title,text,site,date,category,class,url
The many problems with Trump’s Gaza plan,"President Donald Trump is standing firm on his plan to relocate “permanently” more than 2.1 million Palestinians who live in the Gaza Strip to neighboring countries. Trump said the United States would take ownership of Gaza and redevelop the territory to serve as prized real estate on the Mediterranean Sea. Trump told Fox News’s Bret Baier that those living in Gaza would not be allowed to return. Some commentators say the president should not be taken literally. They argue that Trump is attempting to secure greater regional efforts to support Gaza’s postwar development. That by dangling a deeply unpopular idea of displacing the Palestinians out of Gaza, America’s Middle Eastern partners will have to offer better alternatives. What these arguments fail to recognize, however, is that Trump’s rhetoric complicates rather than encourages greater regional support for efforts to stabilize Gaza and secure Israel. As a primary case in point, Saudi Arabia has already made clear that the potential for a peace agreement with Israel is being greatly undermined by Trump’s proposal. And while it’s true that Saudi Crown Prince Mohammed bin Salman has other priorities than the plight of the Palestinians, his supplication to a forcible relocation is a nonstarter. It would fundamentally undermine the crown prince’s key priority of establishing himself and Saudi Arabia as the rising global power of modern Islamic leadership. Similarly, while Jordan is heavily reliant on U.S. aid, King Abdullah II would risk imploding his rule were he to tolerate Trump’s Gaza ownership plan. This would be a disaster for the U.S. both in terms of what might follow Abdullah’s government and what its loss would mean for Washington. The Jordanian GID intelligence service is regarded by U.S. intelligence officers as the most reliable of all Middle Eastern intelligence partners in its service of U.S. security interests. The General Intelligence Department is viewed as more reliable even than the Israeli Mossad, which works to a distinctly Israeli agenda on Middle Eastern issues. This is not a peripheral concern. Alongside the Saudi intelligence services, the GID was instrumental in infiltrating the Islamic State during the heydays of the terrorist group’s 2013-2017 caliphate. This infiltration cost the lives of many GID officers and agents but helped prevent numerous mass casualty attacks in Europe and against American targets. Allies like Jordan are hard earned and deserve American efforts to maintain their stability. This is especially important, bearing in mind the deep Arab affinity for personal honor and trust. Trump’s Gaza plan serves the opposite interest. Trump’s plan is impractical on paper and would cause great damage to U.S. and allied interests in practice. But Trump’s very articulation of his idea is already causing damage to U.S. interests. Even if their regimes are autocratic in nature, the Saudis/Sunni Arab monarchies, Jordanians, and Egyptians now face escalating domestic populist pressures against their alliances with America. Trump is seen to be pushing a nakedly imperialist effort not simply to sidestep Palestinian aspirations but to crush them. Worse, Trump’s “America will own Gaza” and “Palestinians won’t ever be able to return to Gaza” rhetoric is a near pitch-perfect replication of exactly that which jihadist propagandists have long accused American policy in the Middle East of pursuing. Osama bin Laden, Abu Bakr al Baghdadi, and Ayatollah Ali Khamenei might have diverging ideologies and interests. Still, all of them have had great success in mobilizing young Muslim men to their otherwise perverse causes by falsely portraying the U.S. as an evil empire that is determined to dominate Muslim peoples. The crux of their arguments has been supposed American support for Israeli efforts to subjugate the Palestinians. It is for this reason that the overwhelming majority of U.S. counterterrorism specialists strongly oppose Trump’s Gaza rhetoric. While some supporters of the president wish to portray these critics as delusional left-wing activists, their number includes a large number of Joint Special Operations Command and CIA counterterrorism officers who made their careers finding and killing Islamic terrorists without remorse. Put simply, the serious voices opposing Trump’s Gaza plan cannot be characterized as Code Pink morons. Regardless, there’s another glaring problem with Trump’s proposal: Even if the U.S. were able to persuade allies to host Palestinians from Gaza, many Palestinians in Gaza would refuse to leave. A large number of Palestinians would likely even take up arms to defend their homes. Their number would include a great many not affiliated with terrorist organizations. This bears note in light of Trump’s incomprehensible argument that the U.S. military would not be required to secure Gaza. The natural implication is thus either that the Israel Defense Forces will forcibly clear Gaza for the U.S. or that Palestinians in Gaza will suddenly somehow collectively decide they want to leave. Neither possibility is credible. The military costs of forcible relocation of Palestinians in Gaza would be very heavy for Israel, entailing street-to-street fighting and clashes with mixed groups of terrorists, armed civilians, and unarmed civilians. The diplomatic impact on Israel would be catastrophic. The moral impact would also be highly problematic for the Israeli psyche. After all, the forcible relocation of an ethnic group from its home would stir traumatic memories of the Jewish people’s darkest days. That leaves the U.S. military option. Would Trump support such an action so utterly at odds with American moral authority and strategic interests? Doesn’t Trump insist he wants to avoid “stupid wars” rather than start them? The heavy weight of evidence against Trump’s plan leads its supporters to make somewhat outlandish claims in support of it. Trump’s first-term ambassador to Israel, David Friedman, claims that Palestinians want to leave Gaza but then implicitly recognizes that many may not want to do so. He then excuses this not-so-insignificant truth by declaring that “from a moral perspective, they have forfeited the right to the land which they have destroyed.” Friedman justifies this argument by pointing out that Palestinians in Gaza elected Hamas in 2006. And while this is true, Hamas has long wielded power through coercion, violence, and bribery. Opposing Hamas in Gaza is a recipe for death. In turn, a vote for Hamas does not justify the forced relocation of 2.1 million people from their homes. Indeed, I would argue that the collective punishment of ethnic cleansing is antithetical to Israeli and American moral values. What I suspect really motivates much of the Israeli-American support on the Right for Trump’s plan is how it would affect the future of Israeli-Palestinian diplomacy — namely, by extinguishing even the longer-term prospect of a two-state solution, which led to the establishment of a Palestinian state. Trump has further fueled the optimism of the anti-diplomacy movement by suggesting that he might soon recognize full Israeli sovereignty over the West Bank, much of which includes Palestinian settlements. But in contrast to the anti-diplomatic movement, I would argue that it is in the U.S. national interest to maintain political space for a two-state solution, which carries with it hardened guardrails against future terrorism against Israel. Yes, Hamas’s Oct. 7, 2023, atrocity and the ensuing Israeli military response means that there is no reasonable prospect of a two-state solution being reached in the short term. But to eradicate even the future possibility of a Palestinian state would be fuel to the jihadist fire. Again, it cannot be emphasized enough how much this conflict serves as a nuts-and-bolts terrorist recruitment tool for young Muslim men. In the same way, only a Palestinian state that provides a sense of dignity alongside opportunities for prosperity will be able to divert young Palestinians and other Muslims away from terrorism. Other moral considerations notwithstanding, that concern is reason enough for why former Presidents Bill Clinton, George W. Bush, Barack Obama, and first-term Donald Trump all attempted to pursue a two-state solution. Trump’s greatest moral impulse is his desire to secure historic peace agreements that break decades, if not centuries, of cycles of war. But the president’s plan to dislocate Palestinians from their home is both immoral and impractical. And it would cause grievous harm to U.S. interests.",Washington Examiner,2025-02-12T18:58:00+00:00,,Commentary,https://www.washingtonexaminer.com/in_focus/3318161/many-problems-trump-gaza-plan/
Trump’s order on transgender procedures is a win for religious liberty,"At every turn, young people are told that if they want to change their God-given gender, they can do so with a snap of their fingers and with sweeping permission from our nation’s highest leaders. But it does not take policy expertise or a medical degree to know that sterilization and puberty-blocking drugs are not authentic medical care. Fortunately, President Donald Trump issued an executive order putting a stop to child mutilation and the confusion that has taken hold of countless hospitals, including private Catholic hospitals once committed to respecting the dignity of every person. His effort should be applauded as an important first step toward protecting young people. FULL LIST OF EXECUTIVE ORDERS, ACTIONS, AND PROCLAMATIONS TRUMP HAS MADE AS PRESIDENT Trump’s executive order is unapologetic. Going forward, it reads, the U.S. government “will not fund, sponsor, promote, assist, or support the so-called ‘transition’ of a child from one sex to another, and it will rigorously enforce all laws that prohibit or limit these destructive and life-altering procedures.” It outlines what children and young teenagers frequently experience after attempting to surgically change their physical characteristics. They eventually realize, for example , that “they will never be able to conceive children of their own or nurture their children through breastfeeding” or soon discover that they are “trapped with lifelong medical complications, a losing war with their own bodies, and, tragically, sterilization.” It is a great tragedy of our time that so many young people are being told that these harmful procedures will make their lives better. Trump’s executive order begins to undo countless actions taken by the Biden administration to force-feed reasonable Americans the notion that sex-change surgery is the compassionate way to “treat” people questioning their gender, when the very opposite is true. Trump explicitly calls on HHS to end the Biden administration’s harmful redefinition and application of Section 1557 of the Affordable Care Act. Intent on imposing a destructive gender ideology on the American people, the Biden administration in 2024 amended rules pertaining to Section 1557 to force people of faith to fund abortion and transgender surgeries through their health insurance plans. Section 1557 reinterpreted the definition of “on the basis of sex” to include “gender identity” and “termination of pregnancy.” Revising the act delivered a forceful blow to American Christians, who make up nearly 70 % of the U.S. population, not to mention countless others who disagree with this redefinition. But Biden’s HHS went a step further. In a blatant attack on religious liberty, the administration required religious doctors and other medical professionals to perform gender-transition procedures no matter their own personal beliefs about doing so, while denying them the opportunity to opt out even for religious reasons. The policy from the Biden HHS department forced Catholic hospitals into a difficult choice: either comply with the order or shut down and cut off entire communities from healthcare. As a direct result of the Biden administration’s policies, far too many children have been put through the physical and mental agony caused by gender ideology in places where it should never exist. Nearly 150 Catholic hospitals across the country have given vulnerable children hormone therapy or performed gender-transition surgeries between 2019 and 2023. Out of more than 520 minors who received treatments in these Catholic hospitals, “more than 150 had surgeries to alter their appearances to resemble the opposite sex, while more than 380 children were given puberty blockers or hormone therapies,” according to a recent study from Do No Harm, an organization devoted to keeping politics out of medicine. Catholic hospitals, doctors, and other healthcare providers have no business engaging in any of these activities, which run counter not only to good medicine but the teachings of their faith, too. The United States Conference of Catholic Bishops has affirmed that transgender interventions are opposed to Catholic moral teaching and voted to move forward with updating its guidance for Catholic healthcare institutions, insisting that these institutions must not perform any such interventions. Thanks to the president’s executive order, it is my hope that soon families will once again have access to life-affirming care, free from harmful political agendas that damage or destroy patients’ health and well-being. For now, Trump’s executive order will help Catholic medical institutions — and many others — adhere to the highest standards of authentic medicine as well as Catholic social and moral teachings. Faithful Americans must continue to reject the dangerous, life-altering, and irreversible experiments on children that are happening across our nation in the very institutions that should be protecting them. Let us join hands in setting a high standard of care for every patient that affirms their inherent dignity and worth. Chris Faddis is president of Solidarity HealthShare , a health care sharing ministry guided by the moral teachings of the Catholic Church that negotiates directly with providers to ensure delivery of high-quality and affordable, life-affirming health care for the more than 46,000 members it has served since 2016.",Washington Examiner,2025-02-12T17:00:00+00:00,,Commentary,https://www.washingtonexaminer.com/restoring-america/3317773/trump-transgender-order-win-for-religious-liberty/
Journalists discover the Constitution,"New talking points have gone out, and left-wing journalists and pundits have agreed that claiming the nation is in some sort of “ constitutional crisis ” is the soundest strategy to aid their beloved Democrats in their time of need. You could be forgiven if you believed members of the corporate press are just now discovering the Constitution , considering that they display profound ignorance of the nation’s founding documents at any available opportunity. But the shift in language from “Republicans are Hitler” to “save the founders’ legacy” is likely more malicious than it is mindless. People like the Constitution and the natural rights it safeguards. Journalists understand this, and they are likely hoping their audiences forget the press has led the charge to destroy constitutionality, namely the First and Second amendments, for decades. Unfortunately for the media, the “ crisis ” that keeps them up at night, Elon Musk’s Department of Government Efficiency and its mission to rid the federal government of waste, fraud, and abuse, is also quite popular with the public. The Left’s commitment to perverse ideologies has forced it to defend extremely unpopular positions since losing the 2024 election. As Musk and crew uncover one instance after another of reckless, wasteful misuse of tax dollars, Democrats and journalists find themselves defending positions wildly out of step with the vast majority of people. After the Federal Emergency Management Agency neglected the victims of Hurricane Helene in North Carolina, it was caught red-handed funneling $59 million to New York City to fund luxury hotels for illegal aliens, according to Musk. To date, DOGE has saved taxpayers almost $38 billion, canceling wasteful contracts such as funding for an Anthony Fauci exhibit at the National Institutes of Health museum. (Perhaps the entire NIH museum could be on the chopping block next?) DEI programs have been eliminated across the federal government, and the nefarious, propagandistic work of the U.S. Agency for International Development is being clawed back. The people are just fine with those developments. Adding to the shamelessness of the press’s decision to declare that opposition to the Left is a constitutional crisis is the fact that these same journalists ignored a plethora of wildly unconstitutional acts by the Biden regime. Former President Joe Biden’s repeated attempts to undermine the Constitution via his illegal vote-buying student loan forgiveness scheme were praised by the corporate press, as was his decision to raid the home of his political opponent. Journalists covered up the former president’s senility at every turn until, of course, they couldn’t , and I struggle to think of a constitutional crisis greater than the leader of the free world revealed to be nothing more than a puppet for special interests and his own hard-left, ideology-obsessed staff. Aside from pardoning murderers, terrorists, and almost every member of his family, Biden’s focus in the waning days and hours of his presidency was to attempt to tweet an amendment to the Constitution into existence. Tell me more about the constitutional order, journalists. Congress last declared war in 1942 against Romania, Hungary, and Bulgaria, and despite never declaring war since WWII, the U.S. has fought wars in Korea, Vietnam, Iraq (twice), and Afghanistan and has involved itself in civil wars and conflicts in Syria, Yemen, Somalia, Lebanon, Libya, South Sudan, the Congo, Niger, Kosovo, Bosnia, and Grenada, just to name a few. The Patriot Act allowed unprecedented illegal spying on citizens, and as former President Barack Obama admitted , “We tortured some folks.” However, real crises like these leave journalists with the resting heart rate of an Olympic triathlete. Spare me if I don’t buy the press’s outrage over Musk and the gang’s attempt to get the nation’s fiscal house in order. Brady Leonard ( @bradyleonard ) is a musician, political strategist, and host of The No Gimmicks Podcast.",Washington Examiner,2025-02-12T15:57:23+00:00,,Commentary,https://www.washingtonexaminer.com/opinion/beltway-confidential/3317606/journalists-discover-the-constitution/
Lori Chavez-DeRemer’s pro-union stance makes her a poor choice for labor secretary,"There are only two pathways to greater economic growth: more people working or individuals producing more (or both). The new administration has proposed policies to grow the economy and increase U.S. manufacturing . It wants to get more people working and fewer watching by reducing the number of government employees so bureaucrats can enter the productive economy. It plans to leave minimum wage laws up to the states due to regional differences, so unskilled workers, especially teenagers, aren’t excluded from the labor pool, giving them a chance to gain valuable experience that will allow them to become more productive and command higher wages. More importantly, productivity must increase, something that big labor fights . We no longer pick corn by hand, the Bessemer converter allowed us to replace brittle cast iron with low-cost steel, and computers allow bookkeeping without physical books. In order to create an environment where companies can further innovate, the administration intends to reduce government regulations . Companies will be able to focus on technology and process improvements instead of filling out government forms. What doesn’t jibe with the administration’s policies is former Rep. Lori Chavez-DeRemer’s nomination for labor secretary. Randi Weingarten, president of the American Federation of Teachers, considers her nomination significant because Chavez-DeRemer supports “pro-union” policies such as the ProAct, which would replace secret ballots with a card check , making it easier for union bosses to harass people who don’t want to join a union, and eliminating right-to-work laws that prevent forced union membership. Being pro-union is not the same as being pro-worker. In fact, it is the opposite, which is why union membership has recently hit a record low. Growing up in the Mon Valley of Pittsburgh, I witnessed firsthand the destruction of many of the factories that, during WWII, were part of the arsenal of democracy. There are many factors responsible for the downfall of the U.S. steel industry, but unions resisting innovation are part of it. That is one reason U.S. Steel desperately needs investment today. Yet, although Nippon Steel wants to invest over $1 billion in Pittsburgh steel plants, the union says no — despite many rank-and-file steelworkers wanting it. Today , the longshor emen threaten to shut down the economy if automation is installed at U.S. ports, which are already the least productive in the industrialized world. What’s more, we cannot simply hide behind tariffs. If we cannot compete with the world, we will simply fall behind and become economically backwards. President Donald Trump wants to invigorate the economy and revitalize world-class manufacturing in the U.S., but Chavez-DeRemer’s pro-union stances may not be a good fit. Phillip S. Coles is a professor of practice in supply chain management in the department of decision and technology analytics at Lehigh University’s College of Business.",Washington Examiner,2025-02-12T15:54:51+00:00,,Commentary,https://www.washingtonexaminer.com/restoring-america/faith-freedom-self-reliance/3317637/lori-chavez-deremers-pro-union-stance-makes-her-poor-choice-labor-secretary/
