title,text,site,date,category,class,url
"Trump rides the vibes, for better or worse","After a flurry of activity — the president’s tariff threats and showdowns with Mexico and Canada, his expressions of interest in Greenland , the policy changes obtained by Secretary of State Marco Rubio’s trips to Panama and El Salvador, the release of arrested Americans in Venezuela — it seemed clear that the focus of Donald Trump’s foreign policy would be the Western Hemisphere. And then, just a few days later, as he welcomed Israeli Prime Minister Benjamin Netanyahu as the first head of government to visit the White House, Trump announced that “the United States will take over the Gaza Strip.” This is obviously in tension with Trump’s and many Trump supporters’ opposition to U.S. military actions and “nation building” in the Middle East, and while Greenland is arguably within the Western Hemisphere, Gaza clearly is not. Cleaning up and policing Gaza doesn’t sound like a way for Americans to avoid endless wars and violence, as Trump says he wants. On the other hand, looking for outside-the-box solutions sometimes works. It had been gospel among Middle East specialists that Israel couldn’t achieve diplomatic relations with Arab nations without sanctioning the establishment of a Palestinian state first. But the Abraham Accords that Trump negotiated between Israel and the United Arab Emirates and with Bahrain in 2020 did exactly that. As the Abraham Accords suggested, so Trump’s proposal that the U.S. “take over” Gaza jogs the mind and, as Fox News’s Brit Hume writes , moves people “away from the endless pursuit of a ‘two-state solution,’ which has proved such a dead end.” Maybe in some better direction, though no one, including Trump, seems to have an idea of exactly what. In September 2016, the Pittsburgh-based reporter Salena Zito explained that while “the press takes him literally, but not seriously; his supporters take him seriously, but not literally.” To them, he signals the kind of “make America great again” change he seeks, even where his proposals, as on Gaza, seem ludicrous on their face. Almost 10 years later, economist Tyler Cowen advances a similar explanation. “Trumpian policy,” he argues , “elevates cultural policy above all else.” The cultures of the foreign policy establishment, of great corporations, of public schools, of public health and scientific research — none is in great shape. So whenever “the policy or policy debate pushes culture in what you think is the right direction, just do it.” Assume that “the cultural factors will, over some time horizon, surpass everything else in import.” Don’t worry about other constraints, whether it’s legal, whether it will persist. Much of it probably will. Democrats and journalists hope the courts will put the kibosh on Trump’s initiatives. But at some point, this lawfare runs up against the first words of Article II of the Constitution : “The executive Power shall be vested in a President of the United States of America.” His orders to end diversity, equity, and inclusion programs have the backing of the large majority of people of all ethnicities and hues who oppose racial quotas and preferences — and the text of the Civil Rights Act of 1964. His termination of foreign aid programs that advance widely unpopular cultural stands, the hill Democrats are choosing to die on this week, are likely to stand as well. His threats to impose huge tariffs on Canada and Mexico, while economically ruinous if put into effect, prompted promises of increased border surveillance. His instant and massive retaliation against Colombia’s refusal to accept deported immigrants resulted in immediate surrender there and a preemptive surrender by the Maduro government of Venezuela, whose legitimacy the United States and the European Parliament refuse to recognize . Defense Secretary Pete Hegseth, confirmed by only a 51-50 Senate vote, is reporting that Army recruitment has had its “best recruiting numbers ” in a dozen years in the two months since Trump was elected. A change in the culture resulting from Trump’s abolition of DEI and Hegseth’s emphasis on the “ warrior ethos ”? Not clear, but sort of looks like it. Whether Trump’s tactics and unorthodox policy initiatives will produce his promised peace in Ukraine and deter China from attacking Taiwan is far from certain. Clearly, some of Trump’s executive orders and policy directives are carefully vetted, while others — the Gaza acquisition? — are not. If one of his audacious bluffs gets called, the resulting damage could prove horrifying: Think seriously about the wreckage those 25% tariffs would have inflicted on auto supply chains. On foreign policy, matters of war and peace, damage could be orders of magnitude worse. After two weeks, Trump’s job approval is hovering around 50% , higher than at any point in his first term, but still below that of all other incoming presidents since 1953. But the “vibes,” what John Maynard Keynes would have called “animal spirits,” of the nation seem to have shifted. The death of former President Jimmy Carter last December reminded us that some of his policies — transportation deregulation and a defense buildup — helped produce the accomplishment and morale boost of the 1980s. But in his “malaise” speech — he never actually used the word — he admitted that the nation’s “vibes” were negative. They turned positive under his successor, Ronald Reagan, though he entered office with job approval not much above Trump’s, with positive material consequences for America and the world. Could something like that happen again?",Washington Examiner,2025-02-05T17:47:51+00:00,,Commentary,https://www.washingtonexaminer.com/opinion/columnists/3311520/trump-rides-the-vibes/
Ignore Trump’s Gaza distraction. Focus on Iran,"Israeli Prime Minister Benjamin Netanyahu’s meeting with President Donald Trump , the first post-inaugural White House visit by a foreign leader, could shape the Middle East for generations. Pre-meeting speculation centered on how the leaders would handle the Hamas-Israel war. Stunningly, Trump’s comments just before and then after his meeting with Netanyahu focused on the U.S. taking control of the Gaza Strip while Gaza’s residents are resettled elsewhere in the Middle East. There is little point in commenting seriously on this “idea,” which appears to be entirely Trump’s own. The most important strategic issue in the real Middle East remains Iran’s existential threat to Israel. Tehran’s ayatollahs can only be delighted if the Trump administration expends any time and effort at all on the Gaza idea rather than addressing their nuclear weapons program. Restoring the “maximum pressure” campaign from Trump’s first term is a sound decision, but still only the beginning of an effective strategy. Since Hamas’s barbaric Oct. 7, 2023, attack, Israel, with U.S. assistance, has dealt Iran and its “ring of fire” strategy major blows. Hamas and Hezbollah have been decimated but not destroyed. Iran’s ballistic missile production facilities and its sophisticated, Russian-supplied, S-300 air-defense systems have been all but eliminated. Syria’s Iran-friendly Assad regime has fallen, and its S-300 systems and other military assets have been destroyed. Unfortunately, the Houthis in Yemen, West Bank terrorists, and Iranian-controlled Shia militias in Iraq are only wounded, and not severely. The job is unfinished, but enormous progress has been made to diminish Iran’s overall threat, especially its terrorist surrogates. The existential danger remains: Its nuclear program is essentially intact, with only one location, the Parchin weaponization facility, attacked . Looking ahead, the central issue remains how to destroy Tehran’s nuclear weapons efforts, which threaten not only Israel but also constitute a major proliferation threat to America and the world. Eliminating this menace is Netanyahu’s real top priority, but it should not be solely Jerusalem’s responsibility. The United States is the only country that can stop the proliferation of weapons of mass destruction (chemical and biological as well as nuclear). For America and Israel, there has never been a better time to do just that, using carefully targeted force against Iran’s nuclear arms facilities. Accordingly, Israeli-American objectives should be victory against both Iran’s nuclear and terrorist threats. In World War II, Prime Minister Winston Churchill explained to his countrymen why this was the only acceptable outcome: “victory; victory at all costs, victory in spite of all terror, victory, however long and hard the road may be; for without victory, there is no survival.” The real debate is between those advocating victory and those advocating the Obama-Biden approach: endless negotiations on an elusive deal to return Iran’s government to civilized behavior. There are certainly legitimate questions about the timing of striking Tehran’s nuclear facilities. Most important is reducing Iran’s capacity to retaliate against Israel, friendly Gulf Arab states, and deployed U.S. forces in the region. In Lebanon, Hezbollah likely retains tens of thousands of Iranian-supplied missiles, and Iran itself still has significant numbers of missiles and drones. The clock is running. Tehran is racing to repair the production facilities Israel leveled in October 2024 to replenish its missile stockpiles. Another mutual priority is achieving Israel’s objective of eliminating the political and military capabilities of Hamas and Hezbollah, as Netanyahu stressed yesterday. Although Israel has enjoyed remarkable success in Gaza and Lebanon, the recent Gaza hostage releases were staged to portray Hamas as a viable fighting force, with considerable support among Gaza’s civilians. Yet under former President Joe Biden’s ceasefire deal, which Trump’s pre-inaugural pressure on Netanyahu ironically brought to fruition, Israeli negotiations with Hamas over Gaza’s future are due to start. Yet this is precisely what Netanyahu wanted to avoid and why Biden failed for seven months to close the deal. Just because it is now Trump’s deal does not improve it substantively. Hamas can have no part in any future Gaza, whatever it looks like, nor can Hezbollah have any future in Lebanon. Only by removing these cancers can Gazans and Lebanese have any prospect of normality. And so long as the ayatollahs rule in Tehran, they will do their best to rearm their terrorist proxies, even under “maximum pressure” against Iran. Following their summit, Netanyahu and Trump must demonstrate the resolve to persevere, as Churchill said, however long and hard the road may be. Watch what happens on Iran. John Bolton served as national security adviser to then-President Donald Trump between 2018 and 2019. Between 2005 and 2006, he served as U.S. ambassador to the United Nations .",Washington Examiner,2025-02-05T16:08:03+00:00,,Commentary,https://www.washingtonexaminer.com/opinion/beltway-confidential/3311291/ignore-trumps-gaza-distraction-focus-iran/
How Trump and DOGE should reform the Social Security Administration,"As President Donald Trump and his administration look to reduce wasteful government spending and improve federal government productivity, they can find low-hanging fruit at the Social Security Administration . In particular, the administration should undo Biden-era regulations that unnecessarily bloated spending on welfare and disability benefits. The president, working with the technology experts at Elon Musk’s Department of Government Efficiency, should also push for modernized information technology, including new digital features, to enhance accuracy and speed and help solve the agency’s service crisis. Finally, to reduce administrative costs and better target spending to those most in need, Trump must simplify and modernize the basic regulatory rules for disability programs. The Trump administration and DOGE need to act positively and methodically within the law to serve and protect taxpayers and SSA beneficiaries. To begin with, the Trump administration should roll back the unnecessary expansion of eligibility for, and the level of, welfare disability benefits. The SSA issued these regulations, costing about $20 billion over 10 years, with no analysis of how they would help the most disadvantaged people. Another set of regulations, costing about $30 billion, says that disability claimants need to be evaluated based on only five years of work history – down from the requirement in recent rules of fifteen years. This change ignores clear research evidence showing that workers’ skills from past jobs continue for at least ten years and often longer. Another set of administrative actions, costing about $10 billion, essentially forgives the collection of old overpayments made by SSA to beneficiaries. This gloss-over ignores the root cause of the problem – deficiencies in processing information on earnings, assets, and other items. The Biden administration stated that a major motivation for these changes was to reduce agency costs investigate the ability of disability claimants to work, or to see if they had other available resources of support. The aim was to help the agency at a time when it is failing to serve the public. SSA, however, is still failing to answer the phones promptly and accurately and is struggling to process changes in beneficiary status and condition. Furthermore, the agency has a massive backlog of claims for disability benefits. These changes abandoned the prudent stewardship of taxpayer dollars. By the faulty logic of the Biden administration, SSA could pay out on every disability claim made or forgive every overpayment, solving its backlog and service problems. That approach is easier than addressing the underlying sources of SSA’s failures – manual processes, antiquated technologies, and programming languages that were once cutting edge in the 1960s but now are costly to maintain and difficult to integrate into more efficient technology. Indeed, there are still only a few services that the public can get from SSA entirely online, without needing to call or visit a field office. In addition to modernizing customer-facing IT, SSA needs to simplify and modernize its complex and costly disability program rules. The agency needs to use the new statistical data on occupational requirements in its program rules to adjudicate disability claims and continuing benefits. It cannot continue to rely on information last updated almost 50 years ago. Moreover, the new data must be integrated with a modern view of the labor market, less focused on physical work. In the 21st century, more and more people are employed at older ages, and new types of careers are available to more people of various educational backgrounds. Implementing these new rules through an automated tool would simplify and speed up the program administration and improve the consistency of adjudication. Compared to current vocational rules, some disability claimants would get benefits paid while others would not. The net effect would likely be a significant reduction in government spending, from a more accurate and current read of labor market realities. Other recommended changes include a simplification of the return-to-work rules for when disability benefits are cut off and making greater use of claimant attorneys to provide complete information to the agency when filing a claim for a client instead of relying on the agency to collect the required medical and vocational records. Finally, the agency should consider and publish a full analysis of whether all the many layers of appeals are needed and cost-effective for speed and fairness to claimants and to protect the taxpayer. The Trump administration has the opportunity to make policy changes and to use the DOGE in a productive and positive manner to make long overdue technology changes in how the federal government functions. Efficiency and fiscal responsibility are imperative goals – especially for SSA to protect taxpayers and best serve its beneficiaries. Mark J. Warshawsky is a senior fellow at the American Enterprise Institute who served as the Deputy Commissioner for Retirement and Disability Policy at the Social Security Administration.",Washington Examiner,2025-02-05T14:04:31+00:00,,Commentary,https://www.washingtonexaminer.com/restoring-america/faith-freedom-self-reliance/3311173/how-trump-and-doge-should-reform-social-security-administration/
Universities need more change than neutrality,"Institutional neutrality policies, such as those adopted by Stanford University and the University of Pennsylvania , are good steps for hyperpoliticized universities . They also could prove entirely inconsequential. Each school has published a statement of its own explaining the policy and what it aims to accomplish. Universities taking official positions on sociopolitical events has become commonplace and even expected occurrences. The neutrality policy declares these schools will now refrain from doing so, in an effort instead to support the “creativity and academic freedom” of students and faculty, UPenn officials wrote. They still will issue statements on matters that directly affect the university. The conflict between Israel and Palestinians, for example, no matter how imminent college protesters’ theatrics want to make it appear, does not have any bearing on university functions. It is likely that these student demands were a primary catalyst for the schools’ final movements toward neutrality. The rest of the policy’s reasoning is that an institution cannot possibly represent the views of the diverse communities found on a college campus and that it will enhance future expression of free speech. Members will engage in debate without the burdens of political bias and self-censorship. These are benefits we can all hope eventually will take effect on campuses. As it is, though, the policy will change little of the substance that comes from these universities. Universities house mostly left-wing professors. A certain flavor of messaging and education comes out of these institutions as a result and becomes what is effectively the official position of a given school. Unless they hire more conservative professors, universities will strike no neutrality in their politics. Unfortunately, that sounds a lot like diversity hiring, but discrimination is the name of the game for liberal institutions that strive for balanced representation. Aside from that, encountering professors of varying political persuasions opens up a world of study for students. It only deepens their academic interests, provided professors are committed to a similar level of neutrality in the classroom. For their part, conservative professors have been practicing careful neutrality for years. The learning curve of this policy rests on liberal faculty. Without action that intentionally changes the university environment, high-up institutional policies will end up as passive maintenance for the leftism that already controls the school. Neutrality is a good hope, but it wants pairing with substantive measures.",Washington Examiner,2025-02-05T15:11:14+00:00,,Commentary,https://www.washingtonexaminer.com/opinion/beltway-confidential/3154264/universities-need-more-change-than-neutrality/
Rubio must reverse the Biden administration’s designations of US allies,"One year ago, Marco Rubio and seven other senators penned a letter to then-President Joe Biden expressing concerns over Secretary of State Antony Blinken’s misuse of sanctions in Latin America and the Caribbean. “Since January 2021, the overwhelming majority of public designations made under Section 7031(c) have targeted officials in Latin American and Caribbean governments that have cooperated with the United States on strategic diplomatic and national security interests,” the senators pressed. The senators expressed deep concerns about politicizing the sanction process and seemingly targeting politicians on the Right and ignoring “egregious actions in the region by others.” They urged Biden that the administration “must immediately explain the process and criteria it has used since January 2021 to designate individuals in Latin America and the Caribbean under Section 7031(c).” This may seem like an American, right-wing, or human rights concern. Still, as stated in the letter from the Republican senators, it is not just a U.S. problem and especially not just a concern of Latin America and the Caribbean. Among the eight, Rubio is acting as President Donald Trump’s secretary of state. By expressing concerns over U.S. allies’ designations and demanding the Democratic administration review and reverse them, Rubio has set a clear precedent. He must now uphold it. Enter Sali Berisha, a former president and prime minister of Albania who visited the White House twice in the early ’90s and was received by Republican George H.W. Bush and Democrat Bill Clinton. In 2007, Berisha welcomed the first and only U.S. president to visit Albania, George W. Bush. Berisha was and is a staunch ally of the United States, aligning with American interests on everything from the Middle East to Russia, from NATO expansion to the war on terrorism. Berisha’s fall from grace came in May 2021 when Blinken designated him for “undermining democracy” and “significant corruption.” Ironically, Blinken himself, while a senior adviser to Vice President Biden, lauded Berisha and his government’s anti-corruption efforts. Other U.S. Democrats once felt similarly. In 2012, Secretary of State Hillary Clinton delivered a speech in Albania’s parliament, when Berisha was prime minister, stating that “if one wants to see democracy in motion, one should come to Albania.” Berisha blames billionaire George Soros and his cronies in the U.S. for his designation. Case in point, George’s son Alex Soros has been a mainstay in Albanian and Balkan politics since Prime Minister Edi Rama came to power. Former chief of the FBI’s New York counterintelligence office Charles McGonigal’s involvement in Albanian affairs should not be brushed aside. He was sentenced to 28 months in prison by a Washington, D.C., court for this involvement, accepting bribes from Albanian individuals set in motion by Rama’s office, according to the Justice Department file, and pushing the FBI to open an investigation into Berisha’s right-wing Democratic Party. Now that Rubio is in charge and Blinken is out, will Rubio reverse Blinken’s policies and condemnations of right-wing U.S. allies, not only in Latin America and the Caribbean but also in southeastern Europe? Many in Albania think Rubio will do so. Some point to an interesting reason: Being a descendant of anti-communist Cuban immigrants, he knows what communism is. Albania and his grandparents’ country have one thing in common: having suffered dearly under the communist joke. Berisha’s designation is nothing less than a new international Left trying to expunge its right-wing rivals. Alfred Lela is a U.S. citizen and director of press and communication for Albania’s right-wing Democratic Party.",Washington Examiner,2025-02-05T11:00:00+00:00,,Commentary,https://www.washingtonexaminer.com/op-eds/3311024/rubio-must-reverse-the-biden-administrations-designations-of-us-allies/
