title,text,site,date,category,class,url
The Trump-endorsed blueprint to make America great again,"The House Budget Committee has taken a decisive first step in advancing President Donald Trump's ""America First"" agenda. By pursuing the 2025 budget resolution, we have launched one of the most conservative pieces of legislation in modern history and possibly the last chance to fix the broken transfer payment programs, root out the massive waste and fraud in the federal government, and right the fiscal ship before it hits the sand. This resolution is a battle plan to reverse the reckless spending spree of the Biden-Harris administration and return to foundational principles of economic freedom and fiscal responsibility that gave birth to the most powerful, prosperous, and generous nation in the history of the world. The resolution directs congressional committees to draft legislation that will: Bend the curve on mandatory spending that is driving our unsustainable debt. Lock in tax cuts for hardworking families and small businesses crushed by a cost-of-living crisis and rising healthcare costs. Open up domestic energy production and drive costs down for consumers. Release the regulatory stranglehold that is choking our job creators and compromising economic freedom. Bolster investment in a secure border and a strong defense. In short, this budget resolution is the key to unlocking American prosperity and security for the next decade and beyond. A cornerstone of this plan is the extension of the 2017 Trump tax cuts plus new provisions for hardworking people and eliminating taxes on tips. Failure to act will trigger a 22% tax hike on the average taxpayer; that's nearly a $1,700 tax increase on a family of four making the median income in the United States. Our budget blueprint also confronts two of the greatest threats to American prosperity: excessive regulation and out-of-control deficit spending. By avoiding tax increases, slashing regulations, and reining in government bloat and debt, we will supercharge the economy, benefiting every family and worker. The Congressional Budget Office projects that stabilizing the debt by reducing spending would create even greater economic velocity than tax cuts, boosting gross domestic product by a tenth of a percent. Faster growth is essential to counter the exponential increase in cumulative debt and the snowballing interest expenses to service it. This bleak fiscal outlook is a big reason for CBO's projection of just 1.8% in gross domestic product growth in the coming years. With the right economic policies and some spending restraint, we know America can do much better. Despite inheriting former President Barack Obama's sluggish 1.8% annual growth rate, during Trump's first term in office, excluding the year of the COVID pandemic, the United States saw 2.7% average growth. And since World War II, America has experienced an average GDP growth of 3.1%. Our budget includes a reasonable 2.6% annual growth assumption, a benchmark the Trump economy will undoubtedly exceed. Achieving this level of growth will reduce the deficit by over two and a half trillion dollars. Economic growth alone, however, cannot avert the looming fiscal crisis ahead. People recognize that wartime-level indebtedness of $36 trillion, pandemic-level deficits exceeding $2 trillion, and annual interest payments on the debt surpassing the total spent on national defense will take more than pro-growth policies to resolve. What is the single largest driver of this crisis, dollar for dollar? Automatic, unchecked mandatory spending -- expenditures Congress does not vote on annually and rarely even reviews. Our plan mandates at least $1.5 trillion in savings from these programs over the next decade, with a goal of saving even more. Much of the spending in these programs is lost to waste, fraud, and improper payments -- projected to be an astonishing $2.7 trillion over the next decade. Democrats are trying to scare the nation by casting aspersions on the Department of Government Efficiency as if the boogeyman is coming for obligated benefits. In reality, DOGE is uncovering fraud and outrageous theft occurring with hard-earned taxpayer dollars, which if not stopped, will jeopardize those whom these programs are intended to help. Our plan empowers congressional committees to implement DOGE's recommendations, ensuring that U.S. tax dollars are spent responsibly -- and that the people's government works efficiently and effectively. If we fail to meet this moment, we risk a full-scale sovereign debt crisis. As debt and interest payments soar, investors, both foreign and domestic, are demanding higher and higher returns before extending any more credit to the U.S. government. Higher interest rates mean ballooning debt service costs, trapping us in a vicious cycle of economic and fiscal decline. Think of it like a homeowner with an adjustable-rate mortgage whose crushing payments keep rising. Eventually, the burden becomes unsustainable, and the homeowner loses everything. America cannot afford to walk down this path any longer. The 2025 budget resolution is more than numbers on a ledger; it is a blueprint for restoring America's security, prosperity, and global leadership. It repudiates the failed Biden-Harris agenda of radical drift and decline and charts a bold course to reclaim the American dream: To preserve the land of liberty and opportunity by reining in the destructive cycle of taxing, borrowing, spending, and regulating that is crushing the American spirit. HAS DOGE REALLY SAVED $55 BILLION? Every generation to come before us has inherently understood their moral obligation not to leave the next generation, as George Washington described in his farewell address, with ""a burden which we ourselves ought to bear."" Every generation stepped up, sacrificed, and exercised the courage needed to fight for the future of our children and grandchildren. Now, it's our turn, and the stakes have never been higher. If we fail, we will be the first generation to leave our country worse off than we found it. If we succeed, under Trump's leadership, we will secure American global dominance for generations to come. Jodey Arrington represents Texas's 19th Congressional District in the U.S. House of Representatives.",Washington Examiner,2025-02-25T11:00:00+00:00,,Commentary,https://www.washingtonexaminer.com/restoring-america/faith-freedom-self-reliance/3329035/trump-endorsed-blueprint-make-america-great-again/
Vance’s trip shows confidence for Gabbard and RFK Jr. confirmations,"Vice President JD Vance is in Europe this week for an AI summit in Paris and a security conference in Munich. Amid looming confirmation votes for Tulsi Gabbard and Robert F. Kennedy Jr., this may seem like a poor time for Vance, who would be required to cast a tiebreaking vote in the Senate, to travel out of the country. Gabbard, President Donald Trump's nominee for director of national intelligence, is set for a full Senate vote Tuesday. Kennedy, Trump's nominee for secretary of health and human services, will undergo a Senate cloture vote as soon as Gabbard's vote finishes. Vance has already had to rescue one of Trump's nominees, casting the tiebreaking vote for Defense Secretary Pete Hegseth after three Republicans broke ranks. Indeed, both Gabbard's and Kennedy's committee votes passed along party lines, indicating close upcoming votes in the Senate. And with Vance in Europe, Gabbard and Kennedy can only afford to lose two Republican votes to ensure confirmation. Gabbard has already cleared one major hurdle on the path to confirmation, passing a Senate cloture vote 52-46 yesterday. Kennedy's fate, however, is more of an unknown. He won over previous skeptics such as Sen. Bill Cassidy (R-LA) during his committee hearings and passed a procedural vote along party lines, suggesting future success. Sen. Susan Collins (R-ME), who voted against the Hegseth confirmation and is seen as a swing vote, also said she would vote for Kennedy. Vance's trip indicates that Trump has likely secured enough Senate votes to confirm both nominees. After the procedural votes for both candidates, there are indications that both will receive the necessary votes for confirmation. The president would be unlikely to send his VP to overseas conferences if there were any doubt in the confirmation votes. Democrats' continued delay regarding the votes also indicates that Gabbard and Kennedy have enough support. If Vance were the key vote in the process, Democrats would likely want to push the vote through before he returns. Vance's sudden visit to Europe may be a source of worry to some, given the weight of Gabbard's and Kennedy's confirmations. The trip, however, reflects an increased confidence that Trump has sufficient Senate votes to confirm both nominees by Wednesday evening.",Washington Examiner,2025-02-11T17:07:08+00:00,,Commentary,https://www.washingtonexaminer.com/opinion/3316603/jd-vance-trip-shows-confidence-tulsi-gabbard-rfk-jr-confirmation/
Getting to Denmark,"Sooner or later, the New York Times catches on to the news. In the case of immigration policy, the news that it has caught up with mass immigration , legal and illegal , from less developed countries is politically toxic. That news was relayed on a Feb. 24 article and thread on X by reporter David Leonhardt, a writer of center-left sympathies and a keen analyst of statistics -- and the human realities to which they are useful clues. ""The left has lost power in the U.S., Germany, Italy and Sweden,"" Leonhardt writes. ""Canada and Australia may be next. And the far right is growing across the west. But there is one European country where the left has won re-election and marginalized the far right: Denmark. Why?"" His answer seems, once you think about it, glaringly obvious. ""Danish progressives listened to working class voters on immigration -- and reduced immigration levels."" It's an answer that is entirely congruent with a psephological observation in JD Vance's much resented (among European elites) Feb. 14 speech at the Munich Security Conference. ""No voter on this continent,"" Vance said, ""went to the ballot box to open the floodgates to millions of unvetted immigrants."" Politicians in Denmark, unlike those in neighboring Sweden and Germany, paid attention to that. Denmark has long been known for its high taxes and generous welfare state, as well as for its democratic norms and opposition to bigotry, as shown by its citizens' ferrying of almost all its Jews to neutral Sweden during the Nazi occupation . In his book The Origins of Political Order , Francis Fukuyama wrote that a nation developing a competent state, the rule of law and public accountability was ""getting to Denmark."" Denmark's national identity goes back a thousand years and it has long ranked high among nations in trust of government and large institutions. And as the political scientist Robert Putnam discovered (but suppressed his finding for years) a large influx of culturally diverse immigrants, as in Los Angeles circa 2000, sharply reduces levels of trust. Which is one reason free market economist Milton Friedman concluded , as Denmark's Social Democrats have, that heavy immigration and a generous welfare state are incompatible. Danes trust that other Danes won't cheat or freeload; about the Muslim immigrants they see across the Kattegat in Sweden, they're not so sure. It's noteworthy that in Munich Vance was careful to say ""no voter on this continent,"" for voters on another continent, North America, voted for opening the floodgates to unvetted immigrants in 2020 and (in Canada) 2021. Joe Biden and the Democrats made no secret that they would undo Donald Trump's relatively effective (after a few rough months) immigration law enforcement. But perhaps many didn't expect that the Biden administration would usher in perhaps five, perhaps seven million illegal immigrants (or that Justin Trudeau would vastly expand Canada's previously successful policy). In retrospect, it seems a clear example of TDS (Trump Derangement Syndrome) or a logical extrapolation for those ""in this house we believe ... no human is illegal"" signs. For many Americans, any restriction on migration evokes memories of their own forebears from eastern and southern Europe who arrived in the Ellis Island years (1892-1914, 1919-24), and especially for those whose ancestors might otherwise have been murdered in the Holocaust. Interestingly, the post-Civil War surge of 30 million immigrants to the North occurred while only about 1 million blacks and 1 million whites moved from South to North. The wounds of the war had not healed, and employers in the booming industrial North who couldn't attract culturally diverse Southerners were willing to hire culturally diverse Italians, Poles and Jews instead. And in those days the people running America's public schools did a crackerjack job of Americanizing their children. Denmark, by the way, contributed some notable immigrants, including William Knudsen who rose to be president of General Motors and then resigned to accept a $1 a year assignment from FDR to get other industrial leaders to make America the arsenal of democracy even before Pearl Harbor. More recently, notable Danish-American politicians have included patriotic Democrats Sen. and Treasury Secretary Lloyd Bentsen and former House Majority Leader Steny Hoyer. Today, it's not plain that the United States or European nations need and can assimilate all the millions they have been coming in, a population disproportionately of unattached, low-skill young men from low-trust Muslim or Latin cultures. Unfortunately, today's public sector institutions here and in Europe seem disproportionately staffed by people who believe that assimilation is oppression. Plainly there is some erosion of trust. The Biden open-border policy has tilted the immigrant flow toward law-breakers and violent young men whose crimes Donald Trump has been highlighting. German voters in recent months have watched as Muslim immigrants stabbed three people to death in Solingen in August, killed six driving a car into a Christmas market in Magdeburg, stabbed a baby and passerby to death in Aschaffenburg in January, and, two days before the Feb. 23 election, stabbed a Spanish tourist at the Holocaust Museum in Berlin. Those crimes pretty much cover the German map, and every region saw gains for the AfD party, despite its roots in Communist East Germany and some of Nazi apologist members. The result was a stinging defeat for Chancellor Olaf Scholz of the Social Democratic party, founded in 1875 (during the reign of Kaiser Wilhelm I, born in 1797), and for the same reasons as the July 2024 defeat, after failing to stop the inflow, of Britain's Conservative party, founded in 1846 (during the reign of Queen Victoria, born in 1819). Both parties have noble heritages of opposing Nazis and prosecuting the Cold War but have been brought low. The Social Democrats won just 19% , their lowest percentage since 1945. Britain's Conservatives, the world's most electorally successful party, won just 24% in July, and in current polling is now running third with 22% . Meanwhile, as voters saw the results of their open-door immigration policy, America's Democrats, the world's oldest political party, saw their nominee's vote total fall 6 million below 2020, while Donald Trump's total was up 3 million . The case against immigration can be overstated. In daily life native-born Americans mix with Latino immigrants and native-born Europeans mix with Muslim immigrants in shopping malls and fast-food restaurants routinely and politely. But mass immigration of culturally diverse people tends to produce economic stress and erode the trust levels. Traditions of assimilation are weak in Europe and weaker in America than during the Ellis Island era. It's difficult to get the balance right between the benefits and detriments of immigration. What voters have been concluding is that European and American elites have botched the job and that their task now should be ""getting to Denmark.""",Washington Examiner,2025-02-26T21:37:59+00:00,,Commentary,https://www.washingtonexaminer.com/opinion/3331432/getting-to-denmark/
Stop the Medicaid provider tax grift,"House Republicans are calling for $1.5 trillion in spending cuts next year. Medicaid , the joint federal-state health plan established in 1965 to provide publicly funded health coverage to the poor and disabled, is reportedly where they'll find much of that money. Eliminating so-called ""provider taxes,"" which allow states to game Medicaid's rules to extract more dollars from the federal government, is a great place for Republican reformers to start. Medicaid is long overdue for paring. In recent years, it has swelled to cover nearly 1 in 5 people. Total Medicaid spending exceeded $870 billion in 2023 alone. States run their own Medicaid programs, but much of the funding comes from the federal government. In fact, states receive at least $1 from Washington for every dollar they devote to Medicaid. States receive a whopping $9 for every $10 they spend covering Obamacare's ""expansion"" population -- able-bodied adults earning up to 138% of the poverty level. Forty states and Washington, D.C., have expanded Medicaid eligibility to able-bodied adults. The federal government's promise to match every dollar a state spends on Medicaid and then some has prompted some states to engage in elaborate fiscal gamesmanship to unlock additional federal money. For example, some states levy taxes on healthcare providers and use the revenue to raise what they'll pay those same providers. Those additional payments attract matching federal funds from the United States government. Both states and providers enjoy a payday. Only the federal government loses out. No wonder Brian Blase of the Paragon Health Institute calls provider taxes a form of money laundering. Provider taxes have grown popular. Every state but Alaska has one . In 2022, provider taxes and other ""gimmicks"" produced over a quarter of state Medicaid funding, according to the Cato Institute -- up from 9% three decades ago. MEDICAID CUTS PUT GOP ON COLLISION COURSE IN RACE TO PASS TRUMP BUDGET California's Medicaid program, dubbed ""Medi-Cal"" in the state, provides a prominent example of the provider tax grift. The Golden State first implemented its provider tax in 2005 . Last year, Gov. Gavin Newsom (D-CA) expanded the tax to generate an estimated $11 billion for his state through the end of fiscal 2026. Limiting provider taxes could save the U.S. $175 billion over 10 years, according to the House Budget Committee. These handouts from the federal government need to end. Sally C. Pipes is president, CEO, and Thomas W. Smith fellow in healthcare policy at the Pacific Research Institute. Her latest book is The World's Medicine Chest: How America Achieved Pharmaceutical Supremacy -- and How to Keep It (Encounter 2025). Follow her on X @sallypipes .",Washington Examiner,2025-02-24T19:01:30+00:00,,Commentary,https://www.washingtonexaminer.com/restoring-america/faith-freedom-self-reliance/3328002/stop-medicaid-provider-tax-grift/
Trump’s Latin America realignment puts America first,"It's simple: if you care about problems such as drugs, crime, and illegal migration, you must care about what's happening in Latin America. But for a long time, the region has taken a backseat in U.S. foreign policy. Until now. For the first time in nearly 50 years, the United States, under the leadership of President Donald Trump, has made Latin America the top priority of U.S. foreign policy. One of the most important signals the administration sent was directing Secretary of State Marco Rubio to make his first international trip to Latin America. There, he successfully negotiated with Panama to curb China's influence over the Panama Canal, leading Panama to rescind its agreement with China's Belt and Road Initiative. He also secured an agreement with El Salvador President Nayib Bukele for the Central American country to receive criminal deportees to alleviate the U.S. system. Trump has also made it clear that he will not allow socialist puppets of Cuba and Venezuela to undermine American security interests. He confronted Colombia's failed socialist president, Gustavo Petro, demanding that Colombia accept two flights of illegal migrants being repatriated from the United States--and Petro paid for it. Trump demonstrated American resolve and embarrassed Petro on the world stage. The administration has also delivered on its promise to use tariffs to ensure fair treatment from other nations in the Western Hemisphere. After threatening a 25% tariff on Mexican imports, Trump forced Mexico's socialist president, Claudia Sheinbaum, to deploy Mexican national guard troops to our southern border to curb the flow of fentanyl. These things matter because they have an impact on the everyday life of Americans -- and what a great thing that Trump knows and understands that. The actions our partners in the western hemisphere take, or the actions they don't, directly correlate to gang violence in our communities, such as Tren de Aragua members wreaking havoc in Colorado. It goes hand-in-hand with violent criminals who should never have been here taking the lives of our loved ones, heartbreaking scenarios that are very real to people such as Laken Riley's family. It's tied to the kitchen table, where an empty seat marks the loss of a loved one to an entirely preventable fentanyl-related death. Trump promised the people he would address the root causes of migration, drug flows, and illegal migration. Promises made, promises kept. This has been the core motto of the administration's foreign policy toward Latin America--and it's a motto well-earned. The first 100 days of any presidency set the tone for the entire term. We didn't need even a month to see Trump assert that this hemisphere is our sphere of influence and we will not allow our adversaries to take it from us. Not now, not ever. As Chairwoman of the Western Hemisphere Subcommittee, I am working alongside the president to strengthen relationships with our Latin American partners, establish common ground for mutual benefit with countries that may be skeptical of the U.S., and dismantle the destructive influence of our enemies in the region. To our allies across the hemisphere--from the courageous democratic movement in Venezuela to the Christians in Nicaragua resisting the regime of Daniel Ortega to the brave freedom fighters confronting the repressive apparatus of the Castro/Diaz-Canel dictatorship in Cuba --know this: the United States stands by your side. We are fighting for you and doing the hard work necessary to create the conditions for freedom and democracy to flourish. To those who stand in the way of freedom, who aid and abet cartels, terrorists, and human traffickers, or who ally with China, Russia, and Iran, know this: your days are numbered. A golden age in America will lead to a golden age for the world. No matter what, liberty and prosperity will prevail. Maria Salazar is a Republican who represents Florida's 27th congressional District in the U.S. House of Representatives. She is the Chairwoman of the House Foreign Affairs Western Hemisphere Subcommittee",Washington Examiner,2025-02-17T11:00:00+00:00,,Commentary,https://www.washingtonexaminer.com/restoring-america/courage-strength-optimism/3321134/trump-latin-america-realignment-puts-america-first/
