title,text,site,date,category,class,url
Defunding the teacher trainers,"Earlier this month, the U.S. Department of Education eliminated two major teacher-training programs: the $70 million -a-year Teacher Quality Partnerships program and the $80 million -a-year Supporting Effective Educator Development grants. This is terrific news, not just for the budgetary savings but because it strikes an emphatic blow at training that has promoted dubious dogmas and politicized classrooms. The move was met with predictable outrage in the nation's schools of education and the ranks of left-leaning education associations. But it was a welcome and overdue correction, one that deserves to be celebrated. The Department of Education noted that many of the teacher preparation and training programs featured social justice activism, a hyper-fixation on race, and recruiting strategies ""implicitly and explicitly based on race."" Grant proposals included programs that instruct teachers to address ""systemic forms of oppression and inequity"" and pressure trainees to use ""abolitionist pedagogies and issues of diversity in classroom management."" Putting an end to federal support for this stuff is a big deal. After all, it's a mistake to blame the nation's teachers for the toxic DEI and gender dogmas that took root in so many schools in recent years. In fact, while I've worked with educators for decades, I've known precious few elementary teachers eager to discuss gender or make children fill out privilege worksheets. In fact, even when diversity, equity, and inclusion were flying high in 2022, most teachers said they opposed teaching ""the idea of critical race theory."" In truth, much of the blame for the toxic agendas that have cropped up in schools should be reserved for the education professors, consultants, and bureaucrats who train (and bully) the nation's teachers. Unlike teachers, who actually live in their communities, know their students, and interact with parents, these academics and consultants run campus trainings or do fly-bys in which they promote their personal agendas and then scoot out of town with a paycheck. While teacher training has long been a subject of concern, a wave of Freedom of Information Act requests in recent years have shone a bright light on the problem. The Loudoun County Public Schools in Virginia hired trainers from ""The Equity Collaborative"" to teach educators that ""independence,"" ""individual achievement,"" ""individual thinking,"" and ""self-expression"" are racist hallmarks of ""white individualism."" Trainers in Seattle taught teachers that we live in a ""race-based white-supremacist society,"" that schools commit ""spirit murder"" against black children, and that white teachers must ""bankrupt [their] privilege in acknowledgment of [their] thieved inheritance."" In Buffalo, New York, trainers designed a curriculum requiring schools to embrace ""Black Lives Matter principles."" Teachers were told to promote ""queer-affirming network[s] where heteronormative thinking no longer exists"" and ""the disruption of Western nuclear family dynamics."" Kindergarten teachers were directed to discuss ""racist police and state-sanctioned violence."" Trainers in Davis, California, taught teachers how to ""decolonize their language and deconstruct that which they've been taught about gender."" In Eau Claire, Wisconsin, teachers were told that ""parents are not entitled to know their kids' [gender] identities."" The trainers who deliver these sessions don't see the practical consequences for students and families. They treat students as abstractions and schools as laboratories. And educators, fearful of being labeled bigots or racists, have been bullied into playing along. It's good news that the Department of Education is going to stop underwriting a lot of this. State officials and local school boards would do well to follow suit. But this rapid-fire approach to eliminating teacher training programs raises questions. Is zeroing out these programs an excessive response? Isn't it more sensible to take a scalpel to the troubling stuff while protecting the useful training? Here's the thing: There's hardly any evidence that teacher training actually improves teaching. A massive 2014 meta-analysis by the federal Institute of Education Sciences, for instance, evaluated 643 studies of professional development in K-12 math instruction. Of those, only 32 even asked whether professional development caused student improvement, and just two found evidence of positive, reliable results. TRUMP ADMINISTRATION LAUNCHES INVESTIGATION INTO MAINE AFTER HEATED EXCHANGE WITH GOVERNOR Linda Darling-Hammond, former president of the American Education Research Association, has acknowledged that the ""training [educators] receive is episodic, myopic, and often meaningless."" As the Brookings Institution's Tom Loveless has politely put it , ""In a nutshell, the scientific basis for PD is extremely weak."" Instead of spending resources on useless training programs, schools should focus on making sure that teachers know the substance of what they're going to teach and then give them practical support at tasks such as curricular planning and classroom management. Meanwhile, the billions spent on teacher training could be put to better use. The funds could be targeted to provide big pay bumps for educators who do exceptional work, teach high-need subjects, or mentor young colleagues. Ultimately, defunding teacher training isn't much of a trade-off after all. Frederick M. Hess is director of education policy studies at the American Enterprise Institute.",Washington Examiner,2025-02-25T12:00:00+00:00,,Commentary,https://www.washingtonexaminer.com/restoring-america/equality-not-elitism/3328504/defunding-teacher-trainers/
Connecticut thinks 12 years is enough for murder and cannibalism,"The lax attitude toward crime in blue states hasn't faded even as the country has shifted away from the crime-tolerant attitude of 2020 progressives. This means blue states are still putting residents at risk from dangerous people. Connecticut just released a man who killed someone with a hatchet and ate part of the victim's brain and an eyeball. That man, Tyree Smith, was found not guilty by reason of insanity due to schizophrenia and alcohol and drug disorders. In 2013, he was ordered to be confined for 60 years to the state's only maximum-security psychiatric hospital, which seems reasonable enough. Connecticut's Psychiatric Security Review Board has now granted Smith supervised release from the hospital, meaning Smith will be able to return to society just 12 years after he was sentenced for hacking a man to death and taking his body parts to a graveyard for a picnic. The review board had already let Smith spend the last nine months in a community facility. According to its 2023 report , he denied hearing voices, hallucinating, or having homicidal thoughts. According to the report, Smith ""denied experiencing cravings, but stated that if they were to arise, he would reach out to his hospital and community supports and providers."" Evidently, we have no choice but to trust the schizophrenic cannibal ax murderer when he claims he isn't craving human flesh anymore and that he will ""reach out"" if those cravings come back. ARLINGTON MOTHER WARNS 'LOOPHOLE' ALLOWED SEX OFFENDER IN WOMEN'S LOCKER ROOM In 2023, Connecticut legislators considered a bill that would remove the review board and criminal courts from the process of extending the stays for patients. In other words, Connecticut's concern has been that the Psychiatric Security Review Board is too tough when it comes to evaluating patients. Meanwhile, a murderous cannibal is deemed rehabilitated after 12 years. In fact, according to one psychiatrist, ""he is a joy"" and ""a really calming presence for other patients."" Smith likely won't be a calming presence for Connecticut residents as the state grants him more and more freedom. People's lives are worth more than 12 years in a psychiatric hospital, which is why he was sentenced to 60 years in the first place. But Connecticut is a Democratic haven, which means the soft-on-crime mindset of the Democratic Party is allowed to blossom unchecked, no matter how dangerous it is for residents of the state.",Washington Examiner,2025-02-24T19:02:31+00:00,,Commentary,https://www.washingtonexaminer.com/opinion/beltway-confidential/3328309/connecticut-release-tyree-smith-murder-cannibalism/
Could psychiatric institutions solve the mental health crisis?,"At a recent rally, businessman Vivek Ramaswamy stood on an Ohio gubernatorial platform that includes reopening mental institutions. Ramaswamy has said as much before, arguing as he campaigned for president in 2023 that the ""No. 1 psychiatric institution today"" is jail. He echoes the same sentiment now, that ""we are going to bring back the psychiatric institutions that were wrongfully shuttered."" We are also going to see pushback from the Left, but it will conveniently avoid the reality that the ideology has created: Impressions of American mental health are deeply distorted. That reality issues from a youth population condemned to perpetually online life. Young people's mental health has plummeted in the last 15 years, due in large part to social media activity. A combination of screen time, sleep deprivation, content exposure, and negative relational effects is one explanation from only a few likely factors. The boom of smartphone technology caught most parents unawares -- but now, as conservatives push to regulate the internet, left-leaning advocates obscure morality and dismiss parents. Social media and its counterparts contribute to the prevalence of depression, anxiety, and other behavioral disorders. Today, it keeps them more relatable than ever. Mental illness is as ubiquitous as researchers tell us, and knowledge of that fact is unavoidable for a young person who scrolls through the countless TikTok and Instagram posts voicing personal experience. The pattern makes for a crisis associated with paranoia, but not with the sense of imminence that should accompany it. Most mental illnesses are thus leveled to the noise of social media. Minor, more simply solved conditions are amplified, while debilitating, psychiatric ones -- such as would belong to the realm of the institution -- are reduced to the sphere of online sharing. When people actually come across them in people living on the streets, they do not know what to do: Onlookers either are numb to the spectacle or jarred by its severity. The more ""minor"" conditions certainly can be severe as well. Especially as they manifest themselves in young women, they are some of the worst. However severe, severity is the new normal. Part of that has to do with ubiquity, as explained, but much of it is intentional disillusionment. For years, the Left has turned on an effort to make no one feel bad for being different, even more to make no one know that they are wrong. Gender dysphoria is the premier example of our day. Terrible conditions are even further suppressed, until, again, they are level with normalcy. TRUMP WANTS TO DISMANTLE THE EDUCATION DEPARTMENT. HERE'S HOW IT WOULD WORK Of course, this does not work. Societal unrest springs up in favor of the truth, whether or not its inhabitants aim for it. We see this happen most saliently with the epidemic of disintegrated homeless people , many of whom are severely mentally ill. They can, and should, find solace in the mental institution. Abuse and corruption warranted calls for their shutdown in the first place, but it is ""indefensible"" to claim that they cannot be corrected and used for good. The problem is that the path of reform is increasingly unimaginable to generations who know the institution only as a nonentity. Progressive politickers shout that mental institutions, nursing homes , and the like are mere travesty. They are the same group of people who advocate, with every fiber of their ideology, against the family .",Washington Examiner,2025-02-26T14:44:58+00:00,,Commentary,https://www.washingtonexaminer.com/opinion/3330152/could-psychiatric-institutions-solve-the-mental-health-crisis/
Violent climate action is not free speech,"As the Trump administration pursues a mission to develop America's fossil fuel resources, people must unfortunately brace for the impending countermovements from environmental activists who increasingly deploy destructive tactics to gain attention and spread their message. While the Biden administration was largely friendly to environmental causes, it was not immune to disruptive and confrontational protests against its officials. Protesters chanting ""Petro Pete"" chased former Transportation Secretary Pete Buttigieg offstage at a Maryland policy forum in 2023. Roughly 100 activists attempted to blockade former President Joe Biden's Department of Energy last December. Biden even found himself interrupted by a climate protester during a speech honoring the late Sen. John McCain. If this is how the environmental movement treats its friends, one can only imagine the lengths it will go against President Donald Trump, who has vowed to ""drill, baby, drill."" People should be concerned because environmental activists aren't just protesting. They are vandalizing works of art and culture. In the past year alone, they have put adhesive stickers on a Monet painting, thrown tomato soup on the works of Van Gogh and the Mona Lisa , and sprayed orange paint on Stonehenge. Protesters are also actively interfering with commerce, upending the lives of ordinary citizens. Last May, climate activists glued themselves to the runway of a busy German airport, leading to flight cancellations and delays. In April, protesters blocked traffic during rush hour in Boston, a tactic they had previously employed over multiple days in Washington, D.C., provoking angry responses from commuters unable to get to work. If the day-to-day concerns of the working class don't resonate with these environmental protesters, perhaps it's because so few of them come from it. A recent Brookings Institution paper found that the most radical flank of environmentalists are overwhelmingly white (93%), middle-aged (average age of 52), and highly educated, with 91% having completed college and one-third having an advanced degree. These highly educated, what they would deem ""privileged,"" groups care far more about the opinions of wealthy progressive groups such as the Carnegie Foundation for International Peace, which keeps a global tracker of climate protests and their outcomes. They are also cheered on by bureaucrats at the United Nations, who issued a report calling for countries to listen to these disruptive protesters rather than enforce the multiple laws they are breaking. This is just one of many issues the United Nations gets wrong. When environmental protesters break the law, they should be prosecuted just like any other people. To do otherwise sends a dangerous message that their cause puts them above the law. An impending court case in North Dakota could help deliver that message. In 2016, Greenpeace helped organize and sustain ""protests"" against a lawful pipeline project in the state. The Greenpeace-backed protesters destroyed property, set fires, and engaged in violent riots. The broader movement also targeted banks and financial institutions thought to be financing the project. In one case, a Denver bank had its windows smashed and was graffitied with anti-pipeline rhetoric. Ultimately, after protests turned violent, six banks pulled their financing for the project. While the pipeline was ultimately built, a University of Colorado study found that the environmental terrorism campaign cost the energy company and its partners constructing the pipeline an estimated $7.5 billion. The company is now suing Greenpeace, alleging the group helped organize and fund the costly and damaging demonstrations. The First Amendment protects the right to free speech and protest, but it does not give organizations or individuals the right to engage in violence and destruction. When laws are broken and property is destroyed, there must be consequences. ""Climate action"" is not a defense to illegal action. As the Trump administration delivers on its energy development promises, outraged radical environmental activists deserve to have their say. But while protecting their rights, the justice system must also protect the rights of the rest of society by holding accountable any activists, as well as their Big Green backers, who go beyond vitriol and engage in vandalism and violence to bully those with whom they disagree. The decisions made in the North Dakota case will set the tone for whether, in the future, activist groups are permitted to fund and perpetuate crimes when their arguments fail to persuade the majority. Jeff Stier is a senior fellow at the Consumer Choice Center .",Washington Examiner,2025-02-04T11:00:00+00:00,,Commentary,https://www.washingtonexaminer.com/restoring-america/fairness-justice/3309410/violent-climate-action-not-free-speech/
Racial lawlessness and Ronald Reagan National Airport,"The tragic aircraft collision at Ronald Reagan Washington National Airport on Jan. 29 was personally devastating. Not because I knew any of the 67 souls lost that night or the first responders but because of the senselessness of it and the painful conclusion that it was predictable and preventable. I believe that because of efforts I undertook nearly 10 years earlier. In early 2015, former Fox Business reporter Adam Shapiro uncovered, in a three-part expose , former President Barack Obama's plan "" to transform the Federal Aviation Administration into a more diverse and inclusive workplace that reflects, understands, and relates to the diverse customers we serve ,"" by selecting air traffic controllers based on race. I was horrified, not only because of my concern for the safety of 2.9 million passengers aboard 45,000 daily flights across some 29 million square miles of airspace but also because, 20 years earlier, my Colorado client prevailed before the Supreme Court in a landmark ruling that barred the federal government from making race-based decisions. Using Shapiro's articles, which named brave, whistleblowing, and passed-over would-be ATCs, I reached out to disappointed young Americans, many seeking to fulfill a life-long dream. In the process, I encountered an Arizona lawyer, a former ATC, who was doing the same. Over a lengthy meal in Phoenix, Michael Pearson briefed me on the workings of the FAA, the calamity that was Obama's plan to racialize one of the country's most demanding jobs, and the likely catastrophe if an unqualified diversity hire got through 12-16 weeks of training and manned a microphone in a busy control tower. We decided to team up, represent clients discriminated against by the FAA, and file a federal lawsuit. Our client was Andrew Brigida, who was born and raised in Mahopac, New York. Later, his family moved to Arizona, where he attended Arizona State University. He enrolled as an ATC major. In May 2013, he earned two aviation-related Bachelor of Science degrees and took the demanding, eight-hour computer-based Air Traffic Selection and Training exam. He scored 100%. ASU sent his name to the FAA with a recommendation that he be hired. Thanks to Obama's diversity program, Brigida and 2,000 to 3,000 other highly qualified applicants were rejected. On Dec. 30, 2015, I appeared with Brigida on After the Bell , hosted by David Asman on Fox Business , to announce the filing of our lawsuit in federal district court in Arizona. To my knowledge, our Fox Business appearance was the filing's only national news. The next week, my op-ed on it appeared in the New York Post . In August 2016, after Congress failed to kill Obama's plan, I wrote of the matter for Fox News . After that, other than an appearance by Pearson on Tucker Carlson, news of what Obama was doing to the FAA, the repercussions for traveling Americans, and the response of those whose civil rights were violated disappeared. Meanwhile, the lawsuit continued through the federal courts. Dismissed in an Arizona federal district court, it was reinstated in the District of Columbia, where it survived efforts by deep state attorneys to have it dismissed as it progressed through lengthy discovery and motions practice. On Feb. 1, 2022, long after I withdrew as Brigida's counsel and joined the Trump administration, Pearson and his co-counsels prevailed. The district court certified Brigida's lawsuit for class action status for as many as 1,000 "" non-African American[s] "" rejected by the FAA. All this passed unnoticed by the national media. That changed on Jan. 30. President Donald Trump was courageously the first to mention what was on the minds of those who knew about Obama's plan and the lawsuit: DEI . After opening with a moment of silence and prayer for those lost and noting, ""It's all under investigation,"" Trump said, in response to a question about his reasoning, ""I have common sense."" Days later, Vice President JD Vance and Transportation Secretary Sean Duffy echoed him . WHAT TO KNOW ABOUT THE SUIT AGAINST THE FAA'S DEI POLICIES Although the investigation continues, knowledgeable observers believe a decade-plus of the FAA lowering hiring standards, easing testing requirements, and overlooking unsatisfactory performance in pursuit of ""a more diverse and inclusive workplace"" has cost the nation dearly. Whether it contributed to the DCA crash is unknown, but the dangers posed and the risks raised by recruiting, hiring, and retaining people unqualified to be ATCs are too great to continue. William Perry Pendley, a Wyoming attorney and Colorado-based public-interest lawyer for three decades with victories at the Supreme Court, served in the Reagan administration and led the Bureau of Land Management for President Donald Trump.",Washington Examiner,2025-02-27T11:00:00+00:00,,Commentary,https://www.washingtonexaminer.com/opinion/3330606/racial-lawlessness-ronald-reagan-national-airport/
