title,text,site,date,category,class,url
Trump is right on birthright citizenship,"At the heart of the legal debate over President Donald Trump’s executive order on birthright citizenship is the interpretation of the 14th Amendment’s citizenship clause. While there are numerous practical hurdles to eliminating birthright citizenship as it’s been practiced, the president is on solid legal footing. The clause (“All persons born or naturalized in the United States , and subject to the jurisdiction thereof”) should not be interpreted as conferring automatic citizenship to children born of illegal immigrants . Setting aside constitutional interpretation, that just seems like common sense. But not everyone sees it this way, hence the controversy. According to two federal judges who have issued injunctions since the order was issued, the language of the clause should be read at its broadest, which would grant citizenship to any person born within the territorial boundaries of the U.S., regardless of the status of the parents. Proponents of this interpretation point to the Supreme Court case United States v. Wong Kim Ark (1898) in which the court held that a child born within the territorial boundaries of the U.S. to temporary Chinese immigrants was a citizen. But the problems with this interpretation are manifold. For one, it misinterprets the phrase “subject to the jurisdiction thereof” to apply to children born to foreign nationals who are not under full and exclusive allegiance to the U.S. Those who are born in the U.S. to parents who are here on business or vacation should also be denied citizenship on these grounds. While in America, they are subject to the jurisdiction of the U.S. but only in a limited and ephemeral sense. They could not, for example, be drafted into the military. Once they leave, they are not subject to U.S. laws, which is not the case with Americans. There are various ways in which illegal immigrants are not “subject to the jurisdiction thereof” in the same way citizens are. In an op-ed in the Wall Street Journal on Monday, Chuck Cooper and Pete Patterson offered the following scenario: An infant is brought to the U.S. legally, is lawfully naturalized, and serves in the military but cannot run for president — but the child of a foreign tourist born in the U.S. can? The framers of the clause included it to ensure that citizenship would be conferred to the children of slaves who were brought here against their will. It is ludicrous to suggest that people who have traveled here of their own accord and entered the country unlawfully should be granted the same privilege. There are numerous practical hurdles that come with ending birthright citizenship that lawmakers will need to attend to should the Supreme Court eventually decide in Trump’s favor. Some have raised questions about the moral complexities of the move, suggesting that ending birthright citizenship could create an underclass of “stateless” children and result in family separations. It would also worsen the bureaucratic nightmare of our national recordkeeping systems. Lawmakers should do everything possible to mitigate these unintended consequences. But that doesn’t absolve the nation of the responsibility to enact sane immigration policy based on sound legal arguments. Trump’s executive order achieves this, and so it is to be hoped that the courts find this compatible with the Constitution.",Washington Examiner,2025-02-12T05:00:00+00:00,,Commentary,https://www.washingtonexaminer.com/opinion/editorials/3317408/trump-right-on-birthright-citizenship/
The Super Bowl rings in the return of Americana,"“Today we celebrate the urgency of now, the thrill of what’s next, the glory of this game , and we do it as one.” That sentiment is courtesy of Brad Pitt in a soaring prerecorded video on Fox right before the Super Bowl on Sunday night. Only rivaled by Thanksgiving and Christmas , there is no singular event that comes even close to bringing so many of us together — and on a night many of us have to work the next day, no less. A record-breaking 126 million U.S. viewers tuned in to watch the Philadelphia Eagles pummel the Kansas City Chiefs 40-22. And while the game itself wasn’t memorable, outside of the Chiefs finally and deliciously being dethroned, the overall tone and mood of unbridled patriotism was. As a prime example, the Pitt video might as well have been a Trump ad, complete with clips of cowboys riding horseback carrying American flags, firefighters battling wildfires, U.S. Marines raising the flag at Iwo Jima, etc. The message: American greatness only works when we huddle up and work together. Forget patriotism. This was downright jingoistic. Donald Trump himself also became the first president to attend the Super Bowl out of the 59 that have been played. It is unbelievable that not one, from Ronald Reagan to the Bushes to Bill Clinton and Barack Obama, all sports fans, had attended, considering that it is such an easy political win to just show up. There’s nothing but upside to doing so. As you may have heard, Trump received a roaring reception from the crowd when shown on jumbo screens during a tremendous national anthem by Jon Batiste. Contrast that with former Vice President Kamala Harris attending a Los Angeles Lakers game earlier in the week, where the installed 2024 Democratic nominee was barely acknowledged by the fans in her home state. And in what was the ultimate irony, while Trump was applauded in New Orleans, the once-untouchable Taylor Swift was roundly booed moments later. The president, of course, could not let that fact pass without weighing in. “The only one that had a tougher night than the Kansas City Chiefs was Taylor Swift,” Trump trolled on Truth Social. “She got BOOED out of the Stadium. MAGA is very unforgiving!” The culture shift compared to Trump’s first term is nothing short of extraordinary. After his first victory in 2016, Trump voters largely kept their support on mute, especially in the workplace, all out of fear of being ostracized or seeing career prospects going sideways. This time around, the Trump dance is openly being celebrated by everyone from NFL players to LPGA golfers. Corporations, one by one, have been doing away with DEI programs. Hostages are being released by Hamas, a reaction to Trump’s threat of “all hell breaking out” if they continue to stall. Violent gangs of illegal immigrants are being shipped back to their home countries or Guantanamo Bay. And the NCAA announced recently that it would no longer allow biological men to compete against biological women following Trump’s executive order that banned transgender athletes from female competition. The optimism felt during the Super Bowl is reflected in polls that have been exceptional for Trump, especially considering that most of the legacy media has continued its onslaught of unhinged negative coverage of him and his policies, which, after nearly 10 years since announcing his first presidential run, has become beyond tedious and predictable. CBS News has Trump’s approval at 53%, easily his highest ever while occupying the Oval Office. But the crosstabs tell an even rosier story. For example, when voters were asked if Trump was keeping his campaign promises, 70% said yes. What that tells us is that not only are Republicans happy with the president’s dizzying first three weeks of action, but independents and some Democrats are as well. Other highlights: Six-in-10 people support mass deportations for more than just criminals in the country illegally. Nearly two-thirds, 64%, support sending U.S. troops to the U.S.-Mexico border. And here are the four top words that voters would use to describe Trump most: 69% say tough, 63% say energetic — ya think? — 60% say focused, and 58% say effective. This is the Arctic polar opposite of the way former President Joe Biden was described. Voters thought he was old, outdated, elderly, aging, senile, demented, slow, confused, idiotic, ignorant, sleepy, gaffe-prone, and bumbling. Trump’s approval among black and Latino voters also blows away anything we’ve seen from a Republican president in the modern era, with 33% of blacks and 49% of Latinos approving of his performance. If these levels are maintained or even increased, it’s hard to see how Democrats can win any presidential elections moving forward. This is especially true if MAGA-approved JD Vance is the nominee four years from now. Young voters are also giving Trump a big thumbs up, with 55% under 30 approving. This voting bloc, like Latinos and blacks, is supposed to be owned by the Democratic Party. But in another poll from CBS News last month, a whopping 67% of adults aged 18-29 said they are optimistic about Trump’s second term, easily the highest of any age group. And while the president is riding relatively high, Democrats are melting down before our eyes. The confirmation hearings for Trump’s Cabinet nominees were largely a display of cheesy performance art. Their behavior may have driven Republicans on the fence about confirming the more controversial candidates into Trump’s corner. And then there were stunts such as the one led by Rep. Maxine Waters (D-CA) at the Education Department, where the 86-year-old led other House Democratss to attempt to enter the building but were denied by an unarmed security guard with cameras rolling. “What’s your name?” Waters demanded. “Tell us your name. Give me that ID again.” “I’m not giving you the ID,” the guard replied without emotion. “I showed it to you.” “Say what?” Waters asked incredulously. “I showed you the ID,” he replied. “Could you let me see the ID again?” she pressed. “No,” he replied. “Huh?” a flummoxed Waters responded. “No,” he reiterated. And that was it, basically. “The Democrats have lost their minds, and they’ve lost their confidence,” Trump told Senate Republicans at Mar-a-Lago afterward. “They looked foolish today. They tried to break into the Department of Education just because we want to go in and check the books.” As for other opportunities in his second term to play the patriotism card, check out this Triple Crown: The country will celebrate its 250th anniversary in 2026. The U.S. will also host the World Cup the same year. And in 2028, the Olympics return to Los Angeles. Much like attending the Super Bowl, Trump will be front and center for these events while the world looks on. “I’m going to be here for the Olympics and the World Cup,” Trump mused earlier this month. “God works in mysterious ways.” Fixing the economy after Bidenomics crippled it is a top priority, no question. As is fixing the border, improving our horrible test scores in education, drastically cutting government waste, and ending the Russia-Ukraine war. But winning the culture war is also important. It plays to voters’ emotions in a way policy cannot. Over the next four years, Trump has an opportunity to be seen as a beacon of optimism and an embracer of all things Americana. All in contrast to his opponents, who haven’t offered an inspiring vision for America in a long, long time.",Washington Examiner,2025-02-12T01:00:00+00:00,,Commentary,https://www.washingtonexaminer.com/in_focus/3316988/super-bowl-rings-in-return-americana/
The war on plastic straws highlights Democrats’ shoddy ‘science’,"President Donald Trump ‘s executive order ending the federal government’s push to transition to paper straws is a good reminder that environmentally-obsessed Democrats regularly botch “The Science.” This is especially true when it comes to their climate policies. Trump’s executive order naturally earned a response from climate groups such as Oceana, whose “plastics campaign director” warned that “the world is facing a plastic pollution crisis, and we can no longer ignore one of the biggest environmental threats facing our oceans and our planet today.” Plastic straws, we were told, are a massive environmental threat. That’s why multiple Democratic states and cities have banned or restricted them. However, the idea to ban plastic straws stemmed from a study that found that Americans use 500 million plastic straws per day. That “study,” though, was an estimate from a 9-year-old child. It became gospel truth around 2018 among liberal media outlets, politicians in California and Hawaii, and environmental activist groups such as the Sierra Club. In reality, however, the United States is hardly a global player when it comes to plastic pollution. The U.S. is responsible for less than 1% of global mismanaged plastic waste, with plastic straws making up a fraction of that share. China, in comparison, is responsible for more than 20% of global mismanaged plastic waste. Meanwhile, on the straw question specifically, a real study from Belgium found that paper straws have a higher concentration of “forever chemicals” than the plastic straws they are replacing. This is how it so often goes for Democrats trying to “save the planet” with their heavy-handed restrictions. Bans on single-use plastics, including plastic bags, led to New Jersey residents tripling their plastic consumption and using reusable grocery bags that are worse for the environment. California’s fast-approaching ban on gas-powered cars in favor of electric vehicles has several drawbacks for the environment, as does the state’s insistence on banning nuclear energy as part of its carbon-free energy grid. The Democratic Party’s junk science on environmental matters makes the environment worse and life more inconvenient for people. Nothing shows that better than the bizarre panic over plastic straws. It is a statistically insignificant portion of global plastic pollution that rose to prominence based on a “study” from a third grader, which managed to make it all the way to the desk of the president.",Washington Examiner,2025-02-11T23:05:24+00:00,,Commentary,https://www.washingtonexaminer.com/opinion/beltway-confidential/3317019/war-plastic-straws-highlights-democrats-shoddy-science/
A beloved Pennsylvanian returns home from a Russian prison,"BUTLER, Pennsylvania — “He’s coming home, he’s coming home.” Those were the words of Malphine Fogel, the mother of Marc Fogel, a western Pennsylvania teacher who was arrested in Russia in 2021 and sentenced to 14 years in a hard labor camp in 2022. He was imprisoned there until Tuesday, when President Donald Trump ‘s administration secured his release. Sean Parnell, a western Pennsylvania native who was recently named assistant secretary of defense by Trump, recalled being with Malphine Fogel when she met with the president ahead of his July 13 rally in her family’s hometown of Butler. He promised her at the end of the meeting, “We will get your son back.” After earning Trump’s promise, Parnell said Malphine Fogel exited the meeting and joined the crowd dancing to Kid Rock’s “American Badass, “which was pretty awesome to see a 90-year-old woman do.” Mike Kelly, the Butler County Republican congressman who has been a constant in trying to secure Marc Fogel’s release, marveled at his mother’s optimism after her meeting with Trump. “Malphine was given the gift of hope and purpose that day, and she held on to it,” said Kelly, who has known the Fogel family for decades. Kelly praised the Pennsylvania delegation for working together for the family and the upper chamber of the Senate, which in June passed a bipartisan resolution calling for Marc Fogel’s release. Since he graduated from Indiana University of Pennsylvania, Marc Fogel has spent his career teaching the children of American diplomats around the world in places such as Colombia, Malaysia, Oman, Venezuela, and Russia. He was sentenced in 2022 after he was arrested on charges of possessing medical marijuana, which was prescribed by a doctor in the United States for back pain. After missing so much time with his sons, Marc Fogel’s mother filed a lawsuit against then-Secretary of State Antony Blinken last June, saying he failed to designate her son as “wrongfully detained.” That designation finally came in the waning days of the Biden administration on Dec. 26, 2024, when it was moved to the Office of the Special Presidential Envoy for Hostage Affairs within the State Department. Sen. David McCormick (R-PA), who has hosted Malphine Fogel at his home and even sat beside her at the July 13 rally in Butler, said, like the rest of the delegation, Marc Fogel’s release has been a top priority. “It was one of the questions I asked Marco Rubio when he was seeking confirmation as secretary of state and something we have discussed since then,” he said. U.S. Envoy for Hostages Ambassador Adam Boehler posted a photo on X of Marc Fogel in a grey sweatshirt, holding a plate of fruit and cheese, his passport, and what everyone hoped was a stiff drink in his glass. Sen. John Fetterman (PA), a Braddock Democrat, said on X, “Marc Fogel’s return home is long overdue and I know all of Pennsylvania, especially his family will be welcoming him back.” Twenty-two days after being sworn in, Trump kept the promise he made to Malphine Fogel. McCormick said, “Isn’t that something.” Kelly added, “After everything that happened that day, he never forgot. It is providential.”",Washington Examiner,2025-02-11T22:56:20+00:00,,Commentary,https://www.washingtonexaminer.com/opinion/columnists/3317377/beloved-pennsylvanian-returns-home-russian-prison/
Trump can make this a global golden age for religious liberty,"The United States is a beacon for religious freedom . That’s a regrettably rare thing around the world. Pew Research’s 2022 Report on Government Restrictions on Religion showed that restrictions in 198 countries and territories peaked in 2022. President Donald Trump’s second term thus presents a unique opportunity to cement his legacy in championing global religious freedom. “You shouldn’t have to leave your faith at the door of your people’s government, and under President Trump’s leadership, you won’t have to,” Vice President JD Vance said during the International Religious Freedom Summit last week in Washington. Protection of religious freedom was a core tenet of Trump’s first-term foreign policy. In his remarks to the United Nations General Assembly in September 2019, he reaffirmed that “religious freedom is a fundamental right”. His efforts received bipartisan support in Congress. The first Trump administration built on the foundation set by the International Religious Freedom Act of 1998 and launched a series of unprecedented initiatives to support persecuted religious minorities, advocate religious freedom in international forums, and maintain a strong stance against religious persecution in countries such as China and Iran. In 2018, for example, the State Department established the International Religious Freedom Ministerial and held the historic and first Ministerial to Advance Religious Freedom. The event was followed by ministerial meetings held in 2019, 2020, and 2022. These were designed to bring together religious leaders, advocates, and government officials from around the world to discuss and promote religious freedom. They served to elevate the importance of religious freedom on the global stage and reinforce U.S. leadership in defending this fundamental human right. Congress also acted. One of the most prominent bipartisan legislative actions was the passage of the Uyghur Human Rights Policy Act in 2020. This act aimed to address China’s treatment of Uyghur Muslims in its Xinjiang region, including forced labor, surveillance, and mass detentions. The legislation introduced sanctions on Chinese officials responsible for human rights abuses. Also in 2020, the Falun Gong Protection Act was introduced in Congress to highlight concerns over China’s persecution of Falun Gong practitioners. The bill had bipartisan backing, with lawmakers advocating action over the Chinese government’s human rights violations. In addition, several U.S. lawmakers from both political parties have expressed support for Shen Yun Performing Arts. Shen Yun is not just an arts group tied to the Falun Gong. According to its leaders, it is also a living artistic expression of a spiritual and cultural heritage that the Chinese Communist Party seeks to eradicate. Other examples abound. The Iran Human Rights and Hostage-Taking Accountability Act was bipartisan and passed with wide support in 2018. It aimed to hold the Iranian government accountable for human rights abuses, including the persecution of the Baha’i community, religious minorities, and others. In 2019, Congress passed the Elie Wiesel Genocide and Atrocities Prevention Act, which aimed to strengthen U.S. efforts to prevent genocide and other atrocities. The law had broad bipartisan support and was particularly focused on protecting religious and ethnic minorities, including Christians, Yazidis, Sunni minority groups, Shia minority groups, Alawites, Bahai’s, and Jews in areas including Syria, Iraq, and Iran. Building on these remarkable achievements, the new Trump administration could continue to advance global religious freedom and take further steps in supporting religious minorities around the world. The political change in Syria, for instance, requires the U.S. to ensure that minority faith groups — Alawites, Christians, Shiites, and others — finally enjoy religious freedom. In addition, the Trump administration should redouble efforts to protect Christians in North Korea, other religious minorities in Iran, and Christians, Uyghurs, Tibetans, or Buddhists in China. A comprehensive strategy to combat religious persecution and defend religious freedom abroad, ensuring that U.S. foreign aid, diplomacy, and other international efforts prioritize the protection of religious freedoms will advance global peace and stability, strengthen democratic principles, and counter extremism. It will also cement Trump’s legacy of global religious freedom champion. Chris Sacarabany is the executive director of the Foundation for Ethnic Understanding.",Washington Examiner,2025-02-12T11:00:00+00:00,,Commentary,https://www.washingtonexaminer.com/restoring-america/fairness-justice/3317026/trump-global-golden-age-religious-liberty/
