title,text,site,date,category,class,url
Why were hopes of the 1990s dashed?,"As one who shared the hope, after the fall of the Berlin Wall in November 1989, that representative government , guaranteed liberties, and global capitalism laced with some measure of welfare state protections would spread across the globe, I naturally look back over the intervening long generation and ask what went wrong. In the 1990s, it seemed to many that the vision of Francis Fukuyama's The End of History and the Last Man would prevail. Not that bad things would never happen again. Fukuyama's more subtle thesis was that after the debacle of communism, there was no intellectually viable alternative to some combination of political democracy and market capitalism as the means to a decent society. But the past three decades have seen the vitality of politically viable alternatives -- China's dictatorial and Russia's authoritarian state-directed capitalism, the oppressive clerical regimes of Shiite Iran, and various Sunni Muslim states. By Freedom House's sophisticated measures , 2004 saw a high point in global freedom, which has been in decline ever since. How to explain this trend, the opposite of what I hoped for and predicted? As I have reflected on this question, I've fallen back on an article I wrote in 1993 for Irving Kristol's Public Interest , in which I identified four types of political parties. Two were based on European conflicts over religion: Religious parties favored established churches, and liberal parties favored the separation of church and state. Two others, socialist and nationalist, had their beginnings in attempts to rally the masses in the failed European revolutions of 1848, appealing to their working-class interests or their folk national yearnings. Structural features -- the Electoral College, the single-member House and Senate seats -- push American politics into a two-party system in which both are incentivized to amass 50% majorities in what has always been a culturally and economically diverse nation. So, America's political parties, operating in a unique republican framework and under democratic rules that predated Europe's, have partaken of each of these four impulses in varying degrees. In my Public Interest article, I argued that religious parties tend to fade out in nations with no majority faith, liberal parties tend to collapse as their characteristic skepticism leaves them yielding to violent opposition parties, and socialist parties tend to peter out because, at some point, socialism fails to work. Parties that endure, I argued, were, in some major respect, nationalist. American politics over the past 30 years provides some confirmation. The market-respecting liberalism of former President Bill Clinton's Democratic Party yielded to the woke socialism of former Presidents Barack Obama's and Joe Biden's. The religious emphasis and market economics of the Reagan-Bush Republican Party yielded to the demotic nationalism of President Donald Trump's. And Trump won, despite lawfare persecution, a significant and possibly enduring victory over the Democrats' woke socialism last November. My conclusion in 1993 and, tentatively, now is that nationalism is the glue that holds parties and nations together. The republican nationalism of George Washington and Alexander Hamilton, the democratic nationalism of Andrew Jackson and Abraham Lincoln, and the nationalism of the two Roosevelt presidents, who remain vivid figures 116 and 80 years after leaving office. The problem we have encountered over the last 30 years is that other countries' nationalisms are not like America's. It turns out that neither the leaders nor the masses in Muslim nations have much interest in electoral democracy, market capitalism, or the rule of law. It turns out that the leaders of Western Europe, traumatized by the horrifying wars of the first half of the 20th century, seek a transnational harmony that overrules nations' democratic electorates and smothers market capitalism with regulations. In reaction, Britain voted to leave the European Union in 2016, as the formerly (under Tony Blair) liberal Labour Party split into socialist and Scottish National parties and the long-dominant Conservatives into high-education Conservatives and the Trumpish Reform UK party. In the 1990s, there was reason to hope that Russia was moving toward democracy and that China, despite the Tiananmen Square massacre, would move away from repression and toward convergence with rules-based market economies. Instead, Russian President Vladimir Putin grabbed power from the flailing Boris Yeltsin, and Chinese President Xi Jinping jailed one rival and abolished his predecessors' term limits. Putin has been in power for 25 years, almost as long as Joseph Stalin's 29, while Xi has been in power for 13 years, about half as long as Mao Zedong's 27. Putin has been following a nationalist policy that dates back not only to Stalin but also to the czars, expanding Russia's power outward from Muscovy in every direction -- though not as far in Ukraine as he hoped and expected. Xi evidently sees China as its emperors did for 2,000 years, as the greatest nation in the world, unfortunately recovering from a hundred years of humiliation by Western powers and Japan. Something similar has been happening in Mexico. Economic integration with Mexico and replacement of its one-party authoritarian rule by democratic rotation in office and the rule of law was the goal of the North American Free Trade Agreement, pushed in the 1990s by Presidents George H.W. Bush and Clinton and Treasury Secretary Lloyd Bentsen, who grew up on a ranch facing the Lower Rio Grande. NAFTA was ratified, the economies converged, and, as I witnessed, the opposition party ended 71 years of PRI party rule in July 2000. But former Mexican President Andres Manuel Lopez Obrador, elected in 2018, reinstalled one-party rule and government control of the economy, and his handpicked successor, Claudia Sheinbaum, was elected with 61% of the vote. AMLO, as Obrador is universally known, managed to reach accommodations with Trump, and Sheinbaum has as well. But Mexico remains culturally distant, with uncertain property rights and opaque governance despite its geographic proximity. One lesson seems to be that national character matters and that it is more a product of deep-seated history than of recent American policy initiatives. It pops up even when you don't expect it and can't be transformed by paper guarantees. Another lesson is that America, with its unique Constitution, fashioned in 1787 and revised in 1865-70 and, arguably, again in 1937-41, is indeed exceptional -- and that American exceptionalism is a wine that does not travel. A third lesson is that the hopes of the 1990s were not totally dashed. Eighty-five years ago, in 1940, a time when some current leaders, such as Rep. Nancy Pelosi (D-CA) and Sen. Chuck Grassley (R-IA), were living, Adolf Hitler and Stalin were allies in command of or with their allies holding most of the landmass of Eurasia, opposed actively only by Great Britain, whose air force and navy were stretched to the limit. Representative government, guaranteed liberties, and global capitalism laced with some measure of welfare state protections are much better off today than they were then, thanks in large part to the leadership at the time of the British nationalist Winston Churchill, the American nationalist Franklin Roosevelt, and the French nationalist Charles de Gaulle -- something to keep in mind as we bewail our current discontents.",Washington Examiner,2025-02-12T19:43:41+00:00,,Commentary,https://www.washingtonexaminer.com/opinion/columnists/3318333/why-were-hopes-1990s-dashed/
Texas leads in securing the border,"In its coverage of Texas Gov. Greg Abbott's recent trip to the White House, Fox News acknowledged the shift on display. Where the Biden administration threw open our borders, and fought Texas's attempts to enforce the law, the Trump administration is embracing Abbott's actions. Abbott's deputizing the Texas National Guard to help the Border Patrol is just the next logical step. ""It would be hard to find another governor who has done more to support, and help implement and endorse, Trump's hardline border security and immigration agenda,"" Fox News reported ."" Texas, under Abbott's leadership,"" the article continued, ""has spent billions of dollars on border security the past couple of years under Operation Lone Star. And this week, Abbott, in an unprecedented move, gave Texas National Guard soldiers the power to arrest undocumented immigrants in coordination with U.S. Customs and Border Protection."" Of course, Abbott's decision to deputize the National Guard has come under fire from the party of open borders. ""It's likely to lead to harassment and racial profiling of Mexican Americans and other Hispanics in South Texas and the border region,"" claimed Texas Democratic Congressman Joaquin Castro . But here's the reality: The Biden administration's efforts to undermine the rule of law have left the Border Patrol undermanned and underfunded. Abbott's actions are lawful--troops have been used at the border for decades. ""Military forces have been on the border continuously since the establishment of JTF-6 in 1989 to help combat drug smuggling,"" the Center for Strategic and International Studies explains . ""The levels have varied depending on the perceived level of need, the availability of forces, and the politics of immigration but continued in both Republican and Democratic administrations."" What happens next? Some Democratic-run states and cities say they'll remain ""sanctuaries"" for illegal immigrants, including violent criminals. New Jersey Gov. Phil Murphy even claims he is thinking about housing an illegal immigrant in his garage apartment. As he put it, ""good luck to the feds coming in to try to get her."" Not everyone is so recalcitrant. Out in Nevada, Attorney General Aaron Ford, a gubernatorial hopeful, once sponsored legislation to make Nevada a sanctuary state. Now he supports enforcing the law. ""Keeping our communities safe is not a controversial statement,"" Ford told the Las Vegas Review-Journal . ""It is my job, and I intend to do that, and I support policies that do that."" Ford, a Democrat, knows he must change his tune on the border. Not only did President Trump win Nevada by three points, the state now has more registered Republicans than Democrats . What other sanctuary states and cities are missing is that this moment represents a great political sea-change. Trump was very clear about what he was running on, and securing the border was at the top of his list. Voters went for it. Sanctuary states and cities also can't afford the illegal immigration crisis brought about by the Biden administration. Indeed, while President Joe Biden was in office, New York, Chicago, and Denver were all pleading for federal funds to help them pay for their own irresponsible policies. Gov. Abbott has set an example to follow. He has shown how states can come alongside and assist the federal government in enforcing the law. Many states such as Florida, Tennessee, and South Dakota have already sent their own National Guard troops to support Texas. It's time for the others to step up. The Honorable Robert Henneke is the Executive Director and General Counsel at the Texas Public Policy Foundation.",Washington Examiner,2025-02-12T10:00:00+00:00,,Commentary,https://www.washingtonexaminer.com/restoring-america/courage-strength-optimism/3316984/wed-texas-leads-in-securing-the-border/
"Elon Musk, fatherhood, and the Democratic Party","With Elon Musk 's Department of Government Efficiency dominating headlines right now, do voters care that Musk is engaged in yet another custody dispute with one of the many women he has children with? Liberal author Zaid Jilani thinks they could. ""Democrats should make an issue out of how horrible of a dad, husband, and human Elon is,"" Jilani wrote on X. ""If Republicans have abandoned family values they are up there for the taking for someone else."" But does the Democratic Party really have the credibility to make this attack? I don't think so, which is why I wrote in response to Jilani, ""This might be more effective if the Democratic Party believed fathers were necessary or even good."" Some of the responses on X were informative, some were not, and a lot of people wrote something along the lines of , ""Are you seriously suggesting Biden and Obama are worse fathers than Trump?"" which is not what I was arguing at all. Others noted that Obama did promote fatherhood, which is true. Starting with a campaign speech in June 2008, Obama made almost annual speeches on the importance of fatherhood every Father's Day. Obama then followed this up, once elected, with his Fatherhood and Mentoring Initiative with five goals, including promoting and creating positive opportunities for fathers to engage in the intellectual, emotional, and financial well-being of their children; supporting and sustaining stable and healthy environments for children and parents, particularly by strengthening the economic stability of low-income fathers and supporting healthy relationships between parents; strengthening and solidifying relationships among fathers, children, and families early in a child's life; supporting and encouraging disconnected fathers to reconnect with their children and families; and promoting the identification and use of evidence-based practices, as well as fostering high-quality research on fathers and fathering to support policy and program development. These all sound nice, but there is one big word missing from this list: marriage. Indeed, if you go back and read all of Obama's fatherhood speeches, he rarely mentions marriage at all. This is because, since Daniel Patrick Moynihan's 1965 report on the black family , the Democratic Party has been committed to denying the negative effects of the decline of marriage on children. Just look at how Democrats treat this 2013 Centers for Disease Control and Prevention study on fatherly involvement with children. Rep. Frederica Wilson (D-FL) claims the study found that black fathers are ""more involved in their children's lives compared to other racial groups."" New York Times columnists Charles Blow and Kenrya Rankin Naasel make similar claims, with Blow writing that ""black fathers were the most involved with their children daily, on a number of measures, of any other group of fathers -- and in many cases, that was among fathers who didn't live with their children, as well as those who did ."" But that is not what the study found at all. Yes, black fathers who lived with their children were more likely to eat with (78%) or read to (35%) their children than white fathers who lived with their children (74% eat with and 30% read to). Black fathers who did not live with their children also ate with and read to their children more than white fathers who did not live with their children. However, fathers of all races who lived with their children were far more likely to do every activity with their children than fathers who did not live with their children. For example, just 16% of black fathers who did not live with their children played with them every day, compared to 83% of white fathers who did live with their children. As the same CDC report shows, white fathers are simply far more likely to live with their children (81%) than black fathers (58%). This is due almost entirely to the fact that white fathers are far more likely to be married to the mother of their children than black fathers are. One would hope that the Democratic Party would focus on making it easier for young men and women of all races to get and stay married, but instead, Democrats pursue the exact opposite: making it as easy as possible for women to have children without fathers. Just look at the Life of Julia slideshow to promote Obama's 2012 campaign and the Life of Linda slideshow to promote Biden's Build Back Better agenda. In both cases, voters are shown a single woman starting a family by herself with the help of Democratic Party programs. At no point is there ever a father, let alone a husband, pictured. Or take a look at where big Democratic donors such as Melinda Gates spend their money. Gates recently gave millions to help found the American Institute for Boys and Men , which may sound nice until you realize that its founder, Richard Reeves, is committed to promoting ""fatherhood"" as a social institution outside of marriage . ""There is no residency requirement for good fatherhood,"" Reeves writes. ""The relationship is what matters. Fatherhood matters just as much as ever in a world of women's economic independence, but necessarily in a reinvented form."" But this is just plain false. Studies show that the positive behavioral changes associated with fatherhood only occur in residential fathers. More importantly, marriage binds men and women into a long-term project of cooperative care that is absent outside of marriage. If fathers are not bound to the mothers of their children through marriage, what is stopping them from having multiple children with multiple women like Elon Musk does? Nothing. NO, THE AMERICAN FAMILY WAS NOT INVENTED IN THE 1950s This is exactly what is happening, and it is not just with Musk. As I write in my book Sex and the Citizen , ""Of men who father a child outside of marriage, 50 percent of them go on to have a child with another woman. Overall, about 15 percent of men and about 20 percent of women in the United States today have children with more than one partner. The United States is the world leader in this multipartner fertility statistic. No nation has more mothers with children from more than one father than us."" It would be great if we lived in a world where the Democratic Party was committed to promoting the institution of marriage and could credibly attack Musk for fathering children outside of marriage. Unfortunately, we do not live in that world.",Washington Examiner,2025-02-24T22:04:25+00:00,,Commentary,https://www.washingtonexaminer.com/opinion/3328663/elon-musk-fatherhood-democratic-party/
Journalists discover the Constitution,"New talking points have gone out, and left-wing journalists and pundits have agreed that claiming the nation is in some sort of "" constitutional crisis "" is the soundest strategy to aid their beloved Democrats in their time of need. You could be forgiven if you believed members of the corporate press are just now discovering the Constitution , considering that they display profound ignorance of the nation's founding documents at any available opportunity. But the shift in language from ""Republicans are Hitler"" to ""save the founders' legacy"" is likely more malicious than it is mindless. People like the Constitution and the natural rights it safeguards. Journalists understand this, and they are likely hoping their audiences forget the press has led the charge to destroy constitutionality, namely the First and Second amendments, for decades. Unfortunately for the media, the "" crisis "" that keeps them up at night, Elon Musk's Department of Government Efficiency and its mission to rid the federal government of waste, fraud, and abuse, is also quite popular with the public. The Left's commitment to perverse ideologies has forced it to defend extremely unpopular positions since losing the 2024 election. As Musk and crew uncover one instance after another of reckless, wasteful misuse of tax dollars, Democrats and journalists find themselves defending positions wildly out of step with the vast majority of people. After the Federal Emergency Management Agency neglected the victims of Hurricane Helene in North Carolina, it was caught red-handed funneling $59 million to New York City to fund luxury hotels for illegal aliens, according to Musk. To date, DOGE has saved taxpayers almost $38 billion, canceling wasteful contracts such as funding for an Anthony Fauci exhibit at the National Institutes of Health museum. (Perhaps the entire NIH museum could be on the chopping block next?) DEI programs have been eliminated across the federal government, and the nefarious, propagandistic work of the U.S. Agency for International Development is being clawed back. The people are just fine with those developments. Adding to the shamelessness of the press's decision to declare that opposition to the Left is a constitutional crisis is the fact that these same journalists ignored a plethora of wildly unconstitutional acts by the Biden regime. Former President Joe Biden's repeated attempts to undermine the Constitution via his illegal vote-buying student loan forgiveness scheme were praised by the corporate press, as was his decision to raid the home of his political opponent. Journalists covered up the former president's senility at every turn until, of course, they couldn't , and I struggle to think of a constitutional crisis greater than the leader of the free world revealed to be nothing more than a puppet for special interests and his own hard-left, ideology-obsessed staff. Aside from pardoning murderers, terrorists, and almost every member of his family, Biden's focus in the waning days and hours of his presidency was to attempt to tweet an amendment to the Constitution into existence. Tell me more about the constitutional order, journalists. Congress last declared war in 1942 against Romania, Hungary, and Bulgaria, and despite never declaring war since WWII, the U.S. has fought wars in Korea, Vietnam, Iraq (twice), and Afghanistan and has involved itself in civil wars and conflicts in Syria, Yemen, Somalia, Lebanon, Libya, South Sudan, the Congo, Niger, Kosovo, Bosnia, and Grenada, just to name a few. The Patriot Act allowed unprecedented illegal spying on citizens, and as former President Barack Obama admitted , ""We tortured some folks."" However, real crises like these leave journalists with the resting heart rate of an Olympic triathlete. Spare me if I don't buy the press's outrage over Musk and the gang's attempt to get the nation's fiscal house in order. Brady Leonard ( @bradyleonard ) is a musician, political strategist, and host of The No Gimmicks Podcast.",Washington Examiner,2025-02-12T15:57:23+00:00,,Commentary,https://www.washingtonexaminer.com/opinion/beltway-confidential/3317606/journalists-discover-the-constitution/
