title,text,site,date,category,class,url
Beyond Trump v. Zelensky: A New World of Nation States,"People rushed to take sides in the row between U.S. President Donald Trump and Ukrainian President Volodymyr Zelensky. For many in Europe, it allegedly proved that Trump is some sort of cross between a Hitler clone and a Putin puppet. For others, especially in America, it apparently showed that Zelensky is an ingrate dictator unfit to be taken seriously. Never mind for now that neither of those caricatures is true. More importantly, the narrow focus on the personalities of the presidents risks missing the far bigger picture. Because that war of words in the White House was about more than Ukraine's bloody battle with Russia or America's ambitions to mine rare earths in eastern Europe. In dramatic fashion, it signalled the overdue end of the old world order. In tearing up the accepted etiquette of diplomacy on live TV, President Trump also signalled to allies and enemies alike that the established rules and conventions of international relations no longer apply. The question is now, what comes next? For 35 years since the end of the Cold War, we have been assured by Western experts and political elites that the globalist world order had brought the end of history, the end of major international conflicts, and the end of the importance of national sovereignty. Instead, global affairs would be smoothly managed by technocrats in supra-national institutions from the United Nations, International Monetary Fund, and World Health Organisation to the European Union (and especially the European Commission). We were assured that these globalists knew what was best for the rest of us, and that we should sit back and let them run the world. Over the past decade, however, we have witnessed a growing gap between globalist claims and the real world. The old U.S.-led unipolar order has been challenged by the emergence of regional blocs with the rise of China, India, and Russia. And even more importantly, the nation-state has reappeared on the world stage as a central player. There has been an upsurge of insurrectionary national populist parties across Europe and around the globe, a revolt against the globalist elites as people demand that their interests are represented and their voices heard. Trump's shouting match with Zelensky sounded the death knell for a world order that has been dying on its feet anyway. What now? An insightful article in the latest issue of the leading U.S. journal Foreign Affairs, entitled ""The World Trump Wants,"" outlines the future of ""American Power in the New Age of Nationalism"". We are indeed entering an era when nation-states will need to look to their own sovereignty and defence. The trouble is, however, that too many Western leaders today do not believe in the nations they rule over. The globalist elites have spent years telling us that national sovereignty--and by implication, national democracy--is an outdated idea in the modern world. In 2016, shortly after the British people showed what they thought of such globalist notions by voting for Brexit, European Commission President Jean-Claude Juncker even declared that national borders ""are the worst invention ever made by politicians"". In the years since then, Western cultural elites have done all in their power to trash the history of their own nations and civilisation. When Putin's Russia invaded Ukraine three years ago, Europe's leaders suddenly and entirely unconvincingly claimed to have rediscovered the importance of defending national sovereignty. Yet in response to the current crisis, too many of them are still clinging to the wreck of the old supra-national order, with the likes of EU Commission President Ursula Von der Leyen claiming that 'Europe' needs to step up with more centralised defence spending and forces. As national conservative opponents have pointed out, globalist leaders who have shown they are incapable of defending their own national borders are in no position to fight to defend Ukraine's. The elites' bold talk is hollow. Belief in national sovereignty is not something you can turn on and off like a tap. Indeed, behind their empty bravado, the old European elites' true feelings of mistrust for sovereignty and democracy remain deeply ingrained. Thus they see Trump's disruption of their cosy world as a problem of populism. After all, he was elected to do this. Too much democracy! That prejudice is encouraging Europe's old centrist parties to huddle together, trying to form anti-democratic coalition governments in Germany and elsewhere that can keep the insurgent 'far-right' populists at bay. But no paper deals can turn back the tide of historic change. Those group pictures of European statesmen trying to appear determined over Ukraine this week looked (with the exception of Italy's right-wing premier Georgia Meloni) like a funereal shot of dead leaders walking. If we are entering a ""New Age of Nationalism"", we will need national leaders who can inspire their people to stand up for their sovereignty and democracy. This is far more than a question of spending more money on defence. It is about having the political will and determination to give some meaning to patriotism. There is much to be done. The years of woke indoctrination and failed globalist military adventures have taken a heavy toll on a generation; as our columnist Rod Dreher points out, polls across Europe show depressingly high numbers of young people now say they would not fight to defend their nations. Perhaps a genuine crisis might reverse that sentiment, as happened in Israel after the October 7th Islamist pogrom. But who wants to wait for disaster and take that chance? Europe's real hope still lies in the people, many of whom have shown that they have had enough of seeing their traditions and way of life rubbished by rulers who occupy another world. Our job now is to do all we can to advance the national populist revolt. We live in interesting, unstable, and dangerous times. President Trump has shown that all the old easy bets are off. We cannot leave it to failed globalist technocrats to gamble with the future of our sovereignty and democracy.",The European Conservative,2025-03-04T18:26:30,COMMENTARY,Commentary,https://europeanconservative.com/articles/democracy-watch/beyond-trump-v-zelensky-a-new-world-of-nation-states/
Manufacturing Dissent in Eastern Europe: The Power of Foreign State Propaganda,"Eastern Europe has troubles--as do many countries East and West --given the geopolitics of today, but while some are internal, a fair measure of them is not. These externals tend to be driven by powerful political forces seeking to fulfill their own political agendas--and for the latter that''s about control: economic and political. It is beyond doubts that there are forces external to these countries. Slovakian Prime Minister Robert Fico has formally requested that Elon Musk (head of DOGE ) disclose detailed information about American grants allocated to Slovak NGOs and media outlets through USAID , Washington's primary agency for funding political projects abroad. In a letter to DOGE chief Musk--who previously branded USAID a ""criminal organization"" --Fico voiced concerns over what he described as ""gross interference"" in Slovakia's political landscape. ""It is undeniable that funds originating from USAID were also used for political purposes in Slovakia to distort the political system and favor specific political parties,"" Fico wrote in a letter shared on X last Tuesday. He urged Musk to disclose which NGOs, media outlets, and individual journalists had received U.S. funding. Last week, Hungarian Prime Minister Viktor Orban similarly announced that his government would seek full transparency regarding USAID grants to NGOs and media outlets critical of his administration, emphasizing the need to ""eliminate these foreign networks"" that interfere in the country's domestic affairs. In one of his first executive orders after taking office, President Donald Trump suspended all foreign aid ($68.2 billion), pending a review of its alignment with U.S. national interests. Pursuant to these orders, President Trump's administration has frozen all funding to the National Endowment for Democracy (NED) and the USAID. The NED has faced longstanding criticism over its role in supporting political movements to undermine sovereign governments. One example of such suspected undermining is Georgia's case. The Tbilisi government is currently dealing with external forces regarding the recent law just passed requiring media and nongovernmental organizations and other nonprofit groups to register as ""pursuing the interests of a foreign power"" if they receive more than 20% of their funding from abroad. The republic's efforts to adopt its own law on the disclosure of foreign agent funding sources in the country has produced major pushback from the West , even to the point of threats of sanctions. The law, of course, will make ""influence peddling"" through corruption much more difficult for those countries with money to spread around, and that likely would be the West. As Reuters comments, ""Georgian parliament passes 'foreign agent' bill, prompting US anger, new protests."" Romanian politician Calin Georgescu, labeled as ""far right"" by the opposition, came seemingly out of nowhere to secure first place in the first round of the now-annulled presidential elections held on November 24 of last year. Georgescu's lawyer said that the annulment decision was a flagrant violation of the constitution. ""We are in a situation of a coup d'etat."" The decision came amid declassified reports alleging Russian involvement in cyber activities aimed at undermining the integrity of the electoral process. ""What is happening today in Romania, which is completely illegal, could set an extremely dangerous precedent worldwide. I hope that the law will be respected and that there will be no deviations from the will of the Romanian people,"" Calin Georgescu said . The official claim of Russian meddling rested directly and exclusively on a specific set of intelligence documents on the matter, first submitted in a closed National Security Council meeting on 28 November and then hastily declassified on 4 December by the sitting President in order to ""inform"" the Constitutional Court's decision. But the reports contained no actual evidence of the sort. Hillary Clinton, former U.S. secretary of state and presidential candidate, notably popularized the tactic of blaming Russia following her loss to Donald Trump in the 2016 US presidential election--a claim Moscow has consistently denied--and the FBI later admitted was a fraud. Western mainstream political parties continuously blaming Russian meddling for electoral failures are increasingly out of touch with voters, as U.S. Vice President JD Vance has rightly pointed out, criticizing the 'Russian meddling' narrative during his recent visit to Munich.. The truth is that all countries, irrespective of their political theater, attempt to influence voter preferences in other countries through their intelligence apparatus and its NGO and media assets. A fortiori, not every election that does not go the way of the EU ruling elite can be attributed to the machinations of the Kremlin. Clearly, the troubles in the countries of Eastern Europe are not necessarily internal,and certainly, not necessarily of their own making; these states have become a 'battleground' for powerful external forces seeking to exert a measure of control over them. The question is: Can these countries succeed as independent nation-states, given the external economic and political forces which plague their sovereignty? East European nations are at a crossroads in their history. There are either/or choices before them: e Either stay with the status quo of historical inertia or reclaim their identity. To do the former is easy. But to do the latter they must rely on being the courageous people they have always been - and rid themselves of their historical dependency on others.The East Europeans have a choice to make about their identity --about who they are: master of their own consciousness or slave to another's.",The European Conservative,2025-02-28T13:23:59,COMMENTARY,Commentary,https://europeanconservative.com/articles/commentary/east-europe-western-interfering-usaid-eu-georgia-slovakia-hungary-romania/
Notre Dame Reopens: Ancient Glory vs. Modern Disaster,"After five years of hard work, Notre Dame Cathedral in Paris has finally risen from the ashes. A titanic task, which does justice to the extraordinary mobilisation and expertise of the French craftsmen and those who assisted them. But the ceremonies to reopen the building left us with mixed feelings. Speaking as a Frenchwoman, as a Catholic, there are many reasons to rejoice at this achievement. Like millions of people around the world, my heart sank as I watched the magnificent nave being devoured by tongues of fire one evening in April 2019, just a few days before Easter, and then the roof structure giving way with a terrible crash. A strong feeling of irreparable loss gripped us all that evening, to the point where many tears flowed. And yet. Notre-Dame de Paris was the strongest. At the end of an extraordinary construction project, France's most famous cathedral has risen from the ashes. A thousand and one stories, each more moving and powerful than the last, have accompanied its fall and its resurrection. The story of the indifferent fireman who entered the burning building out of duty, only to emerge a believer , touched by grace. That of the firefighters' chaplain who, at the risk of his life, took it upon himself to go and save the Crown of Thorns and the Blessed Sacrament. The carpenters who, as one man, asked for their axes to be blessed before they set about preparing the oaks for the carpentry. There were also breathtaking images, so full of meaning in our grey, mystery-free world. The immortal shot of a ray of sunlight illuminating the altar amidst the rubble. These photos of the restored spire , taken with exaltation by Parisians as it rose once again into the Parisian sky--like the needle of a compass showing them the only direction worth following, that toward Heaven. Render unto Caesar the things that are Caesar's: when many doubted, President Macron believed in it, and put all his authority in the balance (which goes to show that where there's a will, there's a way) to make it possible within these deadlines, at the price, thank God, of a certain number of adjustments of regulations and red tape to work, quickly and well. Confidence and enthusiasm are always there when the objective is noble and exhilarating. He entrusted the project to a worthy man, retired general Jean-Louis Georgelin, who died in 2023, unfortunately without having seen the end of this immense project. There have been enough thunderous failures since Macron took over as head of France for us not to give him a good mark, for once, on the Notre Dame restoration. But the cathedral's rehabilitation has also had its dark side, and the sordid stories are no less numerous than the high points. The ludicrous discussions about the possible transformation of the building, with wild suggestions ranging from an integrated cafe-restaurant to a glass roof-top . The pettiness of the mayor , Anne Hidalgo, who, while not wanting to spend a penny on Notre Dame, has found a way of making the construction site pay a tax. The torrents of hatred that poured down on the wealthy citizens who had generously put their hands in their pockets to finance the work. A quelques jours de la reouverture de Notre-Dame, je n'oublierai jamais qu'alors que les familles Bettencourt-Meyers et Arnault faisaient chacune un don de 200 MEUR, #AnneHidalgo , toute honte bue, exigeait du chantier de restauration une redevance de 25,4 MEUR, avant d'y renoncer... pic.twitter.com/2PEyGhGN40 The questionable choices made, against the wishes of heritage protection associations, such as the removal of the stained glass windows by Viollet-le-Duc in favour of contemporary creations, stubbornly desired by the evil trio formed by Emmanuel Macron, his Minister of Culture Rachida Dati, and Archbishop Msgr. Ulrich. The installation of hopelessly dysfunctional liturgical furnishings , devoid of all grace and meaning. You might think that all that is now behind us, and that the only thing that matters is the reopening of the church and the resumption of worship, effective on the solemnity of the Immaculate Conception, on a beautiful and cold Sunday in December 2025. But the ceremonies held on December 7th and 8th remind us that nothing is won, and that much is irretrievably lost. As a Frenchwoman, as a Catholic, I should be rejoicing, but my heart isn't really in it. The restored Notre Dame is whiter than it has ever been. But with the soot that has been stripped from the stones, the repentance of men and the prayers accumulated within these walls over the centuries have been washed away to create a smooth, uneven face at the image of a hygienic modern world too proud of itself. A little of the soul of Notre Dame has gone. And what about the opening ceremony? With two days to go to celebrate the anniversary of the separation of Church and State, President Macron could not stop himself from speaking inside the cathedral, despite promises to the contrary. And his wife, Brigitte Macron, took communion with the archbishop, even though she lives with a man in a union that is anything but canonical, to say the least--all in a blissful unanimity maintained by a Church in France that no longer really knows where it stands. The official festivities gave rise to gigantic nonsense, providing a formidable factory of memes on social media. The liturgical vestments designed by high-profile fashion designer Jean-Charles de Castelbajac gave the impression that the ceremony was in the colours of Google or Microsoft Office, as the case may be--blithely trampling all over the liturgical calendar in the process. Many people who were not 'traditionalists' noticed this. 'Trad' abbots wearing white lace are to be blamed for their putative non-compliance with the directives of Vatican II, but anything goes for the official clergy, who do what they want, when they want. Vetements des eveques a Notre-Dame de Paris : des reactions aussi vives que les couleurs Avec ses creations comparees au logo de Google Chrome ou aux cartes du Uno, Jean-Charles de Castelbajac en prend plein la chasuble https://t.co/0daPwUOOnH Fr. Clement Barre commented on X : Basically, the problem with this garment, beyond any aesthetic appreciation, is that it escapes the common language of the Catholic liturgy. For a Christian, it does not say what is being celebrated. Instead, it summons up another language, with other references, other meanings... that of the artist, who in effect silences the Church to speak for him. And we are summoned to enter into this new language, which does not belong to us. The ceremony was sadly characterised by the omnipresence of ugliness. In the words of Cyrano de Bergerac's father, the poet Edmond Rostand, ""I thought I saw a long slug slide over a flower."" It is appalling to see the extent to which the modern church strives to present a repulsive image. Let's make the best of it: it's a formidable technique for bringing out the radiant beauty of the past. It would seem that the French have had a problem with opening ceremonies. After the controversy surrounding the Olympic Games, the ceremony at Notre Dame was a huge missed opportunity to speak to the greatest number of people--so much so that the choice of mediocrity and ugliness is never likely to win over the crowds. The public was expected to flock to the building, but a storm blew in from Paris. As a result, many visitors stayed at home. If, like the ancient Romans, we like to read divine will in the signs of the weather, we could say that Heaven was--a little--annoyed at the way things had turned out and wanted to send a reminder. The gaudy colours of the liturgical vestments speak only to a small caste of initiates satisfied that they have paid their dues to the prevailing progressivism. Another example: the musical programme. For a moment, a splendid Magnificat resounded under the vaults. But the 'awakening' ceremony for the organ disconcerted many. Made up of improvisation sequences on the majestic instrument, the vaults resounded with dissonant pieces in the purest vein of twentieth-century music, designed for aesthetes trapped in intellectualism. As amateur organist and editorialist Olivier Babeau humorously put it: ""It's been going on for 50 years. Time doesn't help, it just won't go away. And that's a problem. If music is meant to uplift, it must speak to the senses. For many people, this kind of music is more likely to keep them away from the altar because it's the stuff of pro-virtuoso musicians tired of harmonies."" It would have been so simple to choose something harmonious that would appeal to the humble heart of the man in the street, who has often lost his way in the faith and just wants to be amazed. Too simple. Modernity has forgotten the old Racine adage: ""The main rule is to please and to touch."" The signal had been given from on high, by Pope Francis , who, by refusing to travel to Paris, failed to see what an extraordinary opportunity the reopening of Notre Dame provided to speak to as many people as possible, and who preferred to send a dull message when he could, by his presence, have bowed the knee to a multi-secular reality that is a reference point for millions of people throughout the world. The party is ruined. I would have liked to be there, but the Notre Dame of December 7th is not quite mine. Fortunately, what remains is the inexorable power of those who conceived it, built it and supported it with their prayers. Its immense beauty continues to shine through beneath the garments of gaudy modernity with which it has been dressed. This Notre Dame is still standing, against all odds. I'm going to pay homage to her when the official din has died down. God save France!",The European Conservative,2024-12-09T16:11:18,COMMENTARY,Commentary,https://europeanconservative.com/articles/commentary/notre-dame-reopens-ancient-glory-vs-modern-disaster/
