title,text,site,date,category,class,url
Democrats against democracy,"Democrats are anything but democratic. In the past, their idea of governance was overreach and abuse of power carried through unelected bureaucrats, intimidation attempts by radicalized mobs disguised as protesters, and a weaponized judicial system, especially rogue judges, to impose their will on the public. As a famous quote often attributed to Mark Twain goes, “History doesn’t repeat itself, but it often rhymes.” Once again, the Democratic Party, when thwarted at the ballot box, has turned to judges to impose its will on the public. As many as 10 federal judges have recently ruled against President Donald Trump ‘s proposed budget cuts, spending freezes, transgender policies, and push to end birthright citizenship , as well as access to data by Trump-appointed auditors trying to identify waste, fraud, and abuse. This usurpation of the powers of the executive and legislative branches of government by the judicial branch, ideologically aligned with Democrats, should be considered dangerous, regardless of one’s political affiliation. It is an abuse of authority that the Founding Fathers recognized as a threat to the republic. Ironically, it was Elbridge Gerry — after whom the word “gerrymandering” was created and who was a Massachusetts delegate to the Constitutional Convention of 1787 — who warned about judicial imposition. He voiced his concern about the “sophistry of the judges.” Authors of the Federalist Papers echoed similar sentiments in their writings. The ideas and words of those from the 18th century are applicable in 2025. For example, in Federalist 78 , Alexander Hamilton cautioned that judges might exercise their will instead of their judgment in interpreting laws. He also stressed the importance of judges remaining impartial, noting that the “independent spirit in the judges” was paramount to “a faithful performance of so arduous a duty.” Furthermore, consider Federalist 81 , in which Hamilton discussed the fears and concerns over judicial activism. Hamilton warned that if judges prioritized passion and politics over the law and construed it, then this would enable the judiciary to develop its own rules. “The power of construing the laws according to the SPIRIT of the Constitution, will enable that court to mold them into whatever shape it may think proper; especially as its decisions will not be in any manner subject to the revision or correction of the legislative body,” Hamilton argued . Hamilton’s words proved prescient. Activist courts have become more frequent as judges at the state and federal levels expropriate power assigned to the other two branches of government. Federal judges attempted to usurp executive branch authority in terrorist detainee cases during the Bush administration. They did so again during the first Trump administration when judges opposed Trump’s lawful orders to restrict people coming to the United States from nations where terrorists are active. In each case, judges interceded in nonjusticiable affairs, as was predicted in Federalist 78. Yet, this abuse can be traced back even further. One egregious example was during the last years of the Reagan administration. For example, in 1987, District Judge Russell Clark, an appointee of President Jimmy Carter, ordered a 150% increase in property taxes and a 1.5% income tax to fund a desegregation plan for schools in Kansas City, Missouri. Clark decreed that Missouri was to pay the balance. Since when did the Constitution authorize a judge to order a tax increase? In other instances, judges have overreached their authority in the criminal justice system, issuing rulings related to incarcerated prisoners. For example, in some cities, such activist judges ordered criminals to be released from confinement for no reason other than jails and prisons were, in their opinion, “overcrowded.” Still, other judges have reversed referenda. Judge Thelton Henderson issued an injunction against California’s Proposition 209, which was aimed at dismantling state affirmative-action programs based on sex or race. Californians voted on Proposition 209 in 1996. However, Henderson, also a Carter appointee, thought his opinions were superior to those of the electorate. A 9th U.S. Circuit Court of Appeals panel subsequently overturned Henderson’s ruling. In his majority opinion, Judge Diarmuid O’Scannlain wrote, “A system which permits one judge to block with the stroke of a pen what 4,736,180 state residents voted to enact as law tests the integrity of our constitutional democracy.” O’Scannlain’s sentiments exemplify how the judicial branch should work. He provided an honest and intelligent explanation to which all judges should adhere. Unfortunately, they don’t. If the country allows rogue, activist judges to continue their abuse of power and judicial overreach without any accountability, then we will no longer be a constitutional republic but instead a judiciocracy. It would behoove people of all political parties and ideologies to reject such advances. Moreover, people all along the ideological continuum must remember that the government is “of the people, by the people, for the people” — and not ruled by judges.",Washington Examiner,2025-02-12T15:24:37+00:00,,Commentary,https://www.washingtonexaminer.com/opinion/beltway-confidential/3317675/democrats-activist-judges-against-democracy/
Fort Bragg’s latest name change is pure political appeasement,"The Pentagon has announced it is once again changing the name of one of its largest military bases, Fort Liberty, back to its original name, Fort Bragg, but with a twist. Instead of bearing the name of Confederate General Braxton Bragg, the home of the 82nd Airborne Division and U.S. Army Special Operations Command will now honor Private First Class Roland L. Bragg, a World War II paratrooper who earned the Silver Star for his bravery during the Battle of the Bulge. Let’s be clear: There should never have been a military base named after Braxton Bragg in the first place. Beyond his role as a commander in an armed rebellion against the U.S. government, Bragg is widely regarded as one of the worst generals of the Civil War. His poor leadership and strategic failures were legendary even among his own troops. For this reason alone, the original decision to rename Fort Bragg was commendable. However, in typical fashion, the Biden administration chose the uninspired and overly generic “Fort Liberty,” a safe, watered-down option seemingly designed to appease a segment of the Left that finds offense in just about everything. Now, by rebranding Fort Bragg to honor a little-known WWII soldier, the Trump administration can claim to be restoring history erased by the Left’s insatiable appetite for faux outrage — all while sidestepping the awkwardness of celebrating a Confederate general who was both a notorious slave owner and an incompetent military leader. Yet, in doing so, it has fallen into the same trap of opting for political appeasement rather than seizing the opportunity to honor a genuinely deserving American hero: General James M. Gavin. As the highly decorated third commanding general of the 82nd Airborne Division during World War II, Gavin was more than just a leader; he was a visionary and a soldier’s general. Nicknamed the “Jumping General,” Gavin personally participated in combat jumps alongside his troops in Sicily, in Italy, and during the D-Day invasion of Normandy. His leadership style exemplified courage, strategic brilliance, and an unwavering dedication to his men. At just 37 years old, he became the youngest divisional commander in the U.S. Army, leading the 82nd Airborne Division with unparalleled effectiveness. Gavin’s actions directly contributed to the success of key military campaigns during WWII, and his innovative thinking shaped airborne operations for decades to come. Gavin’s contributions extended far beyond WWII. In 1947, he incorporated the all-black 555th Parachute Infantry Battalion into the 82nd Airborne, making it the first integrated division in the U.S. Army. He also played a crucial role in shaping post-war military strategy, becoming one of the first senior officials to advocate a more agile and mobile fighting force. Gavin’s forward-thinking approach to logistics and rapid deployment, particularly using helicopters, was instrumental in developing the modern air cavalry. The renaming of Fort Liberty to Fort Gavin would not only have paid homage to his exemplary military service but also served as a reminder of the kind of leadership and moral clarity that should define America’s armed forces. Instead, the Pentagon chose to rename it Fort Roland L. Bragg, a name that has little connection to the installation’s rich history but conveniently aligns with an illusion of attempting to restore the past. Before becoming secretary of defense, Pete Hegseth declared, regarding the initial renaming to Fort Liberty, “We should change it back because legacy matters.” Yet, when given the opportunity to correct past mistakes, Hegseth failed to honor the man who best embodied the institution’s legacy and ethos. The 82nd Airborne Division has prided itself on its legacy of excellence, resilience, and innovation. Naming the base after Gavin would have been the perfect way to honor those principles. Unfortunately, by disregarding Gavin’s legacy, the current administration missed the chance to connect Fort Bragg’s new identity to the soldiers who made it legendary. General James M. Gavin was the embodiment of airborne excellence, a leader who defined the very institution Fort Bragg has housed for decades. By failing to recognize his contributions, the current administration has once again squandered an opportunity to tie the past, present, and future of one of the military’s most iconic bases to a leader who truly represented its values. Tim McMillan is a retired police lieutenant, investigative reporter, and co-founder and executive director of TheDebrief . His writing covers defense, science, and the intelligence community. Follow him @lttimmcmillan .",Washington Examiner,2025-02-12T15:05:55+00:00,,Commentary,https://www.washingtonexaminer.com/restoring-america/patriotism-unity/3317626/fort-bragg-latest-name-change-pure-political-appeasement/
Trump must stop the UK’s dangerous surrender of the Chagos Islands,"Most Americans may not be familiar with the Chagos Islands, but they play a crucial role in U.S. national security . This remote Indian Ocean archipelago, which includes Diego Garcia, hosts one of the most strategically important American military bases in the world. The base has been a linchpin of U.S. military operations for decades, providing logistical support for missions in the Middle East , countering China’s growing influence in the Indo-Pacific, and serving as a critical hub for intelligence and surveillance. Despite its strategic significance, the United Kingdom, under the leadership of Prime Minister Keir Starmer, is preparing to hand over the sovereignty of the Chagos Islands to Mauritius. This decision is not based on security concerns or practical governance but on a misguided sense of legalism and postcolonial revisionism. The U.K. is willing to cede control despite the islands having little historical or cultural connection to Mauritius, which lies 1,400 miles away. Under the proposed deal, Britain would cede sovereignty while paying Mauritius 9 billion pounds over 99 years to lease back Diego Garcia, the key U.S. naval base in the region. The negotiations are being led by Starmer’s attorney general, Lord Richard Hermer, who has previously stated that “almost every element” of the British Empire was racist and has actively advocated reparations to be paid to those who were “victims” of the empire. This latest arrangement from Hermer is not only an unprecedented act of strategic self-sabotage by the U.K. but also a direct threat to U.S. interests in the region. Now back in office, President Donald Trump must urgently intervene to prevent this reckless handover, a move that would deal a devastating blow to U.S. national security and ultimately play into the hands of China. China has a well-documented track record of leveraging debt and infrastructure projects to entrench its influence across the developing world. From Sri Lanka’s Hambantota Port to military installations in Djibouti, Beijing has perfected the art of turning economic partnerships into strategic footholds. Once Mauritius takes control of the Chagos Islands, it is only a matter of time before China offers lucrative investment deals in exchange for naval access. Given Mauritius’s economic dependence on China, resistance to such overtures would be difficult. For Washington, the consequences of a Chinese presence in Diego Garcia would be catastrophic. The island has been crucial to America’s power projection in the Indo-Pacific and serves as a counterweight to China’s growing military assertiveness. Allowing China to establish even a minimal footprint in the Chagos archipelago would dramatically shift the balance of power in the region and weaken U.S. deterrence. Trump must make it clear to the U.K. that this deal is unacceptable. The U.S. should leverage its diplomatic and economic influence to halt the transfer, emphasizing that British participation in the Five Eyes intelligence alliance and other key defense agreements depends on London’s commitment to shared security interests. If necessary, Washington must also be prepared to negotiate a direct long-term lease with Mauritius, ensuring ironclad restrictions on any Chinese involvement. This is not a matter of decolonization or historical redress. It is a matter of strategic survival. The Chagos Islands are too important to be sacrificed on the altar of postcolonial revisionism. If Starmer’s government insists on this folly, Trump must step in and put an end to it before it is too late. Azeem Ibrahim, Ph.D., is an officer of the Order of the British Empire, a senior director at the Newlines Institute for Strategy and Policy, and the author of Authoritarian Century: Omens of a Post-Liberal Order .",Washington Examiner,2025-02-12T14:14:03+00:00,,Commentary,https://www.washingtonexaminer.com/opinion/beltway-confidential/3317577/trump-must-stop-uks-dangerous-surrender-chagos-islands/
Shein and Temu must be restricted over slave labor,"The Chinese companies Shein and Temu have become wildly popular for their dirt-cheap clothes and gadgets. Hidden behind the trendy bargains, however, rests an ugly truth: these companies are profiting from slave labor. Mounting evidence ties their supply chains to forced labor by Uyghur Muslims in China’s Xinjiang region. This isn’t a minor allegation; it’s part of what many countries recognize as an ongoing genocide against the Uyghur people. President Donald Trump’s administration is reportedly weighing whether to add Shein and Temu to the Department of Homeland Security’s forced labor blacklist. As the Trump administration works to decouple the United States from reliance on Chinese goods, leveraging existing authority to prevent Shein and Temu from skirting U.S. law should be a priority. Kicking out forced-labor profiteers would protect our values and strengthen our resilience against a hostile foreign power. In 2021, Congress overwhelmingly passed the Uyghur Forced Labor Prevention Act (UFLPA) to ensure that American commercial activity is not supporting forced labor. The UFLPA created a rebuttable presumption that any goods connected to Xinjiang are tainted by forced labor and barred from import unless proven otherwise. This law embodies a basic moral principle: no product of slave labor should reach American homes and businesses. Unfortunately, that principle is undermined every day when Americans purchase products from Shein and Temu. The allegations against Shein and Temu are not mere speculation. A 2022 report by Bloomberg used laboratory testing to confirm that Shein’s products contained cotton sourced from Xinjiang, the epicenter of China’s state-run forced labor program. While Shein claims it does not source from Xinjiang, the opacity of its supply chain raises serious concerns about its credibility. Similarly, Temu, a subsidiary of Chinese e-commerce giant Pinduoduo, is also complicit in the use of forced Uyghur labor. Temu’s rapid expansion into the U.S. market has come with almost no transparency about its sourcing practices. Unlike Amazon or Walmart, which have regulatory and compliance mechanisms in place to audit suppliers, Temu operates as a marketplace that allows Chinese manufacturers—many of whom may rely on Xinjiang supply chains—to sell directly to American consumers with little scrutiny. Banning Shein and Temu is not just a moral necessity; it is an economic imperative. The presence of these companies in the U.S. market undercuts American businesses that adhere to ethical labor practices. Such rock-bottom prices are subsidized by forced labor, lack of supply chain transparency, and regulatory arbitrage. This creates an unfair playing field for American retailers and manufacturers and exposes consumers to harmful products. By formally designating these companies as complicit in forced labor in Xinjiang, their imports could be blocked outright unless they prove no ties to slave labor — a high bar given the evidence. From a strategic perspective, allowing companies with deep ties to the Chinese Communist Party (CCP) to dominate the U.S. e-commerce space poses national security risks. A 2023 report from the House Select Committee on Strategic Competition between the United States and the CCP identified Shein’s “aggressive data collection” on American consumers, similar to the concerns raised about TikTok. Given the CCP’s extensive history of using technology companies for intelligence gathering, continued access to U.S. consumers poses a direct risk. This move would be a significant escalation in holding China accountable and protecting U.S. consumers. It’s also a logical next step in Trump’s broader trade crackdown. Placing Shein and Temu on the UFLPA-covered list would send an unambiguous message: the United States will not be a dumping ground for goods made with slave labor. This approach offers a targeted solution that protects human rights without harming legitimate trade. By banishing Shein and Temu from our market, Trump would be standing up for the millions who cannot speak out, from Uyghur laborers to U.S. workers who deserve better than competing with slave labor. Luke Hogg is the director of technology policy at the Foundation for American Innovation. Josh Levine is a research fellow at the Foundation for American Innovation.",Washington Examiner,2025-02-12T12:00:00+00:00,,Commentary,https://www.washingtonexaminer.com/restoring-america/fairness-justice/3317053/shein-and-temu-must-be-restricted-over-slave-labor/
Texas leads in securing the border,"In its coverage of Texas Gov. Greg Abbott’s recent trip to the White House, Fox News acknowledged the shift on display. Where the Biden administration threw open our borders, and fought Texas’s attempts to enforce the law, the Trump administration is embracing Abbott’s actions. Abbott’s deputizing the Texas National Guard to help the Border Patrol is just the next logical step. “It would be hard to find another governor who has done more to support, and help implement and endorse, Trump’s hardline border security and immigration agenda,” Fox News reported .” Texas, under Abbott’s leadership,” the article continued, “has spent billions of dollars on border security the past couple of years under Operation Lone Star. And this week, Abbott, in an unprecedented move, gave Texas National Guard soldiers the power to arrest undocumented immigrants in coordination with U.S. Customs and Border Protection.” Of course, Abbott’s decision to deputize the National Guard has come under fire from the party of open borders. “It’s likely to lead to harassment and racial profiling of Mexican Americans and other Hispanics in South Texas and the border region,” claimed Texas Democratic Congressman Joaquin Castro . But here’s the reality: The Biden administration’s efforts to undermine the rule of law have left the Border Patrol undermanned and underfunded. Abbott’s actions are lawful—troops have been used at the border for decades. “Military forces have been on the border continuously since the establishment of JTF-6 in 1989 to help combat drug smuggling,” the Center for Strategic and International Studies explains . “The levels have varied depending on the perceived level of need, the availability of forces, and the politics of immigration but continued in both Republican and Democratic administrations.” What happens next? Some Democratic-run states and cities say they’ll remain “sanctuaries” for illegal immigrants, including violent criminals. New Jersey Gov. Phil Murphy even claims he is thinking about housing an illegal immigrant in his garage apartment. As he put it, “good luck to the feds coming in to try to get her.” Not everyone is so recalcitrant. Out in Nevada, Attorney General Aaron Ford, a gubernatorial hopeful, once sponsored legislation to make Nevada a sanctuary state. Now he supports enforcing the law. “Keeping our communities safe is not a controversial statement,” Ford told the Las Vegas Review-Journal . “It is my job, and I intend to do that, and I support policies that do that.” Ford, a Democrat, knows he must change his tune on the border. Not only did President Trump win Nevada by three points, the state now has more registered Republicans than Democrats . What other sanctuary states and cities are missing is that this moment represents a great political sea-change. Trump was very clear about what he was running on, and securing the border was at the top of his list. Voters went for it. Sanctuary states and cities also can’t afford the illegal immigration crisis brought about by the Biden administration. Indeed, while President Joe Biden was in office, New York, Chicago, and Denver were all pleading for federal funds to help them pay for their own irresponsible policies. Gov. Abbott has set an example to follow. He has shown how states can come alongside and assist the federal government in enforcing the law. Many states such as Florida, Tennessee, and South Dakota have already sent their own National Guard troops to support Texas. It’s time for the others to step up. The Honorable Robert Henneke is the Executive Director and General Counsel at the Texas Public Policy Foundation.",Washington Examiner,2025-02-12T10:00:00+00:00,,Commentary,https://www.washingtonexaminer.com/restoring-america/courage-strength-optimism/3316984/wed-texas-leads-in-securing-the-border/
