title,text,site,date,category,class,url
Eyes Wide Shut,"Three in four people in Britain polled support a national inquiry into the prolific and harrowing rape of the nation's children by insatiate "" grooming gangs ."" Yet, contrary to public will, the UK Labour Government last week voted against commissioning an investigation into this enduring horror. Public consciousness of child sexual exploitation in the United Kingdom reached an inflection point this winter after victims shared account after gut-churning account of sexual savagery and careless murder being perpetrated against underage white girls by Pakistani-Muslim men up and down the country. These brave survivors recount how police and social workers were complicit in their abuse, losing evidence, asserting that children could consent , and failing to investigate rapes for fear of being called racist. In one instance, a girl had a morning-after pill forced into her mouth by a police officer . Significant constituencies of the public believe that attempts are being made to cover up the historic failures of both local and national authorities, including 65% of Labour voters. These accusations of corruption, galvanised by high-profile political figures like Elon Musk, have been branded ' far-right' by Keir Starmer, which has only caused the public's attention to shift toward the prime minister and his record as Director of Public Prosecutions . The prime minister fueled speculations of a cover-up when he issued a three-line party whip--the most stringent form of party discipline--against Labour MPs, forcing them to vote against the investigation or risk expulsion from the party. When the vote came, therefore, MPs from the top 50 towns known to be sheltering grooming gangs either abstained or voted against the investigation. Only 3 MPs living in these grooming gang hotspots favoured an investigation. In each instance, the member came from the Conservative Party. No Labour MP voted in favour of an investigation, with around one-fifth abstaining or absent. The result produced a seismic backlash, including from angry victims , in whose names Labour claimed a national investigation would be counterproductive to change. The party line is, ""The investigation has already been had"" and ""It is time to get to work."" This has proven to be one of these sleight-of-hand truths intended to cover all manner of sins. As Reform MP Nigel Farage highlighted for the House, this preexisting inquiry--all 459 pages of it--fails to mention ""grooming gangs"" and of the over 50 towns in England known to be harbouring this scourge, only the infamous Rotherham is mentioned. It is thought that the number of girls who have been victims of child sexual exploitation, sexual assault, and rape by these gangs could be a quarter of a million--at the most conservative estimate. In twelve months alone, a Grooming Gangs Taskforce helped UK police identify and protect ""over 4,000 victims."" The towering ambiguity of just how many girls have been affected should, alone, give cause for a comprehensive, rigorous, and far-reaching investigation. The need is unambiguous and the public mandate is indisputable. Some within the Labour Party are coming to this realisation. MPs have begun to break ranks to side with the opposition in calling for an investigation, including Dan Carden , Paul Waugh , and Sarah Champion --MPs for the infamous Rochdale and Rotherham. But the cynic in me believes this limp 'I am Spartacus'-moment struggles to amount to more than career protection. I do not believe there is the desire or the passion to put an end to the ritual rape of these girls by gangs of foreign men. For decades, MPs have had their eyes wide shut to this scourge. The cold, unfeeling truth is that these girls have been dismissed because their abuse is a political inconvenience. The facts of this atrocity contradict the tenets of 'inclusivity' and 'tolerance' that characterise our modern age. From infancy until death, the public is schooled that diversity is--and can only ever be--a strength. If an immigrant living in a Western nation engages in criminal or grotesque behaviour, he does not reflect the customs and attitudes of his home nation. Nor is he to be included in the ranks of the 'DiverseTM'. He is to be viewed as an innocent--a child--lashing out at a cruel and misunderstanding people. Whether he emerges from a war zone or a paradise, he is to be understood as suffering an impenetrable trauma that gifts rationality to his barbarity. All of which is to say, it is impossible for one to identify a pattern of perversity in any one community, religion, country, or culture. It is in this vein that the British public is charged to ignore the demographic shift in their constituencies--ignore how this might influence a politician's vote. They are forbidden from noticing that the fast-food economy which sustains the middle-class lifestyle also sustains the perpetrators in these rape gangs. They must blind themselves to the incontrovertible. Labour is no longer the party of the white working class because the white, working-class vote is no longer useful to them.It is not the rape of the nation's children the UK Government is trying to cover up, nor is it the endemic failures in local councils and child protection services. What they wish to deny is an attitude: that the life of a white, working-class girl--much like her consent--is surplus to requirements.",The European Conservative,2025-01-14T14:20:20,COMMENTARY,Commentary,https://europeanconservative.com/articles/commentary/eyes-wide-shut/
Europe Is Giving in to the Censorious Demands of Islam,"In July 2023, an Iranian man burned copies of the Bible and Torah outside the Israeli embassy in Copenhagen. The Danish authorities granted Medhi Zaman permission, and the demonstration was mostly disregarded by the general public. However, in both Denmark and Sweden, insulting Islam is treated differently. Last month, Salwan Momika, an Iraqi asylum seeker living in Sweden, was awaiting trial for a series of public burnings of the Quran. The 38-year-old anti-Islam activist did not attend court because, on January 29th, Momika was shot dead in what appears to be a retaliatory attack. Although Momika's protest is supposedly protected under Swedish law--the country scrapped its blasphemy laws in 1970--exceptions are made if the protest is viewed as incitement. He was awaiting a verdict on a charge of 'agitation against an ethnic group.' The protest sparked outrage in muslim-Majority countries. The Scandinavian Quran burnings were cited by Turkey as why they delayed Sweden's NATO membership for months. The Swedish embassy in Baghdad was attacked and its ambassador was expelled. Denmark was once a shining example of Enlightenment rationalism. When the government abolished all types of censorship in 1770, it asserted its citizens' right to free speech. This was demonstrated when it vigorously defended Jyllands-Posten , a Danish newspaper that published a dozen satirical cartoons of the prophet Mohammed in 2005. Despite the potential backlash and the threat to life, the administration remained steadfast in its protection of journalistic freedom.Things have changed, and it appears that certain accommodations have been made for Islam. In response to a series of book burnings, the country introduced what is widely referred to as ""t he Quran law "" in December 2023. Those who burn or defile holy texts face a fine and a maximum sentence of two years in prison. In January, two Danish citizens were the first to be charged under the new law. Both were accused of 'inappropriate treatment of a Quran' at a political festival in June of last year. Despite the European Court of Human Rights having stressed on numerous occasions that freedom of expression constitutes ""one of the essential foundations of a democratic society"", and that ""it is applicable not only to 'information' or 'ideas' that are favourably received or regarded as inoffensive or as a matter of indifference, but also to those that offend, shock or disturb the State or any sector of the population,"" there are still several EU members states that still punish 'insult to religion,' as noted on the website of End Blasphemy Laws. Britain has also formally abolished its blasphemy laws. However, the police's attitude towards those who ridicule Islam's holy book has remained mostly unchanged since 2008, when blasphemy was removed from the statute books. Last month, a man in Manchester was arrested on suspicion of a 'racially aggravated public order offence' after live-streaming himself burning a Quran. Then, just a few days ago, Metropolitan police charged a man with the same offence after a Quran was allegedly burned outside the Turkish consulate in central London, despite the activist being attacked by a man wielding a knife who objected to his protest and reportedly spat on him. In 2023, an autistic 14-year-old boy was suspended from a school in West Yorkshire when a copy of the Quran was scuffed. So great was the anger in the local Muslim community that the boy's mother appeared at a local mosque begging for forgiveness after his life was threatened. To compound the humiliation, her 'sinful' hair was covered to avoid any offending worshippers. The Batley Grammar School teacher who drew the wrath of Muslims in 2021 for displaying his students an illustration of the prophet Mohammed is allegedly still in hiding. When Labour MP Tahir Ali urged Sir Keir Starmer to prohibit the desecration of the Quran and other Abrahamic religious texts during Prime Minister's questions, it was obvious which faith he was talking about. Ali is ideologically captured by the electorate--57.5% of Ali's Birmingham constituency of Hall Green and Moseley are Muslim. Between 2011 and 2021, the Muslim population of England and Wales increased by more than a million, reaching almost 4 million, or approximately 6.5% of the population, and is estimated to rise to 17.2% by 2050. In response to Ali's proposal for a law to safeguard Islam from mockery, Prime Minister Starmer stated: ""I agree that desecration is awful and should be condemned across the House. We are ... committed to tackling all forms of hatred and division, including Islamophobia in all its forms."" Our ruling class's support for state-mandated multiculturalism has culminated in the creation of a new de facto blasphemy law: Islamophobia. During its time in opposition, the Labour Party adopted the All-Party Parliamentary Group on British Muslims (APPG) definition of Islamophobia, a version of which looks likely to be implemented by the government, according to the Sunday Telegraph . An APPG report defined it thus: ""Islamophobia is rooted in racism and is a type of racism that targets expressions of Muslimness or perceived Muslimness."" Following a string of Quran burnings in Scandinavia, the Guardian described the stunts as evidence of a 'racism crisis.' One of the Muslim women interviewed called book burning an example of 'Islamophobia.' However, Islam is a belief system, not a race. There are nearly two billion Muslims in the world, many of whom come from different ethnicities. When you criticise Islam, you are criticising an ideology, not a specific racial group: conflating race and ideas is an efficient technique to silence opposition. The real problem for Europe is definitely not imaginary Islamophobia, but Islam itself. Many convincingly argue that Islam is a religion that is inherently opposed to Western values. This was also evidenced by a survey done in March of last year: 52% of Muslims in the United Kingdom support legislation outlawing the display of images of the Prophet Mohammed within the next twenty years. If you live in the West, you must adhere to its laws and values. If this means tolerating somebody burning a religious text, then so be it. Living in a free society demands a trade-off. However, European countries, once the foundation of enlightenment thinking, have opened their borders and collectively accepted the censorious demands of Islam. Britain--the birthplace of liberty philosopher and advocate John Milton--has a long history of liberty, free expression, and the right to blaspheme. But after importing large numbers of people from countries with dictatorships or theocratic regimes, we seem to be forced to give up on these historically European principles.",The European Conservative,2025-03-01T08:00:00,COMMENTARY,Commentary,https://europeanconservative.com/articles/commentary/europe-blasphemy-laws-censorious-demands-of-islam/
Hillbilly Meets Europe: A New Transatlantic Vision for the West,"Over the decades, the Munich Security Conferences have produced many famous and memorable speeches. Few of them have been as unusual as the one U.S. Vice President JD Vance delivered last Friday. Much of the audience, composed of high-ranking politicians and experts from EU and NATO countries, expected detailed policy outlines on transatlantic security and the war in Ukraine. But Vance focused on the basics, the common heritage, freedom, free speech, and true democracy. Although not many in the audience may have been receptive to these messages, there is certainly a growing number of people in Europe who are willing to work with the backbone, the patriots, the "" hillbillies "" of America on these fundamentals: the conservative sovereigntist forces of Europe such as the Patriots for Europe. What do these values have to do with geopolitics and security? Everything. They point to three main principles that unite the new American and European conservative movements: faith, national sovereignty, and peace through strength. Patriots on both sides of the Atlantic are convinced that our values are ultimately rooted in the principles of our Western civilization, in our faith, in our Christian heritage. It is the most cherished value to be preserved. Because of its uniqueness, Patriots do not believe that any other culture or nation outside the West should or could apply all of our values, principles, or laws. We take it for granted that all men are created equal--it's a Christian idea, after all--but we have learned the lessons of our own recent history about the dangers and costs of "" searching for monsters overseas ,"" even when doing so in the name of liberal democratic values. Patriots believe that we are in this world to have a home somewhere, to be part of a nation. National sovereignty is about solidarity and inclusion. The nation-state is the largest and most successful community of peoples bound together by common history, culture, and norms. When people question the value of the nation and either fantasize about globalist universalism or try to transcend national boundaries with imperial ambitions, they always end in disaster. Faith and national sovereignty recognize the realities of this world. America first, Europe first, Italy first, Hungary first also means that our interests in security, economics, and trade sometimes differ. But despite the critics, at their core, today's patriots have much more respect for other nations than liberal Western elites because they understand the fundamental value of national sovereignty. Finally, peace through strength. Patriots recognize power as the driver of international politics, so they see strong defense and deterrence as a necessity. At the same time, deterrence is enhanced not only by military strength, but also by clearly defining the boundaries of our genuine fundamental interests based on proper risk and cost assessments. Fighting endless unwinnable wars only undermines deterrence. As the Cold War taught us in the Koreas or Vietnam, winning the peace is sometimes more important than winning the war. The West faces daunting challenges. There is much common ground on both sides of the Atlantic among those who believe that the West needs a new kind of Reformation--one that looks boldly to the future, nourished by the wellsprings of original truths. At a recent meeting of the Patriots, Prime Minister Viktor Orban quoted another famous Hungarian, Ferenc Puskas, the greatest soccer player of all time, referring to conservative forces in Europe, ""The team is very much together."" When it comes to bold and powerful solutions in the Western political arena, an American quarterback in the team could change the name of the game for the better.",The European Conservative,2025-02-20T08:00:00,COMMENTARY,Commentary,https://europeanconservative.com/articles/commentary/hillbilly-meets-europe-a-new-transatlantic-vision-for-the-west/
"‘You’re Not Too Conservative, Right?’—Election Weekend in Berlin","There were two types of Germans we met in Berlin while trying to gauge the public sentiment in the last days leading up to the election: Those who believe only the AfD can save Germany from its endemic problems, created by past governments; and those who think the only thing the country needs saving from is the AfD. There seemed to be no in-between, and most disturbingly, no willingness to listen to the other side, which was especially apparent on the Left. The election was rightly called historic for multiple reasons. Both big establishment parties (the CDU and the SPD) delivered one of the worst performances in their history, while the parties on the far sides of the political divide doubled their share of votes--all with a record-high voter turnout. But there has been much said already about the results and why Germans abandoned the center, so let's make an additional point instead, namely that the results you saw mark only the beginning, and not the end, of the process. Yes, AfD broke through the psychologically important 20% threshold for the first time, but there is no sign of them getting anywhere near a glass ceiling yet. To understand why, you have to look at the two primary factors driving the AfD's growth: the establishment's willful ignorance of the people's legitimate concerns--whether about energy prices, immigrant crime, or something else--as well as its insistence on the cordon sanitaire , the undemocratic firewall, against those calling for a change. ""The firewall will collapse, because it has to,"" we heard from AfD supporters time and time again. AfD fights for democracy, freedom of speech, security, and peace, they said, and deserves to participate in the public discourse as much as anyone else. Needless to say, AfD also has some homework to do before it can truly consolidate itself as a force not only able to shape but to lead the public discussion about Germany's future. And that means distancing itself from some of its more radical elements. For instance, Bjorn Hocke's Der Flugel faction might have a place in German politics, but AfD must decide whether it's possible to push them to be more aligned with the rest of the party or if it's better for the two to go their separate ways. The same could be said for Maximilian Krah--whose China spy scandal was first broken by the europeanconservative.com --and whose recent readmittance into the AfD might not have been the wisest choice. Still, the frustration about the isolation of the Right is entirely justified: the entire political establishment essentially told every fifth German that their opinions don't count. Expecting people to just give up after this would be utterly naive: they will keep voting AfD until the party reaches a critical threshold where exclusion is simply not an option. Check out what voters had to say about the #GermanElections ""We stand for democracy, freedom of speech, and security within our borders."" pic.twitter.com/cHHwBrV9sE Yet, a significant portion of society seems bent on denying them the chance to finally get their voice heard, regardless of who ends up in government or what damage to social cohesion and democratic integrity the firewall causes. ""The only thing that matters now is that the far-right is stopped. Nothing else comes close,"" one person told us while we were standing next to Berlin's famous Holocaust memorial, where a radicalized asylum seeker nearly fatally stabbed a Spanish tourist the night before after weeks of plotting to ""murder Jews,"" according to police. Yet, when we tried to ask this person what he thought about the increase in violent crime--a perfectly reasonable question given that the police cordons around the memorial were a visible reminder of the night's attack--he quickly cut the interview short. ""Are you a far-right media?"" No, just conservative. ""But not too conservative, right?"" What is 'too conservative' in today's Germany? Many make the point that AfD's program is nothing more than what mainstream right-wing parties, such as CDU, were advocating just a few decades ago. Given the left-wing shift that establishment center-right parties have undertaken, particularly since the early 2010s, perhaps it's better to flip the question. If one claims to represent conservatives but is unwilling to recognize the harm that uncontrolled migration has caused to our nations, then they're not conservative enough . We were expecting similar interactions with antifascist protesters outside the AfD's Lichtenberg headquarters. The East Berlin district has been voting for the far-left Die Linke since 2005, with the AfD now coming within touching distance of flipping it, finishing in second place with only a one percent difference. But when we tried to talk to anyone from the two protesting groups that completely surrounded the AfD's little rally--one organized by Die Linke and the other by hardcore 'Antifas'--we only received silence, or worse: violent threats. A few of them even began pushing us around , and we owe it to the intervening police that it didn't escalate further. Everywhere we looked, we met these two sides of Berlin: the 'only AfD' and the 'anything, but AfD.' And it's somewhat understandable, given that the party has been enduring unprecedented demonization from both mainstream media and politics. AfD's opponents don't waste time nitpicking through their program; instead, they just carelessly throw around the Nazi card, and the historical guilt deeply embedded in German society takes care of the rest. But, again, this will inevitably lead to two things. One is the further polarization of Germany's political landscape and the fragmentation of its society, and the other is the unavoidable collapse of the firewall. For a few weeks, the CDU's tactic of posing as more right-wing did more to preserve the firewall than years of propaganda. Yet, voters were once again slapped in the face when Merz took a U-turn on migration and called reports on his previous commitment on border control ""disinformation."" The possible impact of this betrayal in the coming years should not be underestimated, as you can only ignore your voters for so long. The firewall will collapse, because it has to.",The European Conservative,2025-02-27T14:42:19,COMMENTARY,Commentary,https://europeanconservative.com/articles/commentary/youre-not-too-conservative-right-election-weekend-in-berlin/
