title,text,site,date,category,class,url
MSNBC hasn’t learned its lesson. That’s a good thing,"Joy Reid was, by far, the worst on-air personality at MSNBC. Her show's dwindling popularity was rivaled only by its lack of honesty, amounting to nothing but a nightly screech-fest against white people, fascism, President Donald Trump , and white people. Rachel Maddow , who pushes the same conspiratorial nonsense as Reid with slightly more subtly and far more elitist arrogance, was supposedly appalled by Reid's unseating at the network, taking time on Monday evening to address the ""changes"" at MSNBC. ""I am 51 years old. I have been gainfully employed since I was 12. And I have had so many different kinds of jobs, you wouldn't believe me if I told you. But in all of the jobs I have had, in all of the years I have been alive, there is no colleague for whom I have had more affection and more respect than Joy Reid,"" she said. ""I love everything about her. I have learned so much from her. I have so much more to learn from her."" ""I do not want to lose her as a colleague here at MSNBC, and personally, I think it is a bad mistake to let her walk out the door,"" she continued. ""It is not my call, and I understand that, but that's what I think."" Maddow went on to describe the network's cancellation of shows of ""two non-white hosts"" as ""unnerving."" ""That feels indefensible, and I do not defend it,"" she said. Given her outrage, did the oh-so-principled Rachel Maddow offer her resignation in protest of the indefensible racism that has infected the halls of MSNBC ? Of course not. I guess $25 million a year just tastes too good. Despite the shameless virtue-signaling of Maddow as she accepts tens of millions of dollars from the same people she has now labeled as indefensible racists, the truth about Reid's ouster is simple: She was fired because she is an unpopular and irrational commentator who happens to be a black woman . Unpopular and irrational people don't have a God-given right to media fame and fortune simply because of their skin color, and only racists believe otherwise. Beyond Reid's much-deserved descent into irrelevance, there's another cause for celebration here: These journalists still haven't learned their lesson. Even as MSNBC hemorrhages viewers like they're dollars in the United States's Social Security fund, it is sticking to the one strategy that got it here: an out-of-touch obsession with race. Trump's victory in November's election should have been a wake-up call to left-wing media that people have moved on from the post-2020 cult-like attitude toward the various -isms that caused former President Joe Biden and his administration to crash and burn. It's hardly a subtle indication that has been missed by other institutions. MSNBC'S CHRIS HAYES MOURNS 'DEVASTATING' FIRING OF JOY REID AMID NETWORK SHAKE-UP Jeff Bezos certainly got the message, announcing that the Washington Post's opinion pages will support and defend personal liberties and free markets. How times have changed. But as long as hacks such as Rachel Maddow and her network of pro-communist, pro-terrorist, and anti-freedom propagandists refuse to catch up with the rest of the country, their precipitous decline will continue. Let's hope they keep ignoring the writing on the wall. Ian Haworth is a syndicated columnist, speaker, and podcast host. You can find him on Substack and follow him on X at @ighaworth .",Washington Examiner,2025-02-27T11:00:00+00:00,,Commentary,https://www.washingtonexaminer.com/restoring-america/patriotism-unity/3331099/msnbc-hasnt-learned-its-lesson-thats-a-good-thing/
Did you know about Biden’s mental decline? Jake Tapper didn’t,"Former President Joe Biden's cognitive decline was obvious during his presidency to anyone who watched him, except apparently to liberal journalists such as CNN's Jake Tapper. Tapper is releasing a book coauthored with Axios's Alex Thompson called Original Sin: President Biden's Decline, Its Cover-Up, and His Disastrous Choice to Run Again. The press release for the book says, ""What you will learn makes President Biden's decision to run for reelection seem shockingly narcissistic, self-delusional, and reckless -- a desperate bet that went bust -- and part of a larger act of extended public deception that has few precedents."" Except you, dear reader, will probably not learn that. Chances are you already know that. To most of us with eyes, we could see that Biden was not up to the job and his brain was slipping. He spent the 2020 campaign hiding in his basement to avoid unscripted interactions. The few times he emerged, he was either married to his teleprompter or offering such wisdom as ""We have to take care of the cure. That will make the problem worse no matter what."" Just two months into the job, Biden couldn't even remember the name of his defense secretary, Lloyd Austin. ""I want to thank Sec-... the ... the former general ... I keep calling him 'General ... My ... My uhh ... The guy who runs that outfit over there."" It only got worse from there, as Biden called out to dead people at speeches, sounded increasingly incoherent off-teleprompter, and claimed he had cancer in addition to claiming that his administration ""ended cancer as we know it,"" among multiple other brain lapses. Everyone knew Biden couldn't function. Democrats and their activist celebrities admitted behind the scenes that Biden's brain was fried. Robert Hur's report detailed that Biden's memory was gone, saying he couldn't remember when he was vice president, what year his son died, or details about the Afghanistan withdrawal of which he was in charge. The Justice Department even buried the audio of that interview with the special counsel to avoid further scrutiny. PALESTINE'S PROPAGANDA PARTNERS Jake Tapper was apparently one of the only people who didn't know. With righteous indignation, he attacked Lara Trump for pointing out Biden's decline, claiming Biden just had a stutter that hadn't presented itself his entire public life and that she should be ashamed for making children who stutter feel bad. Tapper apparently only discovered Biden's mental decline when Thompson brought him on to help sell the book. During the election, Tapper was a cog in the media machine covering up Biden's decline. We don't need a pretentious book from liberal media acting as if they suddenly discovered the cover-up of Biden's health because we sat through their participation in it. Tapper is five years too late for the party and is only here conveniently after the 2024 elections so he can try and win conservative goodwill with no real consequences to his network and his Democratic Party team.",Washington Examiner,2025-02-27T20:25:10+00:00,,Commentary,https://www.washingtonexaminer.com/opinion/beltway-confidential/3332587/biden-mental-decline-jake-tapper-new-book/
Trump can make this a global golden age for religious liberty,"The United States is a beacon for religious freedom . That's a regrettably rare thing around the world. Pew Research's 2022 Report on Government Restrictions on Religion showed that restrictions in 198 countries and territories peaked in 2022. President Donald Trump's second term thus presents a unique opportunity to cement his legacy in championing global religious freedom. ""You shouldn't have to leave your faith at the door of your people's government, and under President Trump's leadership, you won't have to,"" Vice President JD Vance said during the International Religious Freedom Summit last week in Washington. Protection of religious freedom was a core tenet of Trump's first-term foreign policy. In his remarks to the United Nations General Assembly in September 2019, he reaffirmed that ""religious freedom is a fundamental right"". His efforts received bipartisan support in Congress. The first Trump administration built on the foundation set by the International Religious Freedom Act of 1998 and launched a series of unprecedented initiatives to support persecuted religious minorities, advocate religious freedom in international forums, and maintain a strong stance against religious persecution in countries such as China and Iran. In 2018, for example, the State Department established the International Religious Freedom Ministerial and held the historic and first Ministerial to Advance Religious Freedom. The event was followed by ministerial meetings held in 2019, 2020, and 2022. These were designed to bring together religious leaders, advocates, and government officials from around the world to discuss and promote religious freedom. They served to elevate the importance of religious freedom on the global stage and reinforce U.S. leadership in defending this fundamental human right. Congress also acted. One of the most prominent bipartisan legislative actions was the passage of the Uyghur Human Rights Policy Act in 2020. This act aimed to address China's treatment of Uyghur Muslims in its Xinjiang region, including forced labor, surveillance, and mass detentions. The legislation introduced sanctions on Chinese officials responsible for human rights abuses. Also in 2020, the Falun Gong Protection Act was introduced in Congress to highlight concerns over China's persecution of Falun Gong practitioners. The bill had bipartisan backing, with lawmakers advocating action over the Chinese government's human rights violations. In addition, several U.S. lawmakers from both political parties have expressed support for Shen Yun Performing Arts. Shen Yun is not just an arts group tied to the Falun Gong. According to its leaders, it is also a living artistic expression of a spiritual and cultural heritage that the Chinese Communist Party seeks to eradicate. Other examples abound. The Iran Human Rights and Hostage-Taking Accountability Act was bipartisan and passed with wide support in 2018. It aimed to hold the Iranian government accountable for human rights abuses, including the persecution of the Baha'i community, religious minorities, and others. In 2019, Congress passed the Elie Wiesel Genocide and Atrocities Prevention Act, which aimed to strengthen U.S. efforts to prevent genocide and other atrocities. The law had broad bipartisan support and was particularly focused on protecting religious and ethnic minorities, including Christians, Yazidis, Sunni minority groups, Shia minority groups, Alawites, Bahai's, and Jews in areas including Syria, Iraq, and Iran. Building on these remarkable achievements, the new Trump administration could continue to advance global religious freedom and take further steps in supporting religious minorities around the world. The political change in Syria, for instance, requires the U.S. to ensure that minority faith groups -- Alawites, Christians, Shiites, and others -- finally enjoy religious freedom. In addition, the Trump administration should redouble efforts to protect Christians in North Korea, other religious minorities in Iran, and Christians, Uyghurs, Tibetans, or Buddhists in China. A comprehensive strategy to combat religious persecution and defend religious freedom abroad, ensuring that U.S. foreign aid, diplomacy, and other international efforts prioritize the protection of religious freedoms will advance global peace and stability, strengthen democratic principles, and counter extremism. It will also cement Trump's legacy of global religious freedom champion. Chris Sacarabany is the executive director of the Foundation for Ethnic Understanding.",Washington Examiner,2025-02-12T11:00:00+00:00,,Commentary,https://www.washingtonexaminer.com/restoring-america/fairness-justice/3317026/trump-global-golden-age-religious-liberty/
The path to China deterrance,"In his inaugural address, President Donald Trump cast a bold vision for a moonshot that received too little attention: ending global conflict. He said America will achieve ""peace through strength"" via deterrence, making the U.S. military the strongest and most capable fighting force in the world. He also made clear that our primary object of deterrence is China . Certainly, Trump and Defense Secretary Pete Hegseth are already on a winning trajectory when it comes to personnel readiness. Recruiting numbers in January hit a 15-year high, proof that their ""warrior over woke"" cultural transition is working. But when it comes to realigning our capabilities to our adversaries' threats and overhauling the defense industrial base, we are dangerously behind. We are losing the economics of conflict. With rare exceptions, history rewards nations that master the economics of conflict and punishes those that do not. A clear example of this is the contrast between our 1980s intervention in Afghanistan against the Soviets and our involvement in the global war on terror. In the 1980s, we sent $8,500 Stinger missiles to the Mujahadeen, who used them to destroy Soviet aircraft worth millions. This was an incredible return on investment, one Congress gladly made again and again. Over time, the Soviets lost their Afghan war. Shortly thereafter, they lost their country. In contrast, during the global war on terror, the United States deployed exquisite million-dollar armored vehicles across the Middle East, only to see our adversaries defeat them with repurposed explosives and $20 worth of farm supplies. Throughout the last year in the Red Sea, the U.S. Navy has fired $2 million missiles at $50,000 drones launched by the Houthis. The math is broken, and our ability to sustain these costs rests solely on the United States' control over the world's reserve currency. Despite this advantage, our adversaries see the United States losing the economics of future conflict. Our country is $36.3 trillion in debt and runs a $1.8 trillion annual deficit. Our interest payments alone match the entire defense budget, and our annual deficit is double it. While our debt to gross domestic product ratio has hit a historic high of 123%, we only spend 2.9% of GDP on defense, the lowest since World War II. We find ourselves in a historic defense squeeze amid unprecedented fiscal constraints. At the same time, our capabilities are getting more expensive while our enemies' threats are getting cheaper. And history reminds us that cheap and capable beats exquisite and expensive -- every time, over time. As technology gaps shrink, our ability to win short-term conflict decisively is eroding. The United States needs a fundamental shift in how we think about defense. Our adversaries do not need aircraft carriers and battleships to sink ours. Cheap drones can cripple $100 million aircraft sitting on our tarmacs, sink the ships in our harbors or at sea, and even take down our electrical grid and pipeline infrastructure. Let us not forget that Ukraine crippled Russia's entire Black Sea fleet without a navy of its own. Americans have always looked at aircraft carriers in their harbors as a source of national pride and strength -- unparalleled capabilities to project force in times of need. In this new era, they may be liabilities. The United States has never operated in such a paradigm. If we fail to adjust, we risk spending ourselves into the oblivion of the Soviet Union that President Ronald Reagan so meticulously orchestrated, but now presidents Xi Jinping of China and Vladimir Putin of Russia orchestrate against us. Today, we are spending billions to sustain and purchase equipment that has not helped us win the last 30 years of war and will not help us deter or win the next one. So, how do we achieve Trump's objective of modern deterrence through winning the economics of war? First, we must recognize that we can either continue to fund the military we have today or invest in the military we need to deter and defeat China tomorrow. We cannot do both. The military's budget is bleeding from the operational and maintenance costs of outdated platforms and real estate, and that means we need to be ruthless in deciding which capabilities and platforms remain operational. Many in Congress will resist these cuts, but our national security demands honest assessment and hard action. We must butcher military pork like the conservative welfare that it is. Second, we must focus on exquisite capabilities that deliver decisive dominance. If a weapon provides an overwhelming strategic advantage against China, we keep it. If it falls short, we stop buying it and return to the drawing board. For exquisite capabilities in development, contracts must guarantee real battlefield supremacy, not just incremental improvement. We cannot afford to spend billions simply keeping up with China. We must unleash the full potential of American ingenuity to deter it. MISSION-CAPABILITY RATES FOR AIR FORCE FLEETS AT 'LOWEST LEVELS' IN OVER TWO DECADES Third, we must mass-produce our low-cost, high-impact capabilities that construct the foundation of both conventional and future asymmetric warfare. This includes energetics and explosives, munitions, artillery, surface-to-air and anti-tank missiles, rocket motors, and jet engines. We must fund new technologies and software at the speed of innovation and invest heavily in the military's organic capability to produce small drones at a significant scale. A general rule: Unless it achieves strategic dominance, if the cost to produce our capability exceeds what our enemies spend to produce their threat, we shouldn't buy it. Follow this rule, and we'll drive innovation, increase competition, and cut costs and Trump will keep us out of war with China. Ending global conflict? That could be a bonus. Pat Harrigan represents North Carolina's 10th Congressional District in the U.S. House of Representatives and serves on the House Armed Services Committee and the House Committee on Science, Space, and Technology.",Washington Examiner,2025-02-21T15:18:20+00:00,,Commentary,https://www.washingtonexaminer.com/restoring-america/courage-strength-optimism/3325055/path-to-china-deterrance/
Can the FTC stop big tech censorship?,"The Federal Trade Commission is requesting public comments on "" technology platform censorship ,"" a long-standing gripe for conservatives who believe social media companies have been censoring them and their ideas. To date, courts have rejected cases alleging censorship by the so-called Big Tech platforms on grounds that the plaintiffs failed to show ""state action"" on the part of government agents. But ever since the Twitter files were released in late 2022 and early 2023, Congress, the courts, and the executive branch have all been forced to grapple with how social media companies may have been pressured or cajoled by government officials to censor disfavored individuals and ideas. The FTC's inquiry suggests that it is looking for legal ways to address this alleged censorship. The FTC is, for now, just seeking to gather more information on the scope and scale of the alleged censorship. While it is good to know more about pressure campaigns from government officials in particular, the request also aims to know more about how technology platforms ""censor"" users on their own. The commission will ultimately have to weigh how the First Amendment limits what legal tools may be applied to them. The Supreme Court's decision last year in Moody v. NetChoice made clear that social media platforms have a First Amendment interest in how they curate and display third-party content, the output of which constitutes a distinctive ""expressive product."" Overriding their expressive choices impinges on their right to editorial discretion. Moreover, the government has no valid interest in ""improving, or better balancing, the marketplace of ideas."" These constitutional principles directly apply to possible consumer protection or antitrust claims that the FTC might bring. The courts wouldn't grant an injunction requiring platforms to carry particular speech or speakers. In the context of antitrust law, this goes back to the 1945 decision in Associated Press v. United States , where the Supreme Court noted that the government could not ""compel AP or its members to permit publication of anything which their 'reason' tells them should not be published."" The FTC could exercise its consumer-protection jurisdiction to allege the tech platforms were engaged in ""unfair or deceptive acts or practices"" if they violated their own content moderation policies or other representations made to consumers. It's even possible that the commission could legally require the platforms to grant more transparency about their moderation decisions. But the First Amendment protects platforms' ability to set and change their own policies as they see fit in order to create their own ""expressive product."" In other words, the FTC couldn't do much about a tech platform explicitly deciding to ""censor"" speech it doesn't like since it is a private party. The FTC could also allege collusion, whether among technology platforms or among advertisers, that led to similar moderation policies and decisions. Assuming that the FTC could make out such a case (which is by no means obvious), the First Amendment protects not only platforms' right to make their own editorial decisions but also advertisers' right to decide whether to buy ads on particular platforms. While antitrust laws can apply to speech platforms' economic conduct, remedies may not extend to forced carriage or funding of any particular speech or speaker. There are good reasons to be wary of platform censorship. Last year's Murthy v. Missouri decision limited individuals' ability to bring claims of backdoor government censorship. Further action by Congress or the executive branch may, therefore, be needed to encourage transparency and limit government pressure campaigns. But any such changes would need to recognize that the First Amendment protects tech platforms as private actors with a right to editorial discretion over their ""expressive products."" Ben Sperry is a senior scholar with the International Center for Law & Economics.",Washington Examiner,2025-02-27T11:00:00+00:00,,Commentary,https://www.washingtonexaminer.com/restoring-america/patriotism-unity/3331211/can-ftc-stop-big-tech-censorship/
