title,text,site,date,category,class,url
Horrified Taylor Swift Realizes Football Happens Every Year,"KANSAS CITY, MO—Growing increasingly alarmed as she stared at her boyfriend Travis Kelce's upcoming 2024 schedule, a horrified Taylor Swift reportedly realized for the first time Friday that football happens every year. ""So football...that's not just a thing Travis did last fall for a couple of months—that's something that's going to happen again and again?"" said a wincing, shuddering Swift, who added that she had assumed she would never again need to dress up in Chiefs merchandise, buy out stadium boxes, or hang out in Kansas City after Kelce and his team won the Super Bowl last year. ""Oh wow. I thought Brittany Mahomes was joking when she said she'd see me again soon. How many games are there this year? 17? And that's not counting the playoffs. Hoo boy. Guess I better start scheduling more stops on the Eras tour."" At press time, Swift was seen googling how long it took for CTE to kick in and end a football player's career forever.",The Onion,2024-09-06T17:57:58+00:00,Entertainment,Satire,https://theonion.com/horrified-taylor-swift-realizes-football-happens-every-year/
Trump Avoids Answering Hard Questions By Pretending He Shot In Ear Again,"PHILADELPHIA—Deflecting moderators' efforts to pin down his policy positions during Tuesday's presidential debate, Donald Trump reportedly avoided difficult questions throughout the evening by pretending he had just taken another bullet to the ear. ""What? I honestly can't hear you right now because someone's trying to murder me and I've been shot in my ear—again!"" the former president replied when asked by ABC's Linsey Davis about his shifting stance on reproductive rights, later pointing to his ear and moaning loudly when invited to explain why voters should support him in 2024 given his efforts to overturn the results of the 2020 election. ""Ouch, ouch, this really hurts! You seriously expect me to talk about the four different criminal cases against me when I'm up here bleeding because of an attempt on my life? You should spend less time asking about Project 2025 and more time finding the guy who definitely just shot me. Wait, there he goes! I'll go after him!"" At press time, reports confirmed moderator David Muir had been shot and killed by Secret Service agents tasked with protecting Trump.",The Onion,2024-09-11T01:41:22+00:00,Politics,Satire,https://theonion.com/trump-avoids-answering-hard-questions-by-pretending-he-shot-in-ear-again/
Man Replies ‘STOP’ To Political Fundraiser Text Like Powerful Wizard Casting Spell To Ward Off Mythical Beast,"CHICAGO—In an act of astonishing fortitude that showed he drew upon a seemingly endless well of mystic strength, local man Anthony Palmer reportedly replied ""STOP"" Thursday to a political fundraiser text like a powerful wizard casting a spell to ward off a mythical beast. Sources confirmed that moments after receiving the Kamala Harris fundraising message, the accountant typed out his short reply with the certainty of one familiar with an ancient elven tongue summoning an arcane incantation known as the Shield of Thar'Ghal to protect both him and his party of halflings and dwarves from a charging monster escaped from the depths of the underworld. Several reports indicated that as Palmer leapt into action to counter the malign text, he mumbled to himself with distaste not unlike a wizened sorcerer from the Far Westlands bellowing, ""Begone, ye evil creature!"" According to bystanders, the accountant's fingers then confidently tapped out the four capital letters of the unstoppable reply as if he were using an unimaginably powerful staff to draw out the Elements of the Earth and Netherearth that would allow him to fend off the most ferocious of Darklings. At press time, Palmer was said to have sent off his reply with satisfaction, only to then receive a separate text from Bernie Sanders begging him to help, much like the wise-but-arrogant enchanter feeling the grasp of one of the monster's tendrils around his ankle just as he turned his back.",The Onion,2024-09-12T12:00:00+00:00,Local,Satire,https://theonion.com/man-replies-stop-to-political-fundraiser-text-like-powerful-wizard-casting-spell-to-ward-off-mythical-beast/
Scarecrow Has Double Ds,"AFTON, WI—Remarking on the hay-stuffed decoy's surprisingly shapely form, passersby reported Friday that a scarecrow in a local cornfield boasted double-D breasts. ""Damn, she's got hay in all the right places, don't she?"" area man Jim Bickford said to a group of visibly dumbstruck bystanders who either leered and catcalled or stood with jaws agape as they contemplated the ample, overstuffed bust straining against the straw mannequin's faded, stretched-out blouse. ""Them buttons is fixin' to pop right off! Man, I wouldn't mind getting my hands around those knotted nests of brittle sticks and hay. Her burlap face ain't too bad, either."" At press time there were multiple injuries reported among local men who scratched their faces on stray twigs and straw while attempting to motorboat the scarecrow.",The Onion,2024-09-20T12:00:00+00:00,Local,Satire,https://theonion.com/scarecrow-has-double-ds/
‘The Onion’ Officially Endorses Joe Biden For President,"Throughout its venerable 268-year reign,The Onionhas always made it a top priority to endorse the correct presidential candidates. From George Washington to Richard Nixon to Donald Trump, this institution's highly respected editorial board has had its finger on the pulse, and has accurately backed the winner of every single national election in this country's long and storied history. Now, with our nation at a pivotal crossroads,The Onion's editorial board faces its most difficult decision yet. That's why we have chosen to officially endorse Joseph R. Biden for president of the United States. To our loyal, handsome, and stunningly brilliant readers, please know thatThe Onion's latest foray into the 2024 election does not come lightly. In these unprecedented times of misinformation and political violence, everyone from left-wing activists to Silicon Valley megadonors attempted to dissuade us from endorsing Joe Biden at this moment in time. ButThe Onionand its six-member editorial board do not listen to outsiders. Nor do we listen to data, facts, polls, the U.S. government, or the widely panned Geneva Conventions. It is with great pride that this institution officially throws its full and unequivocal support behind Joe Biden, despite many across the political spectrum, including the entire Democratic Party, saying ""it's too late"" and we are ""doing more harm than good."" For months, our editorial board has agonized over this momentous decision. Initially, we'd hoped to publish our endorsement on June 27, 2024, in the hours after Joe Biden's first televised debate against Donald Trump. Then, we'd hoped to publish it a few days later, following Biden's highly anticipated July 5 interview with George Stephanopoulos. Now, on Oct. 2, 2024, we are finally doing what we should have done months ago: Buck tradition, put our reputation on the line, and take a position thatTheNew York Times,TheWashington Post, and other so-called ""papers of record"" are too cowardly to even consider this late in the election. Lest readers doubt the value of our endorsement, we ask them to remember 2016, when voter complacency almost put Hillary Clinton in the White House beforeThe Onionstepped in. Joe Biden may be young by Washington standards, but he's packed a lot into 81 short years. He's fought hard for working Americans, be they on the factory line or on the board of Blackstone Group. He's stood up to everyone who threatened this great nation, from Vladimir Putin to Anita Hill. And he supports women and minorities, based on that seemingly random lady he chose to be his vice president. And soThe Onionhumbly requests that on Nov. 5 you remember our editorial board's courageous, measured, and well-reasoned endorsement of Joseph R. Biden. But if, for some incomprehensible reason, this fails to resonate with the American public, we will be proud to endorse Asa Hutchinson as a backup. Tu Stultus Es, The Onion Editorial Board",The Onion,2024-10-02T15:10:12+00:00,Editorials,Satire,https://theonion.com/the-onion-officially-endorses-joe-biden-for-president/
Texas Sex Ed Class Teaches Boys How To Cheat On Pregnant Wife,"RICHARDSON, TX—In an effort to help his students one day navigate the harsh realities of an adult relationship, local sex ed teacher Robert Emerson reportedly spent class Wednesday teaching male students how to cheat on their pregnant wives. ""Over the 9 months a woman carries a child, her body will change a lot, making it all the more necessary for you to have a hot young slam piece to bang on the side,"" Emerson said before telling the room full of seventh-grade boys that it was perfectly natural for a man whose wife is pregnant to want to send flirty messages to beautiful women on social media, give his number to a hot young waitress, or hit on his wife's attractive younger sister. ""At 3 months, you'll want to keep things casual and mostly send sexually explicit photos to your 'lady friend.' Then, by 6 months, you'll likely have escalated to meeting up on weeknights at a local motel. By 9 months, your wife will definitely be suspicious and demand to see your phone, but that's when you gaslight her and tell her she's crazy."" According to sources, Emerson later distributed sacks of flour to all his students to simulate what it's like to be a father turning his young child against their mother after a divorce.",The Onion,2024-10-02T15:06:11+00:00,News,Satire,https://theonion.com/texas-sex-ed-class-teaches-boys-how-to-cheat-on-pregnant-wife/
Sabrina Carpenter Completes Mandatory Service In South Korean Military,"SEOUL, SOUTH KOREA—Following the conclusion of her 18-month hiatus from music, pop star Sabrina Carpenter confirmed Wednesday that she had completed her mandatory South Korean military service. ""It was the honor of a lifetime to do my patriotic duty by serving in the Republic of Korea's armed forces, but I'm looking forward to my next chapter,"" said Carpenter, who emphasized that she had learned a lot about herself during her time completing basic training, learning to operate field artillery, and serving as a guard in the demilitarized zone. ""I'm so grateful to my fans for their patience and for keeping me in their thoughts. New music and even a tour is coming soon. Plus, my hair has finally grown out from that buzz cut, and it looks great. Stay tuned!"" At press time, pop fans were reportedly crossing their fingers that Chappell Roan and Tate McRae would be discharged next.",The Onion,2024-10-02T15:04:27+00:00,Entertainment,Satire,https://theonion.com/sabrina-carpenter-completes-mandatory-service-in-south-korean-military/
North Carolina Family Informed Their Insurance Policy Voided Once House Gets Wet,"ASHEVILLE, NC—Saying he wished there was more he could do to help as he pointed out a clause that showed he didn't have to, a representative from an insurance company explained to local residents Stan and Loretta Coleman on Thursday that their policy was voided the moment their house got wet. ""Unfortunately, the coverage you paid for doesn't extend to any situation where there is water in, on, or around your home,"" said Pat Treacy, a claims adjuster at Countrywide Mutual Insurance who informed the Colemans that their policy had actually been voided the moment they first filled their bathtub or ran water from their sinks. ""It's industry standard, I'm afraid. Houses just aren't meant to get wet. No insurance company anywhere would take on that kind of liability. If it's possible to prove the house remained dry during the storm, and it just sort of fell down on its own, then maybe a case could be made for approving your claim."" Treacy went on to wish the Coleman family well and said he would keep an eye out for them on GoFundMe.",The Onion,2024-10-03T20:39:53+00:00,News,Satire,https://theonion.com/north-carolina-family-informed-their-insurance-policy-voided-once-house-gets-wet/
Grandma Who Survived Great Depression Casually Drops That She Once Killed Man For Mayonnaise,"LOUISVILLE, KY—In a wide-ranging conversation about the hardships and difficult choices her family had faced during the Great Depression, local grandmother Mary Sipple casually mentioned Tuesday that in August 1937 she took the life of a man who refused to give up a jar of mayonnaise. ""She just crushed his skull with a rock and said a prayer while he bled out,"" said Sipple's granddaughter Sarah Green, explaining that her grandmother had managed to make the mayonnaise last until spring, right around the time the dead man's body—which she had carefully weighed down and dumped into the Ohio River—washed up in the next county. ""Grandma told me she was tired of having nothing to put between two slices of bread. So when she saw the man with his jar of Hellmann's, she made him a proposition: He could either give her the mayonnaise, or he could die. I asked her how she felt about this now, and she just said sandwich spreads were hard to come by back then and the man had made his choice."" At press time, Sipple was reportedly listing on her fingers the various other items—eggs, flour, chewing gum, an Indian head nickel—she had killed people over during the worst economic crisis in American history.",The Onion,2024-10-08T19:41:24+00:00,Local,Satire,https://theonion.com/grandma-who-survived-great-depression-casually-drops-that-she-once-killed-man-for-mayonnaise/
Piss-Soaked Tucker Carlson Claims Demon Urinated On Him While He Slept,"BRYANT POND, ME—Describing the moment as a ""transformative experience"" that inspired him to embrace God and read the Bible, a piss-soaked Tucker Carlson claimed Friday that a demon had urinated on him while he was sleeping. ""One moment I was asleep in bed, and the next, my boxers were absolutely soaked with what could only be the urine of an evil spirit,"" said the former Fox News host, who added that while he did not previously consider himself a religious person, everything changed when he woke up to a rush of hot liquid covering his groin. ""Lying there, I felt this terrible pressure in my bladder, almost as if a demon was sitting on it. Then it unleashed a torrent of urine that drenched my pajamas and my mattress, which still bear the scars."" At press time, Carlson claimed that embracing God had successfully helped ward off every evil spirit except for the one that occasionally visits him and covers the inside of his underwear in semen.",The Onion,2024-11-01T17:41:12+00:00,News,Satire,https://theonion.com/piss-soaked-tucker-carlson-claims-demon-urinated-on-him-while-he-slept/
Trump Calls Harris To Congratulate Himself On Winning,"PALM BEACH, FL—In a five-minute phone call that both campaigns described as largely cordial, President-elect Donald Trump reportedly called Vice President Kamala Harris Wednesday morning to congratulate himself on winning. ""Madame Vice President, I want to be the first to congratulate myself on running one heck of a campaign, and to let you know I'm doing everything in my power to ensure the Trump administration has a smooth transition to the White House,"" said Trump, telling an entirely silent Harris that it had been the honor of his life to have been in this race with himself, and extending his genuine gratitude for everything he had done to keep the race civil, even at its most heated. ""I'll tell you what, despite everything—I know it's been a hard-fought race—but I've really always secretly admired myself. No, I'm serious here, I really am. Just believe me when I say this: Yesterday the better man won, which was me."" According to reports, Harris half-heartedly muttered, ""Thank you, Donald,"" before hanging up the phone.",The Onion,2024-11-06T15:22:32+00:00,Politics,Satire,https://theonion.com/trump-calls-harris-to-congratulate-himself-on-winning/
America Defeats America,"WASHINGTON—In a historic outcome that promised to halt the rising scourge of the United States in its tracks, America has defeated America at the ballot box, sources confirmed Wednesday. ""After 248 years of tense and often divisive conflict, we can finally say, as of this morning, that the nation turned out at the polls and delivered a decisive blow to the nation,"" said electoral analyst Kurt Howitzer, describing the results as a remarkable triumph of the democratic experiment over democracy. ""It's a stunning turn of events. But it really shows the power of one citizenry to come together and prevail over themselves. The message was loud and clear: We are sick and tired of our country, and we want it to end."" At press time, millions of emotional Americans had reportedly gathered on the National Mall in an impromptu celebration of their resounding victory over the forces of liberty and equality.",The Onion,2024-11-06T19:08:00+00:00,Politics,Satire,https://theonion.com/america-defeats-america/
"Man Forgetting Difference Between Meteoroid, Meteorite Struggles To Describe What Just Killed His Dog","TORONTO—Though he tried hard to recall what he had learned about space rocks back in middle school, local man Jason Nieto reportedly forgot the difference between meteoroids and meteorites Thursday, struggling to describe what had just killed his dog. ""God, I always forgot which one is the kind that actually hits the ground, if that's even the difference, so I'm not sure what just crushed Churro,"" said Nieto, explaining that the meteorite or meteoroid—or maybe asteroid, if that was a category including all of them—came streaking out of the clouds while he was walking his Pomeranian in the park. ""If it hadn't left a crater where Churro was and had just burned up in the atmosphere, then that's a meteoroid, right? One of them kills dogs in space in orbit, and the other kills dogs on Earth. I just can't remember which is which. Oh wait, shit, there's also just a 'meteor' too, isn't there? What am I supposed to tell the vet when I bring the ashes over?"" At press time, reports confirmed a stumped Nieto was frantically searching his phone to see if it mattered that the space rock had exploded when it hit his dog.",The Onion,2024-11-14T13:00:00+00:00,Local,Satire,https://theonion.com/man-forgetting-difference-between-meteoroid-meteorite-struggles-to-describe-what-just-killed-his-dog/
Every Movement In Man’s Burrito-Eating Technique Informed By Past Burrito Tragedies,"GLENDALE, CA—Rotating the tortilla-wrapped meal to consume the Mexican food in even levels, eyewitnesses reported Thursday that every movement in local man Eddy Azarian's burrito-eating technique has been informed by past burrito tragedies. ""You can see how he massages the outside to get an a well-balanced distribution of ingredients as he goes, so you know that's a man who has lost some carne asada to a floor before,"" said friend Mike Fuentes, who noted the concentration on Azarian's face as he rolled down the foil to form an even and tactile seam out of biting range. ""Just look at that grip, perfectly spaced and easy to shift on the fly. And then he rolls it at regular intervals, making sure none of the juices or grease pool in one area and leaks out. You know every memory of rice spilling out or guacamole getting lumped in a corner is running through his head as he works. The way he takes a bite from the center and then works to the exterior so nothing is at risk of spilling. He's seen too many burrito catastrophes for one lifetime and he doesn't want to experience one again."" At press time, Azarian was reaching for a napkin after propping up his burrito against a cup of fountain soda he assumed to be full enough.",The Onion,2024-11-21T13:00:00+00:00,Local,Satire,https://theonion.com/every-movement-in-mans-burrito-eating-technique-informed-by-past-burrito-tragedies/
Turkey-Weary Nation Makes Triumphant Return To Eating Shrimp,"WASHINGTON—At long last able to rejoice as its days of wandering in a culinary desert reached an end, the nation's turkey-weary populace has made a triumphant return to eating shrimp, crustacean-munching sources confirmed Wednesday. ""Thanksgiving was tough, Christmas was even tougher, but at last our freezers are free of turkey leftovers and shrimp can return to its rightful place in our mouths, stomachs, and hearts,"" said exultant seafood lover Ellen Bates, echoing the sentiments of millions of grinning Americans who clutched multiple shrimp-laden skewers in their hands and cheered as fishing trawlers loaded with shrimp pulled into harbors up and down the nation's coasts. ""No more must we suffer the indignity of boring, reheated turkey. Now we can consume dozens upon dozens of shrimp each day in all of shrimp's miraculous forms: Popcorn. Scampi. Cocktail. Tempura. Ceviche—yes, God, ceviche! Never again will I take the fisherman's platter for granted. Our long, dark night of Butterball is over, and a golden time of shrimp has dawned over America once more!"" At press time, 340 million Americans were reportedly in the bathroom and not feeling so well.",The Onion,2025-01-01T15:53:05+00:00,News,Satire,https://theonion.com/turkey-weary-nation-makes-triumphant-return-to-eating-shrimp/
"Duracell Removes Frosting, Sprinkles To Discourage Kids From Eating Batteries","CHICAGO—Acknowledging that candy-coated batteries were an iconic part of the brand's legacy, Duracell announced Thursday that it would be removing frosting and sprinkles from its manufacturing process to discourage children from eating the company's products. ""When parents shared with us their concerns about our practice of selling batteries with delicious, sugary toppings, we listened,"" said Duracell spokesperson Nick Miaritis, who added that the battery manufacturer would also be removing the whipped cream and maraschino cherries from atop its AA and AAA varieties effective immediately. ""We understand that batteries will inevitably find their way into the hands of kids, some of whom are too young to understand that Duracell's trademark chocolate, caramel, and nougat center—while very tasty—is not something they are supposed to put in their mouths. Don't worry, though: Our batteries will continue to power your flashlights and TV remotes. They'll just be doing it without that irresistibly sweet Duracell taste."" Reached for further comment, Duracell officials confirmed the company had no plans to discontinue its popular 9-volt Cheese-Blasted batteries.",The Onion,2025-01-02T15:07:42+00:00,News,Satire,https://theonion.com/duracell-removes-frosting-sprinkles-to-discourage-kids-from-eating-batteries/
Man Decides Eating Lunch Without Headphones On Counts As Meditating,"CHARLESTON, SC—Remarking that the unexpected moment of solitude was ""good enough for him,"" local man Alan Stambaugh told reporters Thursday that eating lunch without headphones counted as mediating. ""In terms of practicing mindfulness, accidentally leaving my AirPods at my desk when I went to eat my sandwich basically did the job,"" said Stambaugh, adding that the 10 minutes he spent ingesting his meal without listening to a single podcast, song, or work call was the equivalent of calmly focusing on every breath. ""Eating a turkey club alone in silence more or less got me to a place where I achieved total mental clarity. It was pretty fucking zen."" Stambaugh later confirmed he had reached a state of nirvana and transcended space and time after he completed his entire drive home without once looking at his phone.",The Onion,2025-01-02T15:10:44+00:00,Local,Satire,https://theonion.com/man-decides-eating-lunch-without-headphones-on-counts-as-meditating/
Tips For Picking Out Running Shoes,"With the start of a new year, many Americans will be engaging in new fitness routines, with jogging being among the most popular. Here are tips for finding the selecting running shoes. Decide the level of cushioning based on if you're a back runner, side runner, or stomach runner. Go up a size to leave room for blisters. Count how many feet you have to determine your optimal number of shoes. Salespeople will often allow you to test run shoes as long as they can ride along on your back. Hokas make you appear both taller and wealthier. Pause during cutscenes so you can figure out what type of sneakers Sonic is wearing. Choose a colorway that will complement months of dust. When trying on shoes, wear the same kind of socks and banana costume you usually have on while running. Reflective designs can help drivers spot your body laying in the street after they run you down.",The Onion,2025-01-02T15:13:54+00:00,Local,Satire,https://theonion.com/tips-for-picking-out-running-shoes/
Man Injured Protecting Wife From Polar Bear,"A man has sustained serious injuries after rescuing his wife who was ambushed by a polar bear in an early morning attack, leaping on to the animal to prevent an attack after the woman slipped to the ground. What doyouthink? ""Only an asshole would interrupt a stranger's meal like that."" ""Him getting injured must have been such a turn-off."" ""God forbid a woman gets to sustain her own serious injuries.""",The Onion,2025-01-02T20:21:39+00:00,American Voices,Satire,https://theonion.com/man-injured-protecting-wife-from-polar-bear/
