title,text,site,date,category,class,url
Drake Drops New Track Inviting Kendrick Lamar Out To Coffee So They Can Clear Things Up,"TORONTO—In a stunning twist to the feud between the two hip-hop artists, Drake reportedly dropped a new track Monday inviting Kendrick Lamar out to coffee so they could clear things up. ""The truth is, Kendrick, I think you're a sweetie / Does 2 p.m. work, or maybe 3?"" Drake raps in his new single titled ""I Miss You, Buddy,"" in which the 37-year-old Canadian rapper apologizes for the miscommunication that has derailed the two former collaborators' friendship and suggests they meet up on a day Lamar isn't too busy to see if they can mend things. ""I think it'd be nice if we grabbed some coffee / I have a Tim Hortons gift card that's worth at least twenty / Order whatever you like, this one's on me."" At press time, Kendrick Lamar had responded with a new track titled ""Water Under The Bridge (Love You, Man).""",The Onion,2024-05-06T17:56:00+00:00,Entertainment,Satire,https://theonion.com/drake-drops-new-track-inviting-kendrick-lamar-out-to-co-1851458534/
Perdue Announces Initiative To Even The Playing Field By Giving Chickens Guns,"SALISBURY, MD—Emphasizing that it was an integral part of the company's mission to raise humanely sourced meat, poultry processing giant Perdue Farms announced a new initiative Tuesday to even the playing field by giving guns to chickens. ""At Perdue, we always strive to ensure animals are treated with dignity and respect, and today we expand upon that commitment by handing each bird a loaded pistol and allowing them a fair chance to escape,"" said Perdue spokesperson Jamie Walton, describing a new policy under which each chicken would be issued a weapon with a single round in the chamber and given an opportunity to kill their captor with a well-placed bullet before they could be taken to slaughter. ""They should get one clean shot. That's just good sportsmanship. So from now on, every chicken in our Perdue facilities will have free and easy access to firearms. We may lose some staff to gunshot wounds, but everyone involved—human or fowl—will have an opportunity to defend themselves. It's only right."" At press time, sources confirmed a shift in the balance of power at several Perdue processing plants had resulted in thousands of employees being slaughter with assembly-line efficiency.",The Onion,2024-05-14T15:40:00+00:00,News,Satire,https://theonion.com/perdue-announces-initiative-to-even-the-playing-field-b-1851423157/
New Florida Law Requires All Women To Produce 3 Healthy White Sons By 22nd Birthday,"TALLAHASSEE, FL—Touting the legislation as a common-sense victory for family values, Gov. Ron DeSantis (R) signed a new law Thursday requiring all Florida women to produce three healthy, white sons by the date of their 22nd birthday. ""The production of white daughters will not be penalized, but they will be seized by the state for the production of white sons,"" said DeSantis, who clarified that regardless of the race, ethnicity, or religious background of the mother, all sons would be required to be both white and raised in a Catholic household. ""Three is the bare minimum. Despite what the virtue-signaling, left-wing fanatics are espousing on CNN, this requirement is actually quite fair and attainable. Whether Florida women and girls choose to get started at age 15 or 19, they will have plenty of time to comply."" At press time, DeSantis added that a miscarriage counted as negative one white sons.",The Onion,2024-05-16T18:20:00+00:00,Politics,Satire,https://theonion.com/new-florida-law-requires-all-women-to-produce-3-healthy-1851482288/
Everyone In ER Bit Off Finger While Holding Sandwich,"INDIANAPOLIS—Admitted with complaints that it had been hard to tell the difference between their fingers and their food, everyone in Unity Medical Center emergency room Friday had bitten a digit off their hand while holding a sandwich, according to hospital officials. ""At the present time, every bed in our ER is occupied by someone who inadvertently chewed their finger down to a nub while enjoying a chicken club, Reuben, or tuna melt,"" ER administrator Lauren Calpert told reporters, explaining that the detached appendages had visible teeth marks well past the second knuckle, which she said was an indication that most of the patients had taken more than one bite of their finger. ""Many of these individuals confirmed they felt pain while biting into their sandwich, but said they were so hungry for their lunch they continued eating anyway, not realizing that what they had assumed was mortadella or pepper jack cheese was actually a part of their body. We'll do our best to reattach the fingers that weren't swallowed, but that isn't going to prevent these patients from chewing them off again the next time they eat a gyro or cheesesteak."" At press time, saying they really needed something to wash down their sandwich with, several of the patients reportedly failed to realize they were drinking the blood from their wounded hand.",The Onion,2024-05-24T10:00:00+00:00,Local,Satire,https://theonion.com/everyone-in-er-bit-off-finger-while-holding-sandwich-1851488798/
Cult Leader Not Even Charismatic,"NEW YORK—Baffled by the woman's sway over her millions of acolytes, sources confirmed Monday that local cult leader Taylor Swift, 34, was not even charismatic. ""Typically, the cult leaders I study are highly persuasive individuals with magnetic personalities—Ms. Swift, however, presents a unique case,"" said cult expert and psychologist Professor Marion Douglass, who called it ""bizarre"" that so many young, impressionable women had pledged their devotion to the artist when there were so many other personalities out there who were leagues more magnetic. ""She's managed to amass these so-called Swifties without a drop of charm. It can't be her doctrine they're drawn to, because that is not particularly inspiring either. We know these followers would kill for her, but the question is, why?"" Douglass went on to hypothesize that perhaps Swift was blackmailing her followers with sordid details of their personal lives she had obtained through fan letters.",The Onion,2024-06-03T10:15:00+00:00,Entertainment,Satire,https://theonion.com/cult-leader-not-even-charismatic-1851512851/
Embarrassed David Attenborough Realizes He Spent 10 Minutes Describing Stillness Of Duck Decoy,"CHELMSFORD, ENGLAND—Interrupting his hushed narration about the inanimate bird's majesty as he observed it from a small boat, an embarrassed David Attenborough reportedly realized Friday that he had just spent the past 10 minutes describing the stillness of a duck decoy. ""The male mallard is a temperate waterfowl, known for its remarkable ability not to blink or even move for minute after minute—wait a second, oh, goddammit, really?"" said the renowned naturalist, who grew visibly flustered as he squinted at the wooden bird, cutting off his own monologue praising the ""incredible display of commitment and near-woodenness"" on the part of the nonliving bird in order to scream with frustration. ""I guess I wasn't wrong to say how serene it looks, but...Jesus Christ. No one could have told me? No one? Fuck all of you. Seriously. Well, I suppose I should have learned my lesson when I tried to speak to that scarecrow in Mozambique."" At press time, Attenborough was spotted chewing out a flustered assistant director of photography and insisting that he needed to delete the footage immediately.",The Onion,2024-06-07T10:15:00+00:00,Entertainment,Satire,https://theonion.com/embarrassed-david-attenborough-realizes-he-spent-10-min-1851512951/
Newest U.S. Aid Mission Just Single PowerBar Labeled ‘For Gaza’ Thrown Into Ocean,"WASHINGTON—With more than 2 million displaced Palestinians facing the threat of famine, the U.S. Agency for International Development announced Monday it had fulfilled its pledge to provide food assistance, throwing a single PowerBar labeled ""for Gaza"" into the Atlantic Ocean. USAID reportedly alerted the war-torn region to be on the lookout for the foil-wrapped item, which the agency is counting on to float eastward from North America toward the Mediterranean Sea, and which includes a handwritten note with the instruction ""DO NOT EAT unless Palestinian"" underlined four times. According to officials, the en-route ProteinPlus PowerBar contains a full 20 grams of proteins and will ameliorate the catastrophic hunger presently being endured by a significant percentage of Gazans, so long as whoever finds it agrees to share it. Insiders confirmed that with the right currents and weather patterns, the chocolate-flavored meal replacement should reach Gaza by 2035, only two years after the expiration date.",The Onion,2024-06-17T10:30:00+00:00,News,Satire,https://theonion.com/newest-u-s-aid-mission-just-single-powerbar-labeled-f-1851540802/
Report: Every Place On Earth Has Wrong Amount Of Water,"RESTON, VA—A new global report released Monday by the U.S. Geological Survey revealed that every place on earth currently has the wrong amount of water. ""New satellite data confirms that every corner of the earth has the incorrect quantity of water,"" the report read in part, noting that even though the total amount of water on the planet seemed to be about right, give or take a few hundred milliliters, the distribution of that water across the globe was ""way off."" ""In every case, there is either too much or too little water, with zero exceptions. Even when we try to move it around ourselves to make it even, someone keeps moving it back. It's very frustrating."" The USGS did, however, note that the amount of fire on earth had been properly disbursed.",The Onion,2024-06-17T17:55:00+00:00,News,Satire,https://theonion.com/report-every-place-on-earth-has-wrong-amount-of-water-1851544516/
NASA Warns Space Hawk Has Swooped In And Picked Up Earth For Nest,"WASHINGTON—Sounding the alarm that a cosmic bird of prey had clamped its talons onto the planet, NASA warned Thursday that a space hawk had swooped in and picked up the Earth for its nest of hungry space chicks. ""We are on high alert after our satellite imaging confirmed that a quite sizable space hawk has in fact descended on Earth and carried it off with the intention of feeding our planet to its interstellar hatchlings,"" said NASA administrator Bill Nelson, who explained that the space hawk had used its keen extrasolar vision to pinpoint Earth's blue seas from hundreds of light-years away, allowing the cosmic raptor to pluck our rocky planet right from its orbit. ""Given the evidence we've obtained from observing distant exoplanets, the space hawk will first tear apart the Earth and give bite-sized pieces of our home world to its young. We do not have long before we are devoured and used as sustenance for the next generation of galactic apex predators."" At press time, a supernova had reportedly frightened the space hawk, causing it to drop Earth into a black hole.",The Onion,2024-06-20T12:00:00+00:00,News,Satire,https://theonion.com/nasa-warns-space-hawk-has-swooped-in-and-picked-up-eart-1851544578/
Clarence Thomas Torn Over Case Where Both Sides Offer Compelling Scuba Trips,"WASHINGTON—Admitting that he had never been more conflicted about a ruling in his life, Supreme Court Justice Clarence Thomas was reportedly torn Monday over a case in which both sides offered compelling scuba trips. ""While there's a strong historical precedent for a lavish excursion to Bali, the plaintiff has instead taken a more unorthodox approach and presented an all-expenses-paid diving trip off the shores of Aruba,"" said a thoughtful, inquisitive Thomas, adding that while he had supported taking vacations with donors to Southeast Asia for years, he was starting to see the appeal of visiting the white sandy shores of the Caribbean. ""In their arguments, the defense made a detailed case that perhaps this summer I need three weeks with my family on a luxury yacht in the Pacific, complete with my own scuba instructor and private chef. But the plaintiff has repeatedly claimed he can get me more in Aruba. He even said I could swim with a shark. And I've always wanted to do that."" At press time, Thomas called for a short recess to give the matter more thought, as whichever choice he made could have dire consequences for decades of his luxury vacations.",The Onion,2024-07-01T11:00:00+00:00,News,Satire,https://theonion.com/clarence-thomas-torn-over-case-where-both-sides-offer-c-1851566812/
Democrats Panic After Kamala Harris Ages 40 Years In Single Night,"WASHINGTON—Arriving for a campaign strategy session with the vice president and staring in disbelief at her frail, hunched-over form, top Democratic Party officials reportedly began panicking Monday after they discovered Kamala Harris had aged 40 years in a single night. ""What the hell happened to her? She was only 59 yesterday,"" the visibly distraught DNC chair Jaime Harrison said after the party's new presumptive nominee began to ask him who he was and then trailed off, her cloudy eyes glossing over beneath a wisp of stark-white hair and her skin now wrinkled and liver-spotted. ""She's been rambling about all kinds of nonsense, and she keeps calling everyone ""buster."" No, Madam Vice President, I'm not your stepson, and I'm not here to take you back to California. Goddammit, she's too far gone to even formulate a coherent argument for abortion rights. Someone better call [California Gov. Gavin] Newsom and make sure he still remembers his own name."" At press time, sources confirmed prominent members of the party had been instructed to quickly shift their support to a spry, cogent 31-year-old Joe Biden, who had somehow de-aged 50 years overnight.",The Onion,2024-07-22T18:55:00+00:00,Politics,Satire,https://theonion.com/democrats-panic-after-kamala-harris-ages-40-years-in-si-1851601473/
Congress Bans Roofs,"WASHINGTON—In response to the attempted assassination of former President Donald Trump at a rally in Pennsylvania over the weekend, Congress moved quickly to pass legislation Monday that bans the civilian use of roofs. ""As our country continues to reel from this horrific event, we in Congress have taken action by enacting a nationwide ban on all roofs, roof terraces, and balconies,"" said House Speaker Mike Johnson, explaining that the would-be assassin, who shot at and nearly killed Trump from atop a building 430 feet away, highlighted just how lax U.S. laws had been in addressing the threat of widespread roof access. ""As we saw on Saturday, the risks of Americans having roofs is far too great to continue allowing our homes, schools, and other buildings to be covered in any way. In terms of public policy, this would seem to be the best option available to us."" Critics of the bill argued that its effectiveness may be limited due to a loophole that would still allow future assassins to fire out of a building's windows.",The Onion,2024-07-15T22:00:00+00:00,News,Satire,https://theonion.com/congress-bans-roofs-1851592883/
News Happening Faster Than Man Can Generate Uninformed Opinions,"NEW YORK—Calling out the unsustainable pace at which historic events seemed to be occurring, local man Brad Gifford told reporters Monday that important news stories were now happening faster than he could generate uninformed opinions about them. ""Look, I'm trying my hardest to scrape together confused takes about everything that's going on in our country, but it's getting harder and harder to come up with enough incoherent perspectives to meet the moment,"" said Gifford, who emphasized that he had already felt stretched thin devising a superficial and deluded reaction to the Trump assassination attempt before Biden's withdrawal from the 2024 campaign sent shock waves through the race. ""Frankly, I'm exhausted here. Just as I'm putting the finishing touches on a worldview about a topic that I don't have even the faintest inkling about, it's like three more news stories pop up out of nowhere in an arena where I genuinely have no idea what the fuck I'm talking about. And again, I really don't know jackshit about anything at all, so how am I supposed to keep up?"" At press time, Gifford added that the only thing helping him keep his head above water was that he did not have to research or think about his opinions at all before putting them out into the world.",The Onion,2024-07-22T17:50:00+00:00,Local,Satire,https://theonion.com/news-happening-faster-than-man-can-generate-uninformed-1851601466/
God Forced To Shave Head After Contracting Plague Of Lice,"THE HEAVENS—Saying He had no choice but to target the painful, itching sensation directly at the source, God Almighty, Creator of the Universe, was reportedly forced to shave his head Thursday after contracting a biblical plague of lice. ""Yesterday, a misdirected divine commandment resulted in all the dust of the heavens turning into lice and swarming through My celestial kingdom,"" spake the Lord, adding that He had laundered His heavenly robes using the machine's highest temperature setting and washed His flowing gray locks with lice shampoo but was still not rid of the blood-sucking insect plague He had brought down upon Himself. ""So I've been forced to cut off the hair I've spent millennia growing out. And if this special nit comb I bought doesn't work, I'll have to shave My beard too. Then I'll really look like an idiot. Or worse, a skinhead."" At press time, sources confirmed a clean-shaven God was looking in the mirror and trying to determine if He could pull off wearing a fedora.",The Onion,2024-07-11T10:00:00+00:00,News,Satire,https://theonion.com/god-forced-to-shave-head-after-contracting-plague-of-li-1851580149/
Environmentalists Warn U.S. Running Out Of Small Wooded Areas Where Buddies Can Smoke Up,"WASHINGTON—In a sobering report on the impact of climate change and deforestation, U.S. environmentalists warned Monday that the nation was running out of small wooded areas where a group of buddies could smoke up. ""Sadly, accelerating levels of industrialization have led us to a point where our nation's stoner communities are being severely threatened, with their habitats disappearing at an alarming rate,"" said environmental scientist Jill Krick-Nelson, adding that the past year had seen a marked increase in real estate developments destroying chill-ass groves previously frequented by young Americans, who use such places to smoke low-quality cannabis from a poorly rolled joint or a pipe fashioned from aluminum foil. ""Without these shaded, secluded areas, millions of American teens have been displaced, making them vulnerable to parents and police. Despite conservation efforts, these endangered populations of buddies will soon be left with no place to get super baked except for truck stop parking lots or the rare garage of a divorced parent."" At press time, Krick-Nelson added that, without an increase in preservation efforts, such teens could also be left without secluded overlooks wherein to sexually experiment in their cars.",The Onion,2024-08-05T10:15:00+00:00,News,Satire,https://theonion.com/environmentalists-warn-u-s-running-out-of-small-wooded-1851609190/
R. Kelly Petitions Supreme Court To Watch Him Pee,"BUTNER, NC—In their latest attempt to have the ""Ignition (Remix)"" singer's 2022 conviction for child pornography overturned, attorneys for disgraced R&B star R. Kelly petitioned the U.S. Supreme Court on Monday to watch him pee. ""Today we ask the court to grant review in this case so that Mr. Robert Kelly is given the opportunity to pee in front of the honorable justices while they watch,"" defense attorney Jennifer Bonjean wrote in a petition for certiorari, noting that R. Kelly had already filed a preliminary motion for the exposure of his penis in open court. ""It is our belief that the federal judiciary should not infringe upon the defendant's right to spray his golden shower before the bench. To deny this appeal would be to undermine the First Amendment's guarantee of free expression as it applies to Mr. Kelly's exercise of limitless, unfettered pissing at any time and place of his choosing."" At press time, sources confirmed R. Kelly's lawyers had withdrawn the petition at their client's request after he discovered all nine Supreme Court justices were above the age of consent.",The Onion,2024-08-05T16:50:00+00:00,Entertainment,Satire,https://theonion.com/r-kelly-petitions-supreme-court-to-watch-him-pee-1851619802rev1723482404693/
Federated Union Of Bear Cub Carcass Dumpers Endorses RFK Jr.,"MONTPELIER, VT—Making the announcement from the steps of the powerful organization's national headquarters, the Federated Union of Bear Cub Carcass Dumpers endorsed Robert F. Kennedy Jr. for president on Monday. ""The Federated Union of Bear Cub Carcass Dumpers stands 100% behind Robert F. Kennedy Jr., the only candidate in the 2024 to have earned an A grade on their bear-dumping scorecard,"" said FUBCCD president Walter Hudkins, who endorsed the independent candidate on behalf of the organization's 300,000 dues-paying members. ""Leaving the carcass of a young black bear in the middle of Central Park is exactly the kind of leadership quality this country sorely needs. In addition to this endorsement, we will be making a $50 million donation to the pro-Kennedy super PAC Bear Dump America. Remember, we dump bear carcasses, and we vote."" At press time, Hudkins added that in contrast, former President Donald Trump had a measly C rating from the organization.",The Onion,2024-08-05T17:22:00+00:00,Politics,Satire,https://theonion.com/federated-union-of-bear-cub-carcass-dumpers-endorses-rf-1851613425/
Glen Powell Opens Up About Dangerous Stunt Work Filming With Sydney Sweeney’s Breasts,"AUSTIN, TX—Giving his fans a glimpse behind the scenes of his work as a top Hollywood leading man, Glen Powell opened up to reporters Friday about doing his own dangerous stunts while filming with Sydney Sweeney's breasts on the set of last year's hit rom-comAnyone But You. ""None of that was CGI—I was really being pummeled by those things,"" said the 35-year-old star, who explained that the movie's producers opted to shoot his scenes live with Sweeney's actual breasts rather than having him perform alone in front of a green screen and adding the cleavage in post-production. ""I came home from the set pretty beaten up every day, but it was worth it to get those raw reactions to the breasts in real time. It's stressful, though, because a single mistake in the blocking of a scene can put you in the hospital. Thankfully, we had a lot of stunt professionals working with us to make sure nothing too serious happened—although I did get a black eye from the left one."" Powell added that his mentor Tom Cruise had given him a lot of helpful advice from his experience filming with Salma Hayek.",The Onion,2024-08-16T18:52:58+00:00,Entertainment,Satire,https://theonion.com/glen-powell-opens-up-about-dangerous-stunt-work-filming-with-sydney-sweeneys-breasts/
JD Vance Accuses Tim Walz Of Stolen Valor For Wearing ‘Grill Master’ Apron,"WASHINGTON—Lambasting the Democratic vice presidential candidate across social media platforms, JD Vance reportedly accused Minnesota Gov. Tim Walz Tuesday of stolen valor for wearing an apron that said ""Grill Master."" ""Tim Walz is a liar—he has never attained the rank of grill master,"" said Vance, attacking Walz for misrepresenting his culinary record in what he claimed was an affront to the real, brave grill masters who wielded spatulas every day. ""I know for a fact that Tim Walz was indoors, in the kitchen, when he wore that grill master apron. I wonder, has he ever been on a real deck? I heard he even abandoned his barbecue when the ice cream truck went by."" At press time, Vance was fending off criticism that he himself had only ever used a George Foreman electric grill.",The Onion,2024-08-13T18:57:35+00:00,Politics,Satire,https://theonion.com/j-d-vance-accuses-tim-walz-of-stolen-valor-for-wearing-1851621120/
Everyone In Restaurant Jealous Of Toddler Who Gets To Wear Pajamas And Watch iPad,"ALBUQUERQUE, NM—Expressing their envy at the child's obviously superior dining experience, everyone sitting in a local restaurant Monday was reportedly jealous of a toddler who got to wear his pajamas and watch an iPad for the whole meal. ""I can't believe this! He doesn't even have to talk to anybody or pay attention to what's going on around him—he gets to just sit and watchBluey,"" said Ray's Italian Bistro patron Finn Delamore, echoing the sentiment of dozens around him who reportedly couldn't help but cast longing looks at the 2-year-old whose eyes were glued to the screen in front of him, his hands clasping a bright red toy fire truck. ""Look at him sitting there in those comfortable jammies, laughing his ass off at Bandit and Chilli as he chows down on little pieces of cut-up chicken. Meanwhile, I'm in my stiff dress shirt, making stilted conversation and eating osso buco like an asshole. What I wouldn't give to trade places with him."" At press time, onlookers had become even more jealous after the toddler got to relieve himself without even having to walk all the way to the restroom.",The Onion,2024-09-02T12:00:00+00:00,News,Satire,https://theonion.com/everyone-in-restaurant-jealous-of-toddler-who-gets-to-wear-pajamas-and-watch-ipad/
