title,text,site,date,category,class,url
Corporate Security Detail Not Sure Why They Guarding Crock-Pot CEO,"NEOSHO, MO—Confused by the sudden directive to ""neutralize any threats"" to the leader of the popular kitchen appliance brand, corporate security officer Tim Mulrooney was reportedly unsure Wednesday why he had been assigned to guard the CEO of Crock-Pot. ""A person from the company called in a panic last week and said the CEO needed to 'beef up' his security detail, but when we asked what sorts of threats he was facing, they just kept saying he'd 'made a lot of enemies lately' and wouldn't elaborate,"" said Mulrooney, who reported for duty in the lobby of the company's small headquarters in rural Missouri along with 12 equally confounded members of the slow-cooker executive's newly enhanced security detail. ""I guess I'd be mad if my Crock-Pot overheated and burned my chili or something, but I can't see getting angry enough to plot an assassination attempt. But oh well, whatever makes him feel safe. We get paid either way."" At press time, sources confirmed Mulrooney and his entire security detail were dead after a katana-wielding assassin rappelled down from the office's ceiling in a surprise attack.",The Onion,2025-01-15T14:38:01+00:00,Local,Satire,https://theonion.com/corporate-security-detail-not-sure-why-they-guarding-crock-pot-ceo/
Elderly Man Sets Sights On Big Chair ,"READING, PA—With a look of hardened resolve crossing the man's face as he discovered the large recliner was unoccupied, witnesses confirmed Wednesday that local elderly resident Robert Delacio had set his sights on a big chair. According to sources, Delacio hobbled determinedly toward the worn gray seat, throwing a sharp stare at a nearby young grandson who had started to make movements in the same direction. Delacio reportedly groaned with anticipation as he quickened the pace of his shuffle, focusing his effort as if every year of his long life had earned him this reward. At press time, sources reported that the elderly man was standing motionless next to the recliner, having successfully reached it and then realized he had no viable strategy for sitting down.",The Onion,2025-01-15T14:39:29+00:00,Local,Satire,https://theonion.com/elderly-man-sets-sights-on-big-chair/
LAPD Arrests Everyone Who Lost Home In Fire,"LOS ANGELES—Saying such individuals posed a threat to the safety and security of all city residents, the Los Angeles Police Department announced Thursday that it had arrested everyone who lost their home in the ongoing wildfires. ""In the interest of maintaining public order, I have instructed my officers to round up any suspicious person whose domicile was recently destroyed in the fires,"" said LAPD police chief Jim McDonnell, stressing that his units had already detained ""thousands of such indigent characters"" in neighborhoods ravaged by the Palisades, Eaton, and Hurst wildfires. ""Just because your dwelling has been reduced to smoldering ash does not give you the excuse to make other residents feel unsafe by begging for water or clothing. It drives down property value, and frankly, it's unsightly to have someone going around in their charred rags and asking for handouts. Enough is enough. For any stragglers still out there, we are demanding you clear out of public places tonight, or the department will be forced to take more drastic action."" McDonnell also announced a massive overnight raid on what he called the ""illegal shantytowns"" erected by the Red Cross.",The Onion,2025-01-16T15:41:38+00:00,News,Satire,https://theonion.com/lapd-arrests-everyone-who-lost-home-in-fire/
Nursing Home Told Man Playing Accordion For Them Is Billy Joel,"SOUTH PLAINFIELD, NJ—Having been informed that he canceled a major stop on his big world tour just to be with them on a Thursday afternoon, residents at Golden Horizons Senior Care Center were told the man playing accordion for them in the facility's dining room was Billy Joel. ""That's right, folks, the Piano Man himself will be playing all the hits that made him a global sensation!"" recreation coordinator Charles Milton said as polite applause followed the opening number, which according to Milton was probably ""Uptown Girl."" ""You said you liked him—right, Linda? And I can tell Marcella and Stanley are in a New York state of mind! What are you gonna do next, Billy? ""Allentown""? Or will it be ""Only The Good Die Young""? I hope everybody sticks around, because we've got Jimmy Buffett coming up next."" Milton went on to clarify that guest performers do not reflect the views of Golden Horizons Senior Care Center after the man said to be Billy Joel launched into an unexpected monologue about how Barack Obama was not born in the United States, receiving a standing ovation.",The Onion,2025-01-16T15:45:10+00:00,Local,Satire,https://theonion.com/nursing-home-told-man-playing-accordion-for-them-is-billy-joel/
How Mark Zuckerberg Is Making Meta More MAGA-Friendly,"Meta founder and CEO Mark Zuckerberg has made a major right-wing pivot, including adding Trump ally Dana White to the company's board and agreeing to cohost an inauguration reception. Here are the other changes Zuckerberg is implementing to make the tech company more MAGA-friendly. 12,000% more AI-generated images of a muscular Elon Musk shaking hands with John Wayne Lowering the age minimum on Facebook Dating to 9 Allowing open carry in the Meta food court Banning immigrants from stealing Americans' hard-earned Instagram likes Letting Don Jr. join any expectant mothers Facebook group he wants, no questions asked Adding two-way mirrors to all women's bathrooms More Instagram ads for tactical flashlights and divorce lawyers Encouraging more diverse perspectives on which races are inferior Restoring Confederate monuments that were taken down from Meta headquarters in 2021",The Onion,2025-01-16T16:20:27+00:00,News,Satire,https://theonion.com/how-mark-zuckerberg-is-making-meta-more-maga-friendly/
Michelle Obama Confirms She Will Skip Rest Of Decade,"WASHINGTON—Declining to attend any event or go anywhere at all until 2030, former first lady Michelle Obama confirmed Thursday that she would be skipping the rest of the decade. ""I've decided to just go ahead and excuse myself for the rest of the 2020s,"" said Obama, speaking to reporters through an intercom by the front door of her home in D.C.'s historic Kalorama neighborhood. ""If Barack wants to go to this or that event, he is of course free to do so—butme? Hell no. I can't take another second of this shit. I won't be making any appearances, public or private. No, no, no. Fuck that."" Reached for further comment, Obama acknowledged she had already inked a multimillion-dollar deal with Netflix to make a documentary about her life ""sitting on [her] ass reading a book"" for the next several years.",The Onion,2025-01-16T19:23:21+00:00,News,Satire,https://theonion.com/michelle-obama-confirms-she-will-skip-rest-of-decade/
Kendrick Lamar Hit With Drive-By Summons Outside L.A. Nightclub,"LOS ANGELES—In a chaotic scene that saw young people screaming and ducking for cover in the moments after the hip-hop star was served from a passing vehicle, witnesses confirmed Thursday morning that Kendrick Lamar had been hit with a drive-by summons outside an L.A. nightclub. ""It all happened so fast—one minute Kendrick was standing around talking with his friends, and the next he was on the ground with a stack of papers covering his chest,"" said club owner Mark Rogers, noting that when they saw its tinted window rolling down, Lamar's bodyguards dove in front of the black Escalade that delivered the documents, but they were unable to prevent the ""Not Like Us"" rapper from receiving the notice to appear in court. ""I always get a bad feeling when I see rappers hanging around my club with highly paid lawyers, because it seems like the lawsuits and countersuits could break out at any moment. I just wish they could make music in peace without fear of legal action."" At press time, security was said to have been tightened outside Drake's Toronto mansion following reports that attorneys from a white-shoe law firm had been spotted in the neighborhood.",The Onion,2025-01-16T20:40:19+00:00,Entertainment,Satire,https://theonion.com/kendrick-lamar-hit-with-drive-by-summons-outside-l-a-nightclub/
Biden Batted Around By Giant Cat,"WASHINGTON—Watching in horror as the hulking feline pounced on the commander-in-chief scampering across the White House lawn, officials confirmed Friday that President Joe Biden was batted around by a relentless giant cat. ""Hey, kitty, kitty—please, no!"" said Biden, who looked desperately over his shoulder in search of his Secret Service detail and yelped out in fear as the stray domestic shorthair lifted its paw and smacked him, which sent his 82-year-old body spinning high into the air and pinwheeling across the grass. ""Someone, anyone, get it off me! Dear Lord. Is this how it ends? Is this my legacy? No, kitty! Not my neck!"" At press time, a White House groundskeeper was seen shooing the cat away with a rake.",The Onion,2025-01-17T16:38:24+00:00,News,Satire,https://theonion.com/biden-batted-around-by-giant-cat/
City Zoo Scrambles To Hide Animals Ahead Of Landlord Visit,"SAN DIEGO—As they shooed a herd of giraffes into a nearby bathroom, workers told reporters Friday that they were frantically scrambling to hide all of the San Diego Zoo's animals ahead of a visit from the landlord. ""He texted an hour ago saying he was dropping in to check the garbage disposal, so we've been running around cleaning up evidence of the 12,000 rare and endangered animals we've got living here,"" senior zookeeper Allison Weepie said while lighting a scented candle to cover the stench of snakes, Gila monsters, and tortoises in the reptile exhibit. ""The lease says we're allowed to have a cat, but it requires a $500 pet fee, which, you know, fuck that. I'm gonna turn up the volume on a nature documentary to drown out all the screaming macaques and parrots. Next we gotta throw tarps over the lions and sweep up the hundreds of pounds of rhino dung. As for the pandas, I'm just gonna tell him we're pet-sitting for the neighbors."" At press time, workers were overheard explaining to the landlord that the colony of penguins marching through the property were legally protected service animals.",The Onion,2025-01-17T16:40:49+00:00,Local,Satire,https://theonion.com/city-zoo-scrambles-to-hide-animals-ahead-of-landlord-visit/
Pros And Cons Of Buying Greenland,"President-elect Donald Trump has expressed his interest in buying Greenland, an idea he first floated back in 2019.The Onionexamines the pros and cons of the U.S. acquiring the country. PRO: New Indigenous people to wrong CON: Feels immoral to do anything that makes the Danes richer PRO: Would increase domestic supply of ice caps to melt CON: Full of foreigners PRO: Would make Alaska jealous CON: The Great American Melting Pot is still adjusting to the Scots-Irish PRO: Can finally sate America's appetite for pickled fish CON: 51 stars is a little gaudy, don't you think? PRO: Immigrant camps have to go somewhere CON: Vacation to Greenland no longer considered exotic PRO: USA! USA! USA! CON: Björk from Iceland",The Onion,2025-01-17T16:59:14+00:00,News,Satire,https://theonion.com/pros-and-cons-of-buying-greenland/
"Egyptologists Unearth Depictions Of Simple Ramps, Levers Aliens Used To Build Pyramids ","CAIRO—Finally solving the mystery of how such architectural wonders could have been built with primitive tools in ancient times, Egyptologists from Cambridge University announced Thursday that they had unearthed depictions of the simple ramps and levers that aliens used to build the pyramids at Giza. ""Shortly after traveling to Earth in their quantum-drive spaceships, extraterrestrials must have unloaded the ropes, inclined planes, and primitive copper tools we see pictured here,"" Professor Giles Egerton said as he pointed to the ancient hieroglyphs etched into a newly discovered limestone tablet, adding that the skeptics who doubted the ancient Egyptians' ability to erect the pyramids without alien assistance had been vindicated. ""Looking back now, it's laughable to think we once seriously considered that Egyptians in 2500 B.C. might have had the means to build these structures on their own. This ancient mystery can be neatly explained by a few simple machines and the intense physical labor of tens of thousands of invading alien troops."" Going on to acknowledge the genuine achievements of ancient Egyptians, Egerton noted that these Bronze Age humans had succeeded in using gravity cannons and proton rays to build the Great Sphinx in a single afternoon.",The Onion,2025-01-17T21:26:12+00:00,News,Satire,https://theonion.com/egyptologists-unearth-depictions-of-simple-ramps-levers-aliens-used-to-build-pyramids/
Revelations From Pope Francis’s New Memoir,"Pope Francis has published his memoir,Hope, making him the first pope to publish an autobiography. Here are the biggest revelations from the new release: Became interested in Catholicism after getting possessed by the devil as a child Began career as an executive assistant to the angel Gabriel Crashed the popemobile into a 7-Eleven the first time he tried to drive it Honestly gets pretty weirded out by adult converts Has lip-synced dozens of homilies over a backing track Regrets picking papal name Francis instead of much cooler name like Ryder The best advice God ever gave him was ""consider becoming the pope"" Shares his secret recipe for Hatch chile infused-communion wafers Accidentally converted to Judaism in 2002",The Onion,2025-01-20T13:00:00+00:00,News,Satire,https://theonion.com/revelations-from-pope-franciss-new-memoir/
Elon Musk Holds Up AI Girlfriend App So She Can See,"WASHINGTON—Wanting to ensure his closest companion in the world got a good view of the inauguration proceedings, Elon Musk held up his AI girlfriend app so she could see, sources confirmed Monday. ""Take it all in, Jasmine, my sweet—this is a day we'll tell our children about,"" Musk said as he slowly panned his phone's front camera across the throngs of onlookers, occasionally tilting the screen so he could glimpse the amazement playing over Jasmine's unnaturally glossy features. Bystanders reported that the virtual companion—who had been generated from the keywords 'White, Busty, Obedient, Redhead'—then began glitching in a way that made her appear as a set of floating teeth and eyeballs, prompting Musk to relaunch the app and gently chide her for not behaving herself in front of his very good friend, the president. At press time, the pair had reportedly gotten into a blowout fight after Jasmine intercepted an anatomically impossible nude from one of Musk's other girlfriend apps.",The Onion,2025-01-20T14:00:00+00:00,News,Satire,https://theonion.com/elon-musk-holds-up-ai-girlfriend-app-so-she-can-see/
"Man Feels Like Whole Life Just Endless Cycle Of Work, Eat, Sleep, Get Abducted By Aliens","CLEVELAND—Bemoaning the exhausting pattern into which his existence seemed to have fallen, local man Matthew Taylor told reporters Wednesday that he felt like his whole life was just an endless cycle of working, eating, sleeping, getting abducted by aliens, and then going to work again. ""Pretty much every day I roll out of bed, eat breakfast, head to the office, get beamed aboard the Kluforian mothership for medical analysis, and then go home—like, is this the rest of my life?"" said Taylor, who sighed as he imagined the decades slipping away with week after week of drinking his morning coffee, leaving for the office grind, getting anally probed during his lunch break, sitting in on sales meetings, and then falling asleep after a few hours of bad TV and possibly more anal probing if the Grand Katarka Simblian Vinaroon demanded it. ""It's just this endless rigamarole of getting stuck in traffic, making small talk with coworkers, waking up on a table as a hooded extraterrestrial peels open my abdomen with a plasmoid scalpel, heating up another lousy frozen meal, and shoveling it in my face. Sheesh. At some point you have to ask yourself: What does this all add up to?"" Taylor concluded that his only hope was that his existence served some higher purpose that he was unaware of, but that the invading Garacean-13 galactic fleet understood perfectly.",The Onion,2025-02-26T14:00:00+00:00,News,Satire,https://theonion.com/man-feels-like-whole-life-just-endless-cycle-of-work-eat-sleep-get-abducted-by-aliens/
Forgetful Man Playing Fast And Loose With Free Trials,"OAK PARK, IL—Paying no mind to his forgetful nature and instead lending a fancy free, devil-may-care attitude toward his tendency to sign up for promotional offers, area man Ben Cameron was playing it fast and loose this week with his free trials for numerous subscription-based services. ""Yeah, why not? I'll try FUBI. It's free for the first month, so I'll just cancel after the trial runs out,"" said Cameron, whose goldfish-like memory rendered him completely ignorant to the fact that he had already forgotten to cancel previous free trials for GameFly, Paramount+, Peacock, and several others, despite the steady stream of automatic monthly payments continually withdrawn from his checking account. ""It's my way of gaming the system—why would I pay for Audible premium when I can just listen to all the audiobooks I want for one month, then cancel without ever paying a dime? I just set a reminder in my calendar to cancel it after a month. Anyone who pays for this stuff when they sign up is a sucker."" At press time, Cameron was baffled to discover that he already had an email account associated with AppleTV+, for which he'd been charged the past eight months.",The Onion,2025-02-19T15:54:25+00:00,Local,Satire,https://theonion.com/forgetful-man-playing-fast-and-loose-with-free-trials/
It Almost Weirder That Grown Man On Roblox Isn’t Grooming Children,"SEATTLE—Voicing concern about the adult's aberrant behavior, sources confirmed Monday that it was almost weirder that Richard Shea, a grown man on Roblox, wasn't using the online gaming platform to groom children. ""If he was on here trying to find underage players and lure them into some sort of sexual relationship, that would be super fucked-up, but at least it would explain his reasons for spending hours each day playing virtual experiences designed by children. This guy isn't a predator, though,"" said Roblox player Mason Briggs, 11, telling reporters that the fact that there was no sinister sexual motivation behind Shea's dogged pursuit of high scores on games such asBlox FruitsandBedWarsand that he seemed to play only for fun was bizarre and inexplicable. ""I remember he invited me and a few friends to an in-game party where we could all play and communicate together. He never pressured us to reveal contact information or made any sort of inappropriate or explicit remark. He mostly just wanted tips on how to make it through the Ancient Ruins map onAdopt Me!It kind of gave me the creeps."" At press time, Briggs was reportedly all the more disturbed after receiving a private message from Shea informing her that he'd have even more time to play now that he had received tenure.",The Onion,2025-02-17T14:00:00+00:00,Local,Satire,https://theonion.com/it-almost-weirder-that-grown-man-on-roblox-isnt-grooming-children/
Scientists Confirm Shingleback Lizards Only Reptiles That Mate For Sake Of Aging Mothers,"ITHACA, NY—Noting that the evolutionary quirk results in plenty of familial strife, herpetologists at Cornell University confirmed Tuesday that shingleback lizards are the only reptiles that mate for the sake of their aging mothers. ""Unlike other lizards, the shingleback seeks out a partner to reproduce with as a means to stop the constant haranguing from its mother,"" lead researcher Alonso Gentry told reporters, adding that the short-tailed reptiles most often find a suitable mate via dates set up by their mothers. ""A shingleback lizard may be single for years, despite its mother's objections, but eventually it gets sick of hearing about how she'll die of a broken heart if she doesn't get grandbabies soon. The lizard is then likely to enter into a relationship that may not be healthy just to stop the complaining. A few months later, it gives birth to its offspring and is saddled with a deep bitterness that its life is over."" Gentry went on to add that shinglebacks have the highest suicide rate of any lizard species.",The Onion,2025-02-25T15:34:33+00:00,News,Satire,https://theonion.com/scientists-confirm-shingleback-lizards-only-reptiles-that-mate-for-sake-of-aging-mothers/
Elon Musk Holds Office-Wide Contest To Guess How Many Sperm In Cup,"WASHINGTON—In an attempt to raise morale by providing a fun yet challenging activity for employees of the U.S. DOGE Service, Elon Musk announced Monday a new office-wide contest to guess how many sperm were contained inside a cup placed on the front desk of the group's headquarters. ""Everyone take a good look, and no cheating! There might be more than you think!"" said Musk, speaking to his team at the Eisenhower Executive Office Building, where he kicked off the contest by holding the cup of sperm high in the air so everyone could get a good look before beginning to formulate their guesses. ""It'll be right here in the reception area so you can see it every day when you come in. You can pick up the cup and feel the weight of it, but no one is allowed to peer inside and count them with a microscope—I know it's tempting, but we don't want to ruin the fun. Just try your best to guess how many are swimming around in there, and at the end of the month, the winner will get a special prize. Won't that be fun?"" According to reports, Musk went on to strongly hint that the winning employee would be rewarded with a second cup of his sperm.",The Onion,2025-02-24T18:32:11+00:00,News,Satire,https://theonion.com/elon-musk-holds-office-wide-contest-to-guess-how-many-sperm-in-cup/
Rest Of Party Thanks Fucking God 2 Guys Who Like Etymology Found Each Other,"RALEIGH, NC—Breathing a sigh of relief as the pair of new acquaintances talked each other's ears off without any extra input, the rest of the people attending a party Thursday reportedly thanked fucking God that the two guys who liked etymology had found each other. ""I'm so glad Ian [Hawes] overheard Rob [Agundez] telling me where the word 'quarantine' comes from, because if I had to hear the goddamn term 'proto-European' one more time I was going to die of boredom,"" said party guest Vikki Engel, who described how the two linguistics enthusiasts had cordoned themselves off from everyone else and gotten progressively louder and more animated as they debated whether the word ""posh"" came from the first-class accommodations on early English cruise liners or not. ""It doesn't matter how many times you try and switch the topic to movies or local restaurants or whatever, because no matter what you talk about they are going to home in on some word you use. We're all just over here joking around about Minnie's shitty coworkers and counting our blessings that we don't have to know the symbolism of chrysanthemum or whatever the fuck... Oh shit, it looks like Ian just stormed off and Rob is headed back this way."" At press time, reports confirmed a half hour had passed since Engel had told Agundez she needed to get home to feed her dog, and he was still talking about the larger working canine breeds that had given rise to the word ""dog.""",The Onion,2025-02-26T14:00:00+00:00,Local,Satire,https://theonion.com/rest-of-party-thanks-fucking-god-2-guys-who-like-etymology-found-each-other/
Aliveness Of Baby Quintuple-Checked Before Texting New Parents Congratulations,"GREEN BAY, WI—In a comprehensive and thorough effort to ensure that nothing bad had happened, the aliveness of infant Liam Graham was reportedly quintuple-checked Tuesday before texting the new parents congratulations. ""I was about to pop off a quick text telling Amelia and Mike how happy I was for them, but then this wave of panic washed over me,"" said acquaintance Marcus Hill, echoing the sentiment of friends and family who were hesitant to offer well wishes on the off chance tragedy had struck in the interim between Amelia Graham's labor and the present. ""I don't want to be the person who sends a dozen baby emojis to a couple on the worst day of their lives. First I checked Instagram, but they hadn't posted any new pictures. Then I texted 'any update on mommy and baby?' to our mutual friend, but she just replied with a heart. That worried me, but finally I got an email inviting me to be part of a meal train for Amelia, Mike, and Liam, which gave me the confidence to send them a congratulatory message."" At press time, Hill was said to be googling how to unsend a text after seven hours with no response.",The Onion,2025-02-25T15:31:58+00:00,Local,Satire,https://theonion.com/aliveness-of-baby-quintuple-checked-before-texting-new-parents-congratulations/
